headline,date,doc_type,material_type,section,keywords,source,news_desk,word_count
Anna Sui: Spring 2020,2019-09-10,multimedia,Slideshow,,['New York Fashion Week'],The New York Times,Fashion & Style,0
"North Korea Launches 2 More Projectiles, Its 8th Weapons Test Since July",2019-09-10,article,News,,"['Missiles and Missile Defense Systems', 'Defense and Military Forces']",The New York Times,Foreign,756
Zero + Maria Cornejo: Spring 2020,2019-09-10,multimedia,Slideshow,,['New York Fashion Week'],The New York Times,Fashion & Style,0
"Amid Diplomatic Strain, House Opens Inquiry Into Trump’s Dealings With Ukraine",2019-09-10,article,News,,"['United States International Relations', 'United States Politics and Government', 'Presidential Election of 2016']",The New York Times,Washington,1262
N.R.A. Files Suit Against San Francisco,2019-09-10,article,News,,"['Gun Control', 'Suits and Litigation (Civil)', 'United States Politics and Government', 'Constitution (US)']",The New York Times,Business,423
Psst! Don’t Tell Trump,2019-09-10,article,Op-Ed,,"['United States International Relations', 'United States Politics and Government', 'Espionage and Intelligence Services', 'Classified Information and State Secrets']",The New York Times,OpEd,970
Daring Base Runner’s Goal,2019-09-10,article,News,,['Crossword Puzzles'],The New York Times,Games,964
David Ortiz Throws Out First Pitch at Fenway Park,2019-09-10,article,News,,['Baseball'],The New York Times,Sports,603
Cory Booker - Executive Power,2019-09-10,multimedia,Interactive Feature,,[],The New York Times,U.S.,0
Michael Bennet - Executive Power,2019-09-10,multimedia,Interactive Feature,,[],The New York Times,U.S.,0
Pete Buttigieg - Executive Power,2019-09-10,multimedia,Interactive Feature,,[],The New York Times,U.S.,0
Tulsi Gabbard - Executive Power,2019-09-10,multimedia,Interactive Feature,,[],The New York Times,U.S.,0
Amy Klobuchar - Executive Power,2019-09-10,multimedia,Interactive Feature,,[],The New York Times,U.S.,0
Marianne Williamson - Executive Power,2019-09-10,multimedia,Interactive Feature,,[],The New York Times,U.S.,0
Elizabeth Warren - Executive Power,2019-09-10,multimedia,Interactive Feature,,[],The New York Times,U.S.,0
Bernie Sanders - Executive Power,2019-09-10,multimedia,Interactive Feature,,[],The New York Times,U.S.,0
Beto O'Rourke - Executive Power,2019-09-10,multimedia,Interactive Feature,,[],The New York Times,U.S.,0
Kamala Harris - Executive Power,2019-09-10,multimedia,Interactive Feature,,[],The New York Times,U.S.,0
Joe Walsh - Executive Power,2019-09-10,multimedia,Interactive Feature,,[],The New York Times,U.S.,0
Bill Weld - Executive Power,2019-09-10,multimedia,Interactive Feature,,[],The New York Times,U.S.,0
Steve Bullock - Executive Power,2019-09-10,multimedia,Interactive Feature,,[],The New York Times,U.S.,0
Time Ryan - Executive Power,2019-09-10,multimedia,Interactive Feature,,[],The New York Times,U.S.,0
Joe Sestak - Executive Power,2019-09-10,multimedia,Interactive Feature,,[],The New York Times,U.S.,0
Commander in Chief Power - Executive Power,2019-09-10,multimedia,Interactive Feature,,[],The New York Times,U.S.,0
Military Force Against Americans - Executive Power,2019-09-10,multimedia,Interactive Feature,,[],The New York Times,U.S.,0
Presidential War Powers - Executive Power,2019-09-10,multimedia,Interactive Feature,,[],The New York Times,U.S.,0
Signing Statements - Executive Power,2019-09-10,multimedia,Interactive Feature,,[],The New York Times,U.S.,0
Obstruction of Justice - Executive Power,2019-09-10,multimedia,Interactive Feature,,[],The New York Times,U.S.,0
Presidential Indictability - Executive Power,2019-09-10,multimedia,Interactive Feature,,[],The New York Times,U.S.,0
Executive Secrecy - Executive Power,2019-09-10,multimedia,Interactive Feature,,[],The New York Times,U.S.,0
Press Freedoms - Executive Power,2019-09-10,multimedia,Interactive Feature,,[],The New York Times,U.S.,0
Post-Trump Reforms - Executive Power,2019-09-10,multimedia,Interactive Feature,,[],The New York Times,U.S.,0
Legal Advisers - Executive Power,2019-09-10,multimedia,Interactive Feature,,[],The New York Times,U.S.,0
Presidential Candor - Executive Power,2019-09-10,multimedia,Interactive Feature,,[],The New York Times,U.S.,0
Jon Ossoff Will Run for Senate in Georgia,2019-09-10,article,News,,"['Elections, Senate', 'United States Politics and Government']",The New York Times,Politics,598
Joe Biden - Executive Power,2019-09-10,multimedia,Interactive Feature,,[],The New York Times,U.S.,0
Executive Power Survey,2019-09-10,multimedia,Interactive Feature,,[],The New York Times,U.S.,0
Authorities Search California Offices of Boat Operator After Fire That Killed 34,2019-09-10,article,News,,"['Maritime Accidents and Safety', 'Search and Seizure', 'Diving and Divers', 'Boats and Boating', 'Fires and Firefighters']",The New York Times,Express,573
Tom Ford: Spring 2020,2019-09-10,multimedia,Slideshow,,['New York Fashion Week'],The New York Times,Fashion & Style,0
California Lawmakers Vote to Undo N.C.A.A. Amateurism,2019-09-10,article,News,,"['College Athletics', 'Politics and Government', 'State Legislatures', 'Law and Legislation', 'Basketball (College)', 'Football (College)', 'Colleges and Universities', 'Wages and Salaries']",The New York Times,Sports,1268
Saints Beat Texans on Last-Second 58-Yard Field Goal,2019-09-10,article,News,,['Football'],The New York Times,Sports,481
"Brexit, Russia, Italy: Your Tuesday Briefing",2019-09-10,article,briefing,,[],The New York Times,NYTNow,1286
When the C.I.A. Was Into Mind Control,2019-09-10,article,Review,,"['Books and Literature', 'Espionage and Intelligence Services', 'LSD (Lysergic Acid Diethylamide)']",The New York Times,BookReview,1315
Ban Flavored E-Cigarettes to Protect Our Children,2019-09-10,article,Op-Ed,,"['Smoking and Tobacco', 'E-Cigarettes', 'Teenagers and Adolescence', 'Addiction (Psychology)']",The New York Times,OpEd,891
"Quotation of the Day: Weary of War, but More Wary of the Taliban",2019-09-10,article,Quote,,[],The New York Times,Summary,50
"Corrections: September 10, 2019",2019-09-10,article,Correction,,[],The New York Times,Corrections,492
What’s on TV Tuesday: ‘Mr. Mercedes’ and ‘Hotel Mumbai’,2019-09-10,article,News,,"['Movies', 'Television']",The New York Times,Culture,472
"On Politics: For Sanders, It All Began in Canada",2019-09-10,article,News,,['United States Politics and Government'],The New York Times,Politics,429
Word + Quiz: internecine,2019-09-10,article,News,,[],The New York Times,Learning,184
"Only Trump Would Brag About Canceled Taliban Meeting, Jimmy Kimmel Says",2019-09-10,article,News,,[],The New York Times,Culture,741
Family Cooks,2019-09-10,article,News,,[],The New York Times,Learning,99
"A Fiji Junket, a Padlocked Office and a Pioneering Nonprofit’s Collapse",2019-09-10,article,News,,"['Nonprofit Organizations', 'Children and Childhood', 'Child Abuse and Neglect', 'Race and Ethnicity', 'Foster Care', 'Blacks', 'Black People']",The New York Times,Metro,1414
"A $1.7 Million Loan, $30,000 in Income. Prosecutors Are Now Investigating.",2019-09-10,article,News,,"['Taxicabs and Taxicab Drivers', 'Credit and Debt']",The New York Times,Metro,945
"Presidential Power Must Be Curbed After Trump, 2020 Candidates Say",2019-09-10,article,News,,"['Presidential Election of 2020', 'United States Politics and Government', 'War and Emergency Powers (US)', 'Presidents and Presidency (US)', 'Law and Legislation', 'Constitution (US)', 'Russian Interference in 2016 US Elections and Ties to Trump Associates', 'Prisoners of War']",The New York Times,Washington,1349
"After 9/11, Venice Feted Firefighters. The Party Is Still Going.",2019-09-10,article,News,,"['Fires and Firefighters', 'September 11 (2001)']",The New York Times,Metropolitan,928
Lesson of the Day: ‘6 Google Tricks That Will Turn You Into an Internet Detective’,2019-09-10,article,News,,[],The New York Times,Learning,445
A Drive to Recruit Transgender Police in India Raised Hopes — Then Dashed Them,2019-09-10,article,News,,"['Police', 'Transgender and Transsexuals']",The New York Times,Foreign,1468
"U.K. Parliament Closes, but Lawmakers Don’t Go Quietly",2019-09-10,article,News,,"['Politics and Government', 'Legislatures and Parliaments', 'Great Britain Withdrawal from EU (Brexit)']",The New York Times,Foreign,940
"New & Noteworthy, From Immigrant Writing to a New ‘Darkness at Noon’",2019-09-10,article,News,,['Books and Literature'],The New York Times,BookReview,369
Want to Do Business in Silicon Valley? Better Act Nice,2019-09-10,article,News Analysis,,"['Venture Capital', 'Start-ups', 'Computers and the Internet']",The New York Times,Styles,883
"‘The Undying,’ an Extraordinary and Furious New Memoir About Cancer",2019-09-10,article,Review,,"['Books and Literature', 'Cancer']",The New York Times,Culture,1054
How Parents Can Stay Close to Grown-Up Children,2019-09-10,article,News,,"['Parenting', 'Youth', 'Travel and Vacations', 'Families and Family Life', 'Road Trips']",The New York Times,Well,1203
I Was a Low-Income College Student. Classes Weren’t the Hard Part.,2019-09-10,multimedia,Interactive Feature,,"['Colleges and Universities', 'Income Inequality', 'Poverty', 'ADMISSIONS STANDARDS', 'Minorities']",The New York Times,Magazine,0
When Have You Either Forgiven Someone or Been Forgiven Yourself?,2019-09-10,article,News,,['Philosophy'],The New York Times,Learning,592
"The Obsession That Inspired Great Poetry, if Not Great Romance",2019-09-10,article,Review,,['Books and Literature'],The New York Times,BookReview,691
Moderate Democrats Fared Best in 2018,2019-09-10,article,News,,"['Midterm Elections (2018)', 'Elections, House of Representatives', 'United States Politics and Government', 'Voting and Voters']",The New York Times,Upshot,1082
"While You’re Waiting for the Next Hilary Mantel, Try Andrew Miller",2019-09-10,article,Review,,['Books and Literature'],The New York Times,BookReview,1200
The Great Art Stolen by Hitler,2019-09-10,article,Review,,"['Arts and Antiquities Looting', 'Holocaust and the Nazi Era', 'Books and Literature']",The New York Times,BookReview,746
Inside the Minds of the Women Who Joined ISIS,2019-09-10,article,Review,,"['Books and Literature', 'Women and Girls', 'Muslims and Islam']",The New York Times,BookReview,1330
The Persistence of the Oldest Hatred,2019-09-10,article,Review,,['Books and Literature'],The New York Times,BookReview,1230
Was Michael Bloomberg New York City’s Greatest Mayor?,2019-09-10,article,Review,,"['Books and Literature', 'Mayors']",The New York Times,BookReview,1326
‘The Institute’ Might Be Stephen King’s Scariest Novel Yet,2019-09-10,article,Review,,['Books and Literature'],The New York Times,BookReview,1294
"From the Author of ‘Room,’ Another Bittersweet Family Novel",2019-09-10,article,Review,,['Books and Literature'],The New York Times,BookReview,1216
‘This Is the Most Lonesome Job’: Ride With a ‘Hot Shot’ Oilfield Trucker in Texas,2019-09-10,multimedia,Interactive Feature,,"['Trucks and Trucking', 'Oil (Petroleum) and Gasoline']",The New York Times,Business Day,0
What College Admissions Offices Really Want,2019-09-10,multimedia,Interactive Feature,,"['ADMISSIONS STANDARDS', 'Colleges and Universities', 'Financial Aid (Education)', 'SAT (College Admission Test)', 'Tuition']",The New York Times,Magazine,0
Is Global Warming the 21st Century’s Black Death?,2019-09-10,article,Review,,['Books and Literature'],The New York Times,BookReview,610
"Contemporary American Angst, in a Single, Thousand-Page Sentence",2019-09-10,article,Review,,['Books and Literature'],The New York Times,BookReview,614
Malcolm Gladwell’s Advice When ‘Talking to Strangers’: Be Careful,2019-09-10,article,Review,,['Books and Literature'],The New York Times,BookReview,1208
Letter of Recommendation: Golfing With Strangers,2019-09-10,article,News,,['Golf'],The New York Times,Magazine,1017
"Dr. Livingstone, We Presume?",2019-09-10,article,Review,,['Books and Literature'],The New York Times,BookReview,1228
Is It O.K. if College Students Hire Me to Revise Their Papers?,2019-09-10,article,News,,"['Education (K-12)', 'Colleges and Universities', 'Respiratory Diseases', 'Tutors and Tutoring']",The New York Times,Magazine,1628
Is Meritocracy to Blame for Our Yawning Class Divide?,2019-09-10,article,Review,,"['Books and Literature', 'Equal Educational Opportunities', 'ADMISSIONS STANDARDS', 'Colleges and Universities', 'Income Inequality']",The New York Times,BookReview,1335
What Samantha Power Learned on the Job,2019-09-10,article,Review,,"['Books and Literature', 'United States International Relations', 'United States Politics and Government', 'War Crimes, Genocide and Crimes Against Humanity']",The New York Times,BookReview,2076
The Secret to Success Academy’s Top-Notch Test Scores,2019-09-10,article,Review,,"['Books and Literature', 'Tests and Examinations', 'Education (K-12)', 'Charter Schools']",The New York Times,BookReview,1345
Recent Commercial Real Estate Transactions,2019-09-10,article,News,,"['Real Estate (Commercial)', 'Real Estate and Housing (Residential)']",The New York Times,Business,232
My Best Friend Died by Suicide. I Wish I Had Seen the Warning Signs.,2019-09-10,article,News,,"['United States Defense and Military Forces', 'Veterans', 'Suicides and Suicide Attempts', 'Post-Traumatic Stress Disorder', 'Mental Health and Disorders', 'Iraq War (2003-11)']",The New York Times,Magazine,1746
"Seeking an Obesity Cure, Researchers Turn to the Gut Microbiome",2019-09-10,article,News,,"['Obesity', 'Feces', 'Digestive Tract', 'Transplants', 'Liver', 'Weight', 'Bacteria', 'Infections']",The New York Times,Well,1287
Republican Gerrymander Whiz Had Wider Influence Than Was Known,2019-09-10,article,News,,['Redistricting and Reapportionment'],The New York Times,National,1574
Turkey’s Radical Plan: Send a Million Refugees Back to Syria,2019-09-10,article,News,,"['Refugees and Displaced Persons', 'Politics and Government', 'United States International Relations']",The New York Times,Foreign,1569
Can the Kings Be TV’s Next Super Producers?,2019-09-10,article,News,,['Television'],The New York Times,Arts&Leisure,1699
"A Houston Activist Invited ICE to a Community Meeting. Now, He Faces Deportation.",2019-09-10,article,News,,"['Illegal Immigration', 'Immigration and Emigration', 'Deportation', 'Immigration Detention', 'Hispanic-Americans', 'United States Politics and Government']",The New York Times,Express,946
"To Cover Scooter Disruption, Take the Ride",2019-09-10,article,News,,"['Start-ups', 'Motorcycles, Motor Bikes and Motorscooters', 'Traffic Accidents and Safety']",The New York Times,Summary,751
"Joaquin Phoenix, the Wild Card of ‘Joker’",2019-09-10,article,News,,['Movies'],The New York Times,NYTI,2451
"Beautiful, Remote and So Instagrammable. Can the Azores Manage Popularity?",2019-09-10,article,News,,"['Travel and Vacations', 'Islands', 'Eco-Tourism', 'Dolphins and Porpoises']",The New York Times,Travel,2135
Spelling Their Way to Success,2019-09-10,article,News,,"['Spelling', 'Scripps National Spelling Bee']",The New York Times,Express,1363
A Neutral Middle Ground on the Upper East Side,2019-09-10,multimedia,Slideshow,,"['Interior Design and Furnishings', 'Home Repairs and Improvements', 'Furniture', 'Real Estate and Housing (Residential)']",The New York Times,Real Estate,0
"Isabelle Huppert, Mon Amour",2019-09-10,article,News,,"['Movies', 'ACTORS AND ACTRESSES']",The New York Times,Arts&Leisure,0
Designing a Home and a Marriage,2019-09-10,article,News,,"['Real Estate and Housing (Residential)', 'Interior Design and Furnishings', 'Home Repairs and Improvements', 'Furniture']",The New York Times,RealEstate,862
Are New Yorkers Fleeing the City?,2019-09-10,article,briefing,,['Population'],The New York Times,Metro,897
The Row: Spring 2020,2019-09-10,multimedia,Slideshow,,['New York Fashion Week'],The New York Times,Fashion & Style,0
"Britain, Juul, National Rifle Association: Your Tuesday Briefing",2019-09-10,article,briefing,,[],The New York Times,NYTNow,1387
DealBook Briefing: Pressure Builds on WeWork to Delay Its I.P.O.,2019-09-10,article,News,,['Initial Public Offerings'],The New York Times,Business,2054
Elizabeth Warren Continues to Persist,2019-09-10,article,Op-Ed,,"['United States Politics and Government', 'Presidential Election of 2020']",The New York Times,OpEd,1203
Can the Right Escape Racism?,2019-09-10,article,Op-Ed,,"['Conservatism (US Politics)', 'Race and Ethnicity']",The New York Times,OpEd,1746
A Historic Peace Plan Collapses,2019-09-10,article,News,,['Terrorism'],The New York Times,Podcasts,284
The Republican Party Is Doomed,2019-09-10,article,Op-Ed,,"['Presidential Election of 2016', 'United States Politics and Government', 'Tea Party Movement', 'Midterm Elections (2018)', 'Immigration and Emigration', 'Presidential Election of 2020', 'Voting and Voters']",The New York Times,OpEd,1902
"How Canadians Raised Millions to Save 2,000 Pristine Acres",2019-09-10,article,News,,"['Philanthropy', 'Crowdsourcing (Internet)', 'Land Use Policies', 'Wilderness Areas', 'Parks and Other Recreation Areas']",The New York Times,Express,905
I Work for N.S.A. We Cannot Afford to Lose the Digital Revolution.,2019-09-10,article,Op-Ed,,"['Computers and the Internet', 'Cyberwarfare and Defense', 'Surveillance of Citizens by Government', 'United States Defense and Military Forces', 'Computer Security', 'Data-Mining and Database Marketing', 'General Data Protection Regulation (GDPR)', 'Espionage and Intelligence Services', 'Innovation', 'United States Politics and Government']",The New York Times,OpEd,6106
"China’s Pork Prices Soar, Adding to Beijing’s Troubles",2019-09-10,article,News,,"['Pigs', 'Pork', 'Economic Conditions and Trends', 'Agriculture and Farming', 'Livestock', 'Prices (Fares, Fees and Rates)', 'Infections', 'Supermarkets and Grocery Stores', 'Customs (Tariff)', 'International Trade and World Market']",The New York Times,Business,1033
"Rocking Out in Lederhosen, With a Hint of Populism",2019-09-10,article,News,,"['Folk Music', 'Pop and Rock Music', 'Fringe Groups and Movements', 'Politics and Government']",The New York Times,Culture,1104
"Weekly News Quiz For Students: Hurricane Dorian, Brexit, U.S. Open",2019-09-10,multimedia,Interactive Feature,,[],The New York Times,The Learning Network,0
"Wilbur Ross, Back to Back",2019-09-10,article,Op-Ed,,"['United States Politics and Government', 'Rumors and Misinformation', 'Census', 'Government Employees', 'Appointments and Executive Changes', 'Hurricane Dorian (2019)', 'Social Media']",The New York Times,OpEd,671
"Elizabeth Warren, Fashion Muse?",2019-09-10,article,Review,,"['Fashion and Apparel', 'your-feed-fashion', 'New York Fashion Week']",The New York Times,Styles,770
Robert Frank Dies; Pivotal Documentary Photographer Was 94,2019-09-10,article,Obituary (Obit),,"['Photography', 'Deaths (Obituaries)', 'Art']",The New York Times,Obits,2130
It’s Horses vs. Motors in Senegal. The Steeds Still Win on Many Roads.,2019-09-10,article,News,,"['Pedicabs and Rickshaws', 'Taxicabs and Taxicab Drivers', 'Transportation']",The New York Times,Foreign,988
Fall Fashion Takes It Easy,2019-09-10,article,News,,[],The New York Times,TStyle,43
"A Dying Town, a Crumbling Hotel and the Water That Could Restore Both",2019-09-10,article,News,,"['Hotels and Travel Lodgings', 'Area Planning and Renewal', 'Real Estate (Commercial)']",The New York Times,Business,1273
How a 100-Year-Old Family Cheese Company Makes Its Whey in Modern Times,2019-09-10,article,briefing,,"['Cheese', 'Family Business']",The New York Times,National,1241
A Novel Gun Control Strategy: Pressure Banks and Retailers,2019-09-10,article,News,,"['Gun Control', 'Firearms', 'Executive Orders and Memorandums', 'Government Contracts and Procurement', 'Banking and Financial Institutions', 'Shopping and Retail']",The New York Times,Metro,1245
A Weekly Report From Afghanistan That Takes a Toll,2019-09-10,article,News,,"['Afghanistan War (2001- )', 'Civilian Casualties', 'Deaths (Fatalities)']",The New York Times,Insider,780
"Dan Bishop, North Carolina Republican, Wins Special Election",2019-09-10,article,News,,"['Elections, House of Representatives', 'Midterm Elections (2018)', 'United States Politics and Government']",The New York Times,Politics,1657
"E.U. Leadership Shake Up: The Most Consequential, and Controversial, Things to Know",2019-09-10,article,News,,"['Defense and Military Forces', 'Immigration and Emigration']",The New York Times,Foreign,1056
"After Sept. 11, Twin Towers Onscreen Are a Tribute and a Painful Reminder",2019-09-10,article,News,,"['September 11 (2001)', 'World Trade Center (Manhattan, NY)', 'Movies', 'Television', 'Terrorism']",The New York Times,Culture,1327
Sarah Jessica Parker and Matthew Broderick Are Returning to Broadway,2019-09-10,article,News,,"['Theater', 'Television']",The New York Times,Culture,816
"How to Create a Laid-Back, CBD-Infused Dinner Party",2019-09-10,article,News,,"['Tables', 'Cooking and Cookbooks', 'Parties (Social)']",The New York Times,TStyle,972
Jack Ma Is Retiring From Alibaba. He Won’t Go Far.,2019-09-10,article,News,,"['Appointments and Executive Changes', 'E-Commerce']",The New York Times,Business,688
Texas Monthly Creates a Tempting Job: Taco Editor,2019-09-10,article,News,,"['Tacos', 'Magazines', 'Appointments and Executive Changes']",The New York Times,Dining,657
Share of Americans With Health Insurance Declined in 2018,2019-09-10,article,News,,"['Health Insurance and Managed Care', 'Patient Protection and Affordable Care Act (2010)', 'United States Economy', 'Income Inequality', 'Poverty', 'United States Politics and Government']",The New York Times,Business,1596
Ask the Authors of ‘How to Raise a Reader’ Your Questions,2019-09-10,article,News,,[],The New York Times,Parenting,103
Senate Democrats Try to Corner Republicans on Border Emergency,2019-09-10,article,News,,"['United States Politics and Government', 'Border Barriers']",The New York Times,Washington,1180
‘Psychic’ Who Promised to Lift Curse Gets Prison Time,2019-09-10,article,News,,"['Psychics and Fortune Tellers', 'Frauds and Swindling']",The New York Times,Express,684
What the Hapsburg Empire Got Right,2019-09-10,article,Op-Ed,,"['World War I (1914-18)', 'Royal Families', 'Treaties', 'Politics and Government']",The New York Times,OpEd,1896
"Mugabe Is Dead, but Big Man Politics Lives On",2019-09-10,article,Op-Ed,,"['Land Use Policies', ""Coups D'Etat and Attempted Coups D'Etat""]",The New York Times,OpEd,1288
"Scientists Find the Skull of Humanity’s Ancestor, on a Computer",2019-09-10,article,News,,"['Paleontology', 'Skull (Body Part)', 'Fossils', 'Neanderthal Man', 'Evolution (Biology)', 'your-feed-science']",The New York Times,Science,996
Lasker Awards Honor Advances in Modern Immunology,2019-09-10,article,News,,"['Lasker Awards', 'Breast Cancer', 'Vaccination and Immunization', 'Immune System', 'Children and Childhood', 'your-feed-science', 'Herceptin (Drug)', 'Third World and Developing Countries', 'Lymph Nodes and Lymphatic System', 'Genetics and Heredity', 'Thymus Gland', 'Philanthropy', 'Drugs (Pharmaceuticals)', 'Tumors', 'Nonprofit Organizations', 'Cancer', 'Chemotherapy', 'Genetic Engineering', 'Public-Private Sector Cooperation']",The New York Times,Science,1367
What Painting With Your Feet Does to Your Brain,2019-09-10,article,News,,"['Art', 'Brain', 'Mouth', 'Feet', 'Thalidomide (Drug)', 'Birth Defects', 'your-feed-health', 'your-feed-science']",The New York Times,Science,816
New Electric Eel Is Most Shocking Yet,2019-09-10,article,News,,"['Eels', 'Biodiversity', 'Animal Behavior', 'Electric Light and Power', 'Genetics and Heredity', 'your-feed-science']",The New York Times,Science,796
You Can’t Go to College With Your Kid. But You Can Pretend on Facebook.,2019-09-10,article,News,,"['Colleges and Universities', 'Fraternities and Sororities', 'Parenting', 'Social Media', 'Dormitories']",The New York Times,Styles,1571
Huawei Has a Plan to Help End Its War With Trump,2019-09-10,article,Op-Ed,,"['5G (Wireless Communications)', 'International Trade and World Market', 'Industrial Espionage']",The New York Times,OpEd,1478
A Family’s Dedication to Beef Lives On at Don Julio in Buenos Aires,2019-09-10,article,News,,"['Restaurants', 'Meat', 'Beef', 'Grilling (Cooking)']",The New York Times,Dining,1196
Jennifer Lopez Answers Your Questions on Persevering and More,2019-09-10,article,News,,"['Movies', 'Toronto International Film Festival']",The New York Times,Culture,975
Pelosi Energizes Battle to Lower Drug Prices,2019-09-10,article,News,,"['United States Politics and Government', 'Drugs (Pharmaceuticals)', 'Prices (Fares, Fees and Rates)', 'Law and Legislation', 'Medicare', 'your-feed-healthcare']",The New York Times,Washington,1264
Press B3 to Be Mine (With a Vending-Machine Engagement Ring),2019-09-10,article,News,,"['Jewels and Jewelry', 'Vending Machines', 'Diamonds', 'Dating and Relationships']",The New York Times,Styles,700
"Ceviche, Pisco and Other Peruvian Favorites on the Upper East Side",2019-09-10,multimedia,Slideshow,,['Restaurants'],The New York Times,Food,0
"Peruvian Ceviche, Now With Plates and Chairs",2019-09-10,article,Review,,"['Restaurants', 'Seafood']",The New York Times,Dining,1124
How to Help Your Child Succeed at School,2019-09-10,multimedia,Interactive Feature,,"['Children and Childhood', 'Education', 'Teachers and School Employees']",The New York Times,Smarter Living,0
"Netanyahu, Facing Tough Israel Election, Pledges to Annex a Third of West Bank",2019-09-10,article,News,,"['Elections', 'Politics and Government', 'Palestinians', 'United States International Relations']",The New York Times,Foreign,1466
