headline,date,doc_type,material_type,section,keywords,source,news_desk,word_count
How Could Travel Giant Thomas Cook Fail?,2019-09-23,article,News,,"['Credit and Debt', 'Bankruptcies', 'Great Britain Withdrawal from EU (Brexit)', 'Travel and Vacations', 'Travel Agencies and Agents', 'Hotels and Travel Lodgings']",The New York Times,Travel,1626
The Baltimore Symphony Brings Back Its Musicians,2019-09-23,article,News,,"['Classical Music', 'Labor and Jobs']",The New York Times,Culture,391
Republicans Only Pretend to Be Patriots,2019-09-23,article,Op-Ed,,"['United States Politics and Government', 'Ethics and Official Misconduct']",The New York Times,OpEd,886
"Greta Thunberg, Ukraine, Emmys: Your Monday Evening Briefing",2019-09-23,article,briefing,,[],The New York Times,NYTNow,1018
"Christopher Rouse, Composer of Rage and Delicacy, Dies at 70",2019-09-23,article,Obituary (Obit),,"['Classical Music', 'Grammy Awards', 'Pulitzer Prizes', 'Deaths (Obituaries)']",The New York Times,Obits,1206
Agriculture Department Flooded With Appeals to Stop Food Stamp Purge,2019-09-23,article,News,,"['United States Politics and Government', 'Food Stamps', 'Poverty', 'Welfare (US)']",The New York Times,Washington,966
"Health Experts Fight Ebola in Congo, and Each Other",2019-09-23,article,News,,"['Epidemics', 'Ebola Virus', 'Vaccination and Immunization', 'your-feed-science']",The New York Times,Science,882
"In the Ivy League, Football Season Is Finally Here",2019-09-23,article,News,,['Football (College)'],The New York Times,Sports,1242
"Oil Giants, Under Fire From Climate Activists and Investors, Mount a Defense",2019-09-23,article,News,,"['Global Warming', 'Greenhouse Gas Emissions', 'Oil (Petroleum) and Gasoline', 'Carbon Capture and Sequestration', 'Natural Gas', 'Carbon Caps and Emissions Trading Programs', 'Alternative and Renewable Energy', 'United Nations Framework Convention on Climate Change', 'Energy and Power', 'Regulation and Deregulation of Industry']",The New York Times,Climate,1274
Gov. Gavin Newsom Says Horse Racing in California Needs Reform,2019-09-23,article,News,,"['Horse Racing', 'Justify (Race Horse)']",The New York Times,Sports,657
Where Have We Seen This Before?,2019-09-23,article,News,,"['Presidential Election of 2020', 'United States Politics and Government', 'Trump-Ukraine Whistle-blower Complaint and Impeachment Inquiry']",The New York Times,Politics,1223
What Victims’ Families Think of the Whitey Bulger Wrongful Death Claim,2019-09-23,article,News,,"['Organized Crime', 'Prisons and Prisoners', 'Murders, Attempted Murders and Homicides', 'Suits and Litigation (Civil)']",The New York Times,National,1143
Autoworkers Face a Tough Road Ahead,2019-09-23,article,Op-Ed,,"['Automobiles', 'Strikes', 'Labor and Jobs', 'Wages and Salaries']",The New York Times,OpEd,810
"Federer and Nadal Make Laver Cup Shine, for Now, on a Crowded Calendar",2019-09-23,article,News,,['Tennis'],The New York Times,Sports,1207
Orlando Officer Is Terminated After Arresting 6-Year-Olds,2019-09-23,article,News,,"['Decisions and Verdicts', 'Police Brutality, Misconduct and Shootings']",The New York Times,Express,688
Trump Is Accused of Inventing Tax Return ‘Privilege’ to Block Subpoena,2019-09-23,article,News,,"['Trump Tax Returns', 'Subpoenas']",The New York Times,Metro,829
Antonio Brown Saga Just Another Sign of the Patriot Way,2019-09-23,article,News,,"['Football', 'Sex Crimes']",The New York Times,Sports,1035
The Growing Threat to Journalism Around the World,2019-09-23,article,Op-Ed,,"['News and News Media', 'Freedom of the Press', 'Newspapers', 'Freedom of Speech and Expression', 'Assassinations and Attempted Assassinations', 'Political Prisoners', 'Kidnapping and Hostages']",The New York Times,OpEd,3268
Can Someone Be Fired for Being Gay? The Supreme Court Will Decide,2019-09-23,article,News,,"['Homosexuality and Bisexuality', 'Discrimination', 'Workplace Hazards and Violations', 'Transgender and Transsexuals']",The New York Times,Washington,1531
Islanders Break Ground on Arena at Belmont Park,2019-09-23,article,News,,"['Hockey, Ice', 'Building (Construction)']",The New York Times,Sports,523
"Instead of ‘No Collusion!’ Trump Now Seems to Be Saying, So What if I Did?",2019-09-23,article,News Analysis,,"['Trump-Ukraine Whistle-blower Complaint and Impeachment Inquiry', 'United States Politics and Government', 'Impeachment', 'Foreign Aid']",The New York Times,Washington,1488
The Math Says the Mets Are Alive. Common Sense Says They Aren’t.,2019-09-24,article,News,,['Baseball'],The New York Times,Sports,929
"Mr. Trump, Blow Us Away With Your Transparency",2019-09-24,article,Editorial,,"['Trump-Ukraine Whistle-blower Complaint and Impeachment Inquiry', 'Whistle-Blowers', 'Inspectors General', 'Foreign Aid', 'United States Politics and Government']",The New York Times,Editorial,869
U.S. Seeks More Sanctions on Venezuela’s Leaders and Faults Europe’s Inertia,2019-09-24,article,News,,"['United States International Relations', 'Embargoes and Sanctions', 'Human Rights and Human Rights Violations']",The New York Times,Foreign,764
This Knife Cuts Vegetables and More,2019-09-24,article,News,,"['Knives', 'Utensils and Cutlery']",The New York Times,Dining,166
Japanese Rice Fresh From the Source,2019-09-24,article,News,,"['Rice', 'Factories and Manufacturing']",The New York Times,Dining,144
A Pan for Just About Anything,2019-09-24,article,News,,"['Cookware', 'Cooking and Cookbooks']",The New York Times,Dining,169
A. Alvarez Dies at 90; Poet Elevated Both Sylvia Plath and Poker,2019-09-24,article,Obituary (Obit),,"['Poetry and Poets', 'World Series of Poker', 'Books and Literature', 'Suicides and Suicide Attempts', 'Writing and Writers', 'Deaths (Obituaries)']",The New York Times,Obits,1410
A Doughnut Six Years in the Making,2019-09-24,article,News,,['Doughnuts'],The New York Times,Dining,161
Bobby Flay’s New Book Is a Solid Weeknight Guide,2019-09-24,article,News,,['Cooking and Cookbooks'],The New York Times,Dining,163
"For a Cooking Corrective, Add Some Vinegar",2019-09-24,article,News,,"['Cooking and Cookbooks', 'Vinegar']",The New York Times,Dining,187
Rethinking Counterterrorism,2019-09-24,article,Op-Ed,,"['Terrorism', 'Mass Shootings', 'El Paso, Tex, Shooting (2019)', 'Fringe Groups and Movements', 'Whites']",The New York Times,Editorial,952
Russian Man Pleads Guilty in ‘Massive’ Hacking Scheme,2019-09-24,article,News,,"['Cyberattacks and Hackers', 'Computer Security', 'Securities and Commodities Violations', 'Banking and Financial Institutions', 'Stocks and Bonds', 'Gambling']",The New York Times,Express,538
"Review: For These African Immigrants, Life Is a Haunted House",2019-09-24,article,Review,,['Theater'],The New York Times,Culture,1058
Review: Being Young and Bored in a Book Club on ‘Sunday’,2019-09-24,article,Review,,['Theater'],The New York Times,Culture,861
Religious Symbol,2019-09-24,article,News,,['Crossword Puzzles'],The New York Times,Games,711
"Quotation of the Day: Tuesday, September 24, 2019",2019-09-24,article,Quote,,[],The New York Times,Summary,42
"Corrections: September 24, 2019",2019-09-24,article,Correction,,[],The New York Times,Corrections,193
"Your Tuesday Briefing: Thomas Cook, U.N. Climate, Labour",2019-09-24,article,briefing,,[],The New York Times,NYTNow,1422
"What Is the United Nations? Its History, Its Goals and Its Relevance",2019-09-24,article,News,,"['International Relations', 'Human Rights and Human Rights Violations', 'Humanitarian Aid', 'vis-multimedia']",The New York Times,Foreign,1184
Trump Administration Threatens to Cut U.S. Highway Funds From California,2019-09-24,article,News,,"['Global Warming', 'Environment', 'Greenhouse Gas Emissions', 'Carbon Dioxide', 'United States Politics and Government', 'Fuel Emissions (Transportation)', 'Air Pollution', 'Federal-State Relations (US)']",The New York Times,Climate,793
What’s on TV Tuesday: ‘Mixed-ish’ and ‘American Horror Story’,2019-09-24,article,News,,['Television'],The New York Times,Culture,490
The Future of Democracy in Tunisia,2019-09-24,article,Op-Ed,,"['Middle East and North Africa Unrest (2010- )', 'Legislatures and Parliaments', 'Demonstrations, Protests and Riots', 'Elections']",The New York Times,OpEd,1158
German Court Says a Hangover Is an Illness,2019-09-24,article,News,,['Oktoberfest'],The New York Times,Foreign,455
Word + Quiz: sororal,2019-09-24,article,News,,[],The New York Times,Learning,238
Late Night Calls Out Trump for Bringing Up Biden With Ukraine,2019-09-24,article,News,,"['Trump-Ukraine Whistle-blower Complaint and Impeachment Inquiry', 'Television']",The New York Times,Culture,730
Notes of Lavender,2019-09-24,article,News,,[],The New York Times,Learning,71
How One Address Led to a $100 Million Tax Credit Scheme,2019-09-24,article,News,,"['Relocation of Business', 'Real Estate (Commercial)', 'Tax Credits, Deductions and Exemptions', 'Frauds and Swindling']",The New York Times,Metro,1671
When Mac & Cheese and Ketchup Don’t Mix: The Kraft Heinz Merger Falters,2019-09-24,article,News,,"['Mergers, Acquisitions and Divestitures', 'Food']",The New York Times,Business,1340
Earthquake Strikes Off Puerto Rico’s Coast as Island Braces for Storm,2019-09-24,article,News,,"['Earthquakes', 'Weather']",The New York Times,Foreign,254
Kim Jong-un Visits South Korea? The South Says It Could Happen,2019-09-24,article,News,,"['United States International Relations', 'ARMS CONTROL AND LIMITATION AND DISARMAMENT', 'Nuclear Weapons', 'International Relations']",The New York Times,Foreign,723
A Man or a ‘Yellow Object’? Hong Kong Police Dispute Assault Allegations,2019-09-24,article,News,,"['Hong Kong Protests (2019)', 'Police Brutality, Misconduct and Shootings']",The New York Times,Express,914
‘Right to Be Forgotten’ Privacy Rule Is Limited by Europe’s Top Court,2019-09-24,article,News,,"['Privacy', 'Computers and the Internet', 'Search Engines']",The New York Times,Business,991
‘In Hoffa’s Shadow’ Details How a Famous Disappearance Hit Close to Home,2019-09-24,article,Review,,['Books and Literature'],The New York Times,Culture,1073
Lesson of the Day: ‘Birds Are Vanishing From North America’,2019-09-24,article,News,,[],The New York Times,Learning,549
Is Everyone Doing Chemo Without Me?,2019-09-24,article,News,,"['Breast Cancer', 'Chemotherapy', 'Radiation']",The New York Times,Well,1191
Jameela Jamil Does Her Own Makeup — Sometimes in a Car,2019-09-24,article,News,,"['Cosmetics and Toiletries', 'Skin', 'ACTORS AND ACTRESSES', 'Hair', 'Exercise']",The New York Times,Styles,1059
How Similar Are Your Political Views to Those of Your Parents?,2019-09-24,article,News,,[],The New York Times,Learning,774
Facial Recognition Technology in Public Housing Prompts Backlash,2019-09-24,article,News,,"['Facial Recognition Software', 'Law and Legislation', 'Racial Profiling', 'Surveillance of Citizens by Government', 'Civil Rights and Liberties', 'Public and Subsidized Housing']",The New York Times,Washington,1389
The Secret Is Out: Penguins Are Promiscuous Too,2019-09-24,article,Review,,"['Books and Literature', 'Penguins', 'Exploration and Explorers']",The New York Times,BookReview,649
Ann Patchett Spins a Modern Fairy Tale in Her Luminous New Novel,2019-09-24,article,Review,,['Books and Literature'],The New York Times,BookReview,1251
How to Pivot From a Dud of a Destination,2019-09-24,article,News,,"['Travel and Vacations', 'Budget Travel', 'Customer Loyalty Programs', 'Credit Cards', 'Hotels and Travel Lodgings', 'Frequent Flier Programs']",The New York Times,Travel,1048
Patti Smith Plumbs Her Dreams in ‘Year of the Monkey’,2019-09-24,article,Review,,['Books and Literature'],The New York Times,BookReview,629
Ta-Nehisi Coates’s Debut Novel Mingles History and Fantasy,2019-09-24,article,Review,,['Books and Literature'],The New York Times,BookReview,1123
"‘Know My Name,’ a Sexual Assault Survivor Tells the World",2019-09-24,article,Review,,['Books and Literature'],The New York Times,BookReview,1415
Why Are American Jews Falling Out of Love With Israel?,2019-09-24,article,Review,,"['Jews and Judaism', 'Zionism', 'Books and Literature']",The New York Times,BookReview,1405
An Underwater World of Marble to Amuse and Protect Tuscan Fish,2019-09-24,article,News,,"['Art', 'Sculpture', 'Fishing, Commercial', 'Conservation of Resources']",The New York Times,Foreign,1275
Three Up-and-Coming Furniture Designers to Watch,2019-09-24,article,News,,"['Furniture', 'Art', 'Design', 'Tables']",The New York Times,TStyle,880
Sleep Therapy for the Masses May Be Coming to You Soon,2019-09-24,article,News,,"['Mobile Applications', 'Sleep', 'Insomnia', 'Therapy and Rehabilitation', 'Employee Fringe Benefits']",The New York Times,Business,1308
"Chasing Deadlines, Then Some Miles",2019-09-24,article,News,,"['Running', 'News and News Media', 'Fifth Avenue Mile', 'New York City Marathon']",The New York Times,Insider,668
Would You Like a Tiny Fish With That?,2019-09-24,article,News,,"['ANCHOVIES', 'your-feed-selfcare', 'Fish and Other Marine Life']",The New York Times,Styles,1297
"In Munich and Dessau, Art and Design Call. But History Is Even More Compelling.",2019-09-24,article,News,,"['Art', 'Historic Buildings and Sites', 'ARCHITECTURE', 'Travel and Vacations', 'Design']",The New York Times,Travel,2063
"Children of 9/11, Following Their Fathers’ Last Footsteps",2019-09-24,article,News,,"['Fires and Firefighters', 'September 11 (2001)', 'Deaths (Fatalities)', 'World Trade Center (Manhattan, NY)', 'Terrorism']",The New York Times,Metropolitan,2110
The America That Isn’t Polarized,2019-09-24,article,News,,"['Presidential Election of 2020', 'Polls and Public Opinion', 'United States Politics and Government', 'Social Media', 'Voting and Voters']",The New York Times,Upshot,1877
Tekashi 69: Will He Join the Infamous in Witness Protection?,2019-09-24,article,briefing,,"['Witness Protection Program (US)', 'Gangs']",The New York Times,Metro,1084
Brexit Turmoil Intensifies as Court Rebukes Boris Johnson,2019-09-24,article,News,,"['Great Britain Withdrawal from EU (Brexit)', 'Decisions and Verdicts', 'Politics and Government']",The New York Times,Foreign,1597
Spanish Court Approves Franco’s Exhumation,2019-09-24,article,News,,"['Politics and Government', 'Spanish Civil War (1936-39)', 'Decisions and Verdicts']",The New York Times,Foreign,927
Passengers Return to Britain After Thomas Cook Collapse,2019-09-24,article,News,,"['Diplomatic Service, Embassies and Consulates']",The New York Times,Foreign,1283
What Happened at the U.N. General Assembly,2019-09-24,article,News,,"['United States International Relations', 'United States Politics and Government', 'International Relations', 'United Nations Framework Convention on Climate Change', 'Global Warming', 'Nuclear Weapons', 'Embargoes and Sanctions']",The New York Times,Foreign,2469
"Boris Johnson, United Nations, Puerto Rico: Your Tuesday Briefing",2019-09-24,article,briefing,,[],The New York Times,NYTNow,1427
Can We Please Talk About How Ukrainians Feel About This?,2019-09-24,article,Op-Ed,,"['Politics and Government', 'Corruption (Institutional)', 'United States Politics and Government', 'Trump-Ukraine Whistle-blower Complaint and Impeachment Inquiry']",The New York Times,OpEd,721
What Jonathan Van Ness’s Story Teaches Us About the H.I.V. Epidemic,2019-09-24,article,Op-Ed,,"['Acquired Immune Deficiency Syndrome', 'Child Abuse and Neglect', 'Sex Crimes', 'Epidemics', 'United States Politics and Government']",The New York Times,OpEd,1211
Does Donald Trump Want to Be Impeached?,2019-09-24,article,Op-Ed,,"['Corruption (Institutional)', 'Impeachment', 'Trump-Ukraine Whistle-blower Complaint and Impeachment Inquiry', 'Presidential Election of 2020', 'Constitution (US)', 'United States Politics and Government']",The New York Times,OpEd,1646
A Conversation With a Border Patrol Agent,2019-09-24,article,News,,"['Illegal Immigration', 'Immigration Detention', 'Asylum, Right of', 'Immigration and Emigration']",The New York Times,Podcasts,265
American Jews and American Muslims Have a Common Antagonist,2019-09-24,article,Op-Ed,,"['Jews and Judaism', 'Muslim Americans', 'United States Politics and Government', 'Discrimination', 'ANTI-SEMITISM']",The New York Times,OpEd,992
DealBook Briefing: There’s No Right to Be Forgotten Globally,2019-09-24,article,News,,['Privacy'],The New York Times,Business,1741
Tropical Storm Karen’s Rains Begin to Soak Puerto Rico,2019-09-24,article,News,,"['Hurricanes and Tropical Storms', 'Earthquakes', 'Hurricane Maria (2017)', 'Rain', 'Landslides and Mudslides']",The New York Times,National,707
‘Anthropocene: The Human Epoch’ Review: Global Warnings,2019-09-24,article,Review,,"['Documentary Films and Programs', 'Earth']",The New York Times,Culture,499
Marine Serre: Spring 2020,2019-09-24,multimedia,Slideshow,,['Paris Fashion Week'],The New York Times,Fashion & Style,0
E.U. Court Orders Fiat Chrysler to Pay Back $33 Million in Taxes,2019-09-24,article,News,,['Antitrust Laws and Competition Issues'],The New York Times,Business,720
Bernie Sanders Proposes a Wealth Tax: ‘I Don’t Think That Billionaires Should Exist’,2019-09-24,article,News,,"['Taxation', 'High Net Worth Individuals', 'Presidential Election of 2020', 'Income Inequality', 'United States Politics and Government']",The New York Times,Politics,1205
VW Executives and Ex-C.E.O. Are Charged With Market Manipulation,2019-09-24,article,News,,"['Frauds and Swindling', 'Automobiles', 'Fuel Emissions (Transportation)', 'Securities and Commodities Violations']",The New York Times,Business,1402
A Slain Jewish Girl’s Diary of Life Under the Soviets and the Nazis,2019-09-24,article,News,,"['Diaries', 'Holocaust and the Nazi Era', 'World War II (1939-45)', 'Biographical Information', 'Books and Literature', 'Jews and Judaism', 'War Crimes, Genocide and Crimes Against Humanity']",The New York Times,Foreign,1285
Forest in a Soccer Stadium Outrages Austria’s Far Right,2019-09-24,article,News,,"['Art', 'Elections']",The New York Times,Culture,944
Democrats Want to Tax the Rich. Here’s How Those Plans Would Work (or Not).,2019-09-24,multimedia,Interactive Feature,,"['Capital Gains Tax', 'Income Inequality', 'High Net Worth Individuals']",The New York Times,Business Day,0
"Weekly News Quiz For Students: Climate Protests, Whistle-Blower, Emmy Awards",2019-09-24,multimedia,Interactive Feature,,[],The New York Times,The Learning Network,0
How Impeachment Shifted,2019-09-24,article,Op-Ed,,"['United States Politics and Government', 'Presidential Election of 2020', 'Trump-Ukraine Whistle-blower Complaint and Impeachment Inquiry', 'Impeachment', 'Democracy (Theory and Philosophy)', 'United States International Relations']",The New York Times,OpEd,629
Recent Commercial Real Estate Transactions,2019-09-24,article,News,,"['Real Estate (Commercial)', 'Real Estate and Housing (Residential)']",The New York Times,Business,231
"On ‘The Good Place,’ Chidi Redefines the Black Nerd",2019-09-24,article,News,,['Television'],The New York Times,Culture,1471
"Talking to Jerry Brown About Tackling Climate Change, With Help From China",2019-09-24,article,briefing,,[],The New York Times,National,1261
U.K. Supreme Court Declared Boris Johnson’s Actions Unlawful. What Happens Next?,2019-09-24,article,News,,"['Legislatures and Parliaments', 'Politics and Government']",The New York Times,Foreign,1190
Overtime Pay Eligibility Is Widened in New Federal Rule,2019-09-24,article,News,,"['Wages and Salaries', 'Labor and Jobs', 'Overtime', 'Regulation and Deregulation of Industry']",The New York Times,Business,809
Big3 Star Andre Emmett Is Shot and Killed in Dallas,2019-09-24,article,News,,['Basketball'],The New York Times,Sports,276
"Lady Hale, U.K. Supreme Court Judge, Speaks Calmly and Brings Down the Hammer",2019-09-24,article,News,,"['Great Britain Withdrawal from EU (Brexit)', 'Decisions and Verdicts', 'Politics and Government']",The New York Times,Foreign,1350
Coffee May Lower Risk of Gallstones,2019-09-24,article,News,,"['Gallstones', 'Coffee']",The New York Times,Well,240
Trump Makes Clear He’s Ready for a Fight He Has Long Anticipated,2019-09-24,article,News,,"['United States Politics and Government', 'Presidential Election of 2020', 'Impeachment', 'Trump-Ukraine Whistle-blower Complaint and Impeachment Inquiry']",The New York Times,Washington,1403
Trump Defends Call With Ukrainian President: It Was ‘Perfect’,2019-09-24,multimedia,Video,,"['United States Politics and Government', 'Trump-Ukraine Whistle-blower Complaint and Impeachment Inquiry']",The New York Times,,0
"Nine Albums Later, Tegan and Sara Are Finally Ready to Discuss High School",2019-09-24,article,News,,"['Twins', 'Pop and Rock Music', 'Homosexuality and Bisexuality']",The New York Times,Arts&Leisure,2261
Nancy Pelosi Announces Formal Impeachment Inquiry of Trump,2019-09-24,article,News,,"['Impeachment', 'Trump-Ukraine Whistle-blower Complaint and Impeachment Inquiry', 'United States Politics and Government', 'Espionage and Intelligence Services', 'Whistle-Blowers']",The New York Times,Washington,1921
We Need a PBS for Social Media,2019-09-24,article,Op-Ed,,"['Social Media', 'Computers and the Internet', 'News and News Media']",The New York Times,OpEd,1145
The Rohingya’s Right of No Return,2019-09-24,article,Op-Ed,,"['Politics and Government', 'Defense and Military Forces', 'Economic Conditions and Trends', 'Refugees and Displaced Persons', 'Immigration and Emigration', 'War Crimes, Genocide and Crimes Against Humanity', 'Rohingya (Ethnic Group)', 'Smuggling', 'Rakhine (Ethnic Group)', 'Muslims and Islam', 'Discrimination', 'Citizenship and Naturalization']",The New York Times,OpEd,1707
It Takes a Teenager to Help a Teenager in Crisis,2019-09-24,article,Op-Ed,,"['Volunteers and Community Service', 'Depression (Mental)', 'Youth', 'Mental Health and Disorders', 'Suicides and Suicide Attempts', 'Social Media']",The New York Times,OpEd,1844
Dior: Spring 2020,2019-09-24,multimedia,Slideshow,,['Paris Fashion Week'],The New York Times,Fashion & Style,0
Sleep Apnea Tied to Mood Disorders,2019-09-24,article,News,,"['Anxiety and Stress', 'APNEA (SLEEP DISORDER)', 'Sleep', 'Mental Health and Disorders', 'Depression (Mental)']",The New York Times,Well,216
"If Liberalism Is in Crisis, Who’s to Blame?",2019-09-24,article,Review,,['Books and Literature'],The New York Times,BookReview,1925
"Earthquake Strikes Pakistan, Killing at Least 22",2019-09-24,article,News,,"['Earthquakes', 'Deaths (Fatalities)']",The New York Times,Foreign,409
"Trump and Johnson, Together on World Stage, Eye Troubles Back Home",2019-09-24,article,News,,"['Politics and Government', 'Legislatures and Parliaments', 'United States Politics and Government', 'Impeachment']",The New York Times,Foreign,635
How the U.K. Supreme Court’s Rebuke to Boris Johnson Remakes British Law,2019-09-24,article,News,,"['Legislatures and Parliaments', 'Great Britain Withdrawal from EU (Brexit)']",The New York Times,Foreign,1338
"A Civilized Retreat, if You Know Where to Look",2019-09-24,multimedia,Slideshow,,['Restaurants'],The New York Times,Food,0
"Behind a Hidden Door, a Sleek Lair for Escaping New York",2019-09-24,article,Review,,['Restaurants'],The New York Times,Dining,1197
Letters to the Editor,2019-09-24,article,Letter,,['Books and Literature'],The New York Times,BookReview,519
What I Learned in a Year of Weeknight Cooking,2019-09-24,article,News,,['Cooking and Cookbooks'],The New York Times,Dining,1543
"Tulsi Gabbard Qualifies for Next Debate, Bringing Lineup to 12",2019-09-24,article,News,,"['Debates (Political)', 'Presidential Election of 2020']",The New York Times,Politics,755
Trump Celebrates Nationalism in U.N. Speech and Plays Down Iran Crisis,2019-09-24,article,News,,"['United States International Relations', 'Immigration and Emigration', 'Defense and Military Forces', 'International Relations']",The New York Times,Washington,1387
Dean & DeLuca Closes Its Midtown Store,2019-09-24,article,News,,"['Shutdowns (Institutional)', 'Shopping and Retail', 'Supermarkets and Grocery Stores']",The New York Times,Dining,461
Alice Hoffman Brings Magical Realism to the Holocaust Novel,2019-09-24,article,Review,,['Books and Literature'],The New York Times,BookReview,601
"As an Ohio City Struggles, Some See Salvation in a Prairie",2019-09-24,article,News,,"['AIRPORTS', 'Land Use Policies', 'Real Estate (Commercial)', 'Labor and Jobs', 'Conservation of Resources']",The New York Times,Business,1283
"For Joe Biden, Trump Impeachment Inquiry Brings a Long-Expected Test",2019-09-24,article,News,,"['Impeachment', 'Presidential Election of 2020', 'United States Politics and Government', 'Trump-Ukraine Whistle-blower Complaint and Impeachment Inquiry']",The New York Times,Politics,1498
WeWork C.E.O. Adam Neumann Steps Down Under Pressure,2019-09-24,article,News,,"['Appointments and Executive Changes', 'Co-Working', 'Initial Public Offerings', 'Stocks and Bonds']",The New York Times,Business,1445
‘I’ve Been Dishonored’: French Chef Sues Michelin Guide Over Lost Star,2019-09-24,article,News,,"['Suits and Litigation (Civil)', 'Restaurants', 'Chefs']",The New York Times,Foreign,899
"At Gibney, a New Curatorial Director Makes a Revolution",2019-09-24,article,News,,"['Dancing', 'Writing and Writers', 'Appointments and Executive Changes']",The New York Times,Culture,1190
"More Flags, More Problems for the N.F.L.’s Offensive Linemen",2019-09-24,article,News,,"['Football', 'Officiating (Sports)']",The New York Times,Sports,583
When the Antiques Have to Go,2019-09-24,article,News,,"['Real Estate and Housing (Residential)', 'Interior Design and Furnishings', 'ANTIQUES', 'Furniture']",The New York Times,RealEstate,1914
"Korean Barbecue in an Elegant Space, at Hyun",2019-09-24,article,News,,"['Restaurants', 'Korean Food (Cuisine)', 'Wine Bars']",The New York Times,Dining,615
