headline,date,doc_type,material_type,section,keywords,source,news_desk,word_count
"During Kavanaugh Hearings, Senator Alerted F.B.I. to New Allegation",2019-09-16,article,News,,"['United States Politics and Government', 'Sexual Harassment', 'Sex Crimes']",The New York Times,Washington,1473
Three Leaders of Women’s March Group Step Down After Controversies,2019-09-16,article,News,,"['Appointments and Executive Changes', ""Women's Rights"", 'ANTI-SEMITISM']",The New York Times,National,693
The 13 Best Cookbooks of Fall 2019,2019-09-16,article,News,,['Cooking and Cookbooks'],The New York Times,Dining,1851
Shane Gillis Dropped From ‘S.N.L.’ Cast Amid Criticism of Racist Slurs,2019-09-16,article,News,,"['Comedy and Humor', 'Television', 'Discrimination', 'Homosexuality and Bisexuality', 'Chinese-Americans', 'Race and Ethnicity', 'ANTI-SEMITISM']",The New York Times,Culture,830
"U.S.-Iran Tensions, and Fears of War",2019-09-16,article,Letter,,"['Embargoes and Sanctions', 'United States Politics and Government', 'United States International Relations']",The New York Times,Letters,386
"Mike Stefanik, Ex-NASCAR Champion, Dies in Plane Crash",2019-09-16,article,News,,"['Automobile Racing', 'Aviation Accidents, Safety and Disasters', 'Deaths (Fatalities)']",The New York Times,Express,409
"Saudi Arabia, Hong Kong, Banksy: Your Tuesday Briefing",2019-09-16,article,briefing,,[],The New York Times,NYTNow,1463
"Age Isn’t Hurting 2020 Democratic Leaders, to Rivals’ Chagrin",2019-09-16,article,News,,"['Presidential Election of 2020', 'United States Politics and Government', 'Debates (Political)', 'Age, Chronological']",The New York Times,Politics,1481
The Cost of Running Guantánamo Bay: $13 Million Per Prisoner,2019-09-16,article,News,,"['Detainees', 'United States Defense and Military Forces', 'Military Bases and Installations', 'Terrorism', 'Federal Budget (US)']",The New York Times,Washington,2135
Men Arrested at Courthouse Say They Were Sent to Test Its Security,2019-09-16,article,News,,"['Robberies and Thefts', 'Security and Warning Systems']",The New York Times,Express,593
Allegations Against Brett Kavanaugh: A New Uproar,2019-09-16,article,Letter,,"['Sexual Harassment', 'United States Politics and Government']",The New York Times,Letters,413
Washington Monument to Reopen After Three Years,2019-09-16,article,News,,"['Monuments and Memorials (Structures)', 'National Parks, Monuments and Seashores', 'Historic Buildings and Sites']",The New York Times,Travel,814
"Elizabeth Warren, at Washington Sq. Park Rally, Promises to Take On Corruption",2019-09-16,article,News,,"['Presidential Election of 2020', 'Triangle Shirtwaist Factory Fire (1911)', 'Corruption (Institutional)', 'United States Politics and Government', 'Primaries and Caucuses']",The New York Times,Politics,1271
How Long Has Roller-Skating Been ‘a New York Thing’? Take a Look,2019-09-16,article,News,,"['Roller Skating', 'Dancing', 'Parks and Other Recreation Areas']",The New York Times,Express,1063
"Oil, Brett Kavanaugh, The Far Side: Your Monday Evening Briefing",2019-09-16,article,briefing,,[],The New York Times,NYTNow,1084
Answers to Reader Questions on Our Brett Kavanaugh Essay,2019-09-16,article,News,,"['Sexual Harassment', 'Books and Literature']",The New York Times,Insider,828
3 From JPMorgan Accused in Scheme to Game Precious Metals Market,2019-09-16,article,News,,"['Futures and Options Trading', 'Commodities', 'Securities and Commodities Violations', 'Organized Crime', 'Racketeering and Racketeers', 'Banking and Financial Institutions']",The New York Times,Business,707
"Paul Ingrassia, Prizewinning Auto Industry Reporter, Dies at 69",2019-09-16,article,Obituary (Obit),,"['News and News Media', 'Deaths (Obituaries)']",The New York Times,Obits,704
Florida Judge Denies Bid by Epstein Victims to Nullify Non-Prosecution Deal,2019-09-16,article,News,,"['Sex Crimes', 'Human Trafficking', 'United States Attorneys']",The New York Times,National,1121
Republicans Don’t Believe in Democracy,2019-09-16,article,Op-Ed,,"['United States Politics and Government', 'Presidential Election of 2020', 'Elections']",The New York Times,OpEd,860
"As Congo’s Ebola Outbreak Drags On, Untracked Cases Sow Confusion",2019-09-16,article,News,,"['Ebola Virus', 'Epidemics']",The New York Times,Science,784
Who Was Behind the Saudi Oil Attack? What the Evidence Shows,2019-09-16,multimedia,Interactive Feature,,['Oil (Petroleum) and Gasoline'],The New York Times,World,0
"Iran Might Be America’s Enemy, but Saudi Arabia Is No Friend",2019-09-16,article,Op-Ed,,['United States Defense and Military Forces'],The New York Times,OpEd,775
Richard Quinn: Spring 2020,2019-09-16,multimedia,Slideshow,,['London Fashion Week'],The New York Times,Fashion & Style,0
An Unusual Rise in Interest Rates Roils a Crucial Financial Market,2019-09-16,article,News,,"['Banking and Financial Institutions', 'Interest Rates', 'United States Economy', 'Credit and Debt', 'Hedge Funds', 'Stocks and Bonds']",The New York Times,Business,605
Making Companies Act When Government Won’t,2019-09-16,article,Editorial,,"['Gun Control', 'Mass Shootings', 'Corporations', 'Regulation and Deregulation of Industry', 'Corporate Social Responsibility', 'Alternative and Renewable Energy', 'United States Politics and Government']",The New York Times,Editorial,1002
"For Democrats, the Future Is Female",2019-09-16,article,News,,['United States Politics and Government'],The New York Times,Politics,1285
1.1 Million Can Skip School for Climate Protest,2019-09-16,article,News,,"['Global Warming', 'Education (K-12)', 'Demonstrations, Protests and Riots']",The New York Times,Metro,876
Would a Purdue Bankruptcy Protect the Sacklers? Good Question.,2019-09-16,article,News,,"['Opioids and Opiates', 'Bankruptcies', 'OxyContin (Drug)', 'Suits and Litigation (Civil)', 'States (US)', 'Attorneys General', 'Local Government', 'your-feed-healthcare', 'your-feed-health']",The New York Times,Science,1065
"Lewandowski Cleared for Limited Testimony in House Inquiry, as White House Blocks Others",2019-09-16,article,News,,"['United States Politics and Government', 'Russian Interference in 2016 US Elections and Ties to Trump Associates', 'Impeachment']",The New York Times,Washington,1322
Trump Says U.S. and Japan Have Reached Initial Trade Agreement,2019-09-16,article,News,,"['International Trade and World Market', 'United States Politics and Government', 'Trans-Pacific Partnership', 'Customs (Tariff)', 'Agriculture and Farming']",The New York Times,Business,954
"With Oil Under Attack, Trump’s Deference to Saudis Returns",2019-09-16,article,News,,"['United States International Relations', 'Human Rights and Human Rights Violations']",The New York Times,Washington,1349
Venezuela’s Maduro Trains Sights on Opposition’s Last Bastion: Congress,2019-09-17,article,News,,"['Legislatures and Parliaments', 'Politics and Government']",The New York Times,Foreign,697
Ask Your Questions About Inequality in California,2019-09-17,article,News,,['Income Inequality'],The New York Times,National,75
"‘Locked and Loaded,’ but for What?",2019-09-17,article,Editorial,,"['Defense and Military Forces', 'United States International Relations']",The New York Times,Editorial,716
Trump Gives Medal to Another Sports Legend Who Likes Him: Mariano Rivera,2019-09-17,article,News,,"['United States Politics and Government', 'Baseball', 'Presidential Medal of Freedom']",The New York Times,Washington,812
"To G.M. Workers, U.A.W. Strike Is Chance for Overdue Reward",2019-09-17,article,News,,"['Strikes', 'Wages and Salaries', 'Organized Labor', 'Labor and Jobs', 'Bankruptcies', 'Automobiles', 'Factories and Manufacturing']",The New York Times,Business,1480
Husband Charged With Murder After Bodies of Wife and 4 Children Are Found,2019-09-17,article,News,,"['Murders, Attempted Murders and Homicides']",The New York Times,Express,540
Writers Guild Re-elects Leadership at Odds With Agencies,2019-09-17,article,News,,"['Movies', 'AGENTS (BUSINESS)']",The New York Times,Business,602
"Review: In ‘Wives,’ the Other Halves Have Their Say",2019-09-17,article,Review,,['Theater'],The New York Times,Culture,739
Happy,2019-09-17,article,News,,['Crossword Puzzles'],The New York Times,Games,830
Odell Beckham Jr. Reminds MetLife What He Can Do in Win Over Jets,2019-09-17,article,News,,[],The New York Times,Sports,870
Quotation of the Day: Hair From Unsolved Killing? Send It to This Man,2019-09-17,article,Quote,,[],The New York Times,Summary,47
"Corrections: September 17, 2019",2019-09-17,article,Correction,,[],The New York Times,Corrections,312
Russian Athletes Set to Remain ‘Neutral’ at Track Championships,2019-09-17,article,News,,"['Track and Field', 'Steroids', 'Doping (Sports)']",The New York Times,Sports,867
Red Bull Salzburg Gets Its Wings,2019-09-17,article,News,,"['UEFA Champions League (Soccer)', 'Soccer']",The New York Times,Sports,1290
Trump Tries to Woo Hispanic Voters at Rally in New Mexico,2019-09-17,article,News,,"['United States Politics and Government', 'Hispanic-Americans', 'Race and Ethnicity', 'Illegal Immigration', 'United States Defense and Military Forces', 'Presidential Election of 2020', 'Voting and Voters']",The New York Times,Washington,1111
Your Tuesday Briefing,2019-09-17,article,briefing,,"['Trump Tax Returns', 'Great Britain Withdrawal from EU (Brexit)']",The New York Times,NYTNow,1581
"Train Derails in Hong Kong, Injuring 5 and Snarling Commute",2019-09-17,article,News,,"['Railroad Accidents and Safety', 'Subways', 'Transit Systems', 'Commuting']",The New York Times,Foreign,492
What’s on TV Tuesday: ‘Bachelor in Paradise’ and ‘Last Kids on Earth’,2019-09-17,article,News,,"['Television', 'Movies']",The New York Times,Culture,495
"Israel Wants Palestine’s Land, but Not Its People",2019-09-17,article,Op-Ed,,"['Israeli Settlements', 'Palestinians', 'Elections', 'Politics and Government']",The New York Times,OpEd,984
Word + Quiz: galumph,2019-09-17,article,News,,[],The New York Times,Learning,197
"Luis Severino Returns, but the Yankees’ Slew of Injuries Remains a Mystery",2019-09-17,article,News,,"['Sports Injuries', 'Baseball']",The New York Times,Sports,903
A Mosaic of Groups Competes in Israel’s Election,2019-09-17,article,News,,"['Elections', 'Jews and Judaism', 'Voting and Voters', 'Race and Ethnicity', 'Palestinians', 'Zionism', 'Legislatures and Parliaments']",The New York Times,Foreign,1646
"Trump Is ‘Locked and Loaded’ for Iran, but He’s No Dirty Harry, Colbert Says",2019-09-17,article,News,,[],The New York Times,Culture,755
Lesson of the Day: ‘Does Hispanic Heritage Month Need a Rebrand?’,2019-09-17,article,News,,[],The New York Times,Learning,522
A Professor’s Killing Sends a Chill Through a Campus in Pakistan,2019-09-17,article,News,,"['School Shootings and Armed Attacks', 'Colleges and Universities', 'Terrorism', 'Muslims and Islam', 'ACADEMIC FREEDOM']",The New York Times,Foreign,1096
Why We Feel Compelled to Say ‘Bless You’ When Someone Sneezes,2019-09-17,article,News,,"['Customs, Etiquette and Manners']",The New York Times,Well,896
My Family’s Life Inside and Outside America’s Racial Categories,2019-09-17,article,News,,"['Blacks', 'Black People', 'Race and Ethnicity', 'Whites']",The New York Times,Magazine,6823
How an Oil Price Surge Could Hurt the U.S. Economy,2019-09-17,article,News,,"['United States Economy', 'Oil (Petroleum) and Gasoline', 'Recession and Depression', 'Prices (Fares, Fees and Rates)', 'International Trade and World Market']",The New York Times,Business,845
Can the N.F.L. Turn a 360-Pound Rugby Player Into a Football Star?,2019-09-17,article,News,,"['Draft and Recruitment (Sports)', 'Rugby', 'Football']",The New York Times,Magazine,3844
How to Take Advantage of Shoulder Season,2019-09-17,article,News,,"['Travel and Vacations', 'Summer (Season)', 'Autumn (Season)', 'Prices (Fares, Fees and Rates)', 'Hotels and Travel Lodgings']",The New York Times,Travel,804
Letter of Recommendation: Dog Tricks,2019-09-17,article,News,,"['Animal Behavior', 'Dogs', 'Hobbies', 'Animal Cognition']",The New York Times,Magazine,927
Should I Challenge My Longtime Friends About Their Bigoted Views?,2019-09-17,article,News,,"['Dating and Relationships', 'Sex Crimes', 'Ethics (Personal)']",The New York Times,Magazine,1424
"New & Noteworthy Visual Books, From Disney to Drag",2019-09-17,article,News,,['Books and Literature'],The New York Times,BookReview,386
Love Among the Ruins,2019-09-17,article,Review,,['Books and Literature'],The New York Times,BookReview,646
What Our Editor Learned by Speaking to Hundreds of Filmmakers,2019-09-17,article,News,,"['Movies', 'ACTORS AND ACTRESSES', 'Video Recordings, Downloads and Streaming']",The New York Times,Summary,679
Rachel Cusk Said She Was Done With Autobiography. These Essays Suggest Otherwise.,2019-09-17,article,Review,,['Books and Literature'],The New York Times,BookReview,968
Is the Green New Deal Realistic? Two Sympathetic Authors Weigh In,2019-09-17,article,Review,,"['Books and Literature', 'Green New Deal']",The New York Times,BookReview,1407
Wallabies Promise Unpredictability at the Rugby World Cup After Embracing Tumult,2019-09-17,article,News,,"['Rugby', 'World Cup 2019 (Rugby)']",The New York Times,SpecialSections,1278
Have You Ever Had a Significant Friendship End?,2019-09-17,article,News,,[],The New York Times,Learning,532
How a Dying Man Wrote a Timeless Novel,2019-09-17,article,Review,,['Books and Literature'],The New York Times,BookReview,659
​Job One for Saudis’ New Energy Chief: Picking Up the Pieces,2019-09-17,article,News,,"['Oil (Petroleum) and Gasoline', 'Royal Families']",The New York Times,Business,1110
"Confronting Grief, Mental Illness and Marginalization, in Verse",2019-09-17,article,News,,"['Books and Literature', 'Poetry and Poets']",The New York Times,BookReview,1059
Neighborhood Celebrations,2019-09-17,article,News,,[],The New York Times,Learning,110
Was the Gap Ever Cool? A Look at 50 Years in Denim and Khaki,2019-09-17,article,News,,"['Shopping and Retail', 'Fashion and Apparel', 'Nineteen Hundred Sixties']",The New York Times,Styles,1146
Rugby Referee Creates a Buzz While Keeping the Peace,2019-09-17,article,News,,"['Rugby', 'World Cup 2019 (Rugby)', 'Officiating (Sports)']",The New York Times,SpecialSections,1274
"Rugby Underdogs Again, the U.S. Team Hopes to Turn a Corner",2019-09-17,article,News,,"['Rugby', 'World Cup 2019 (Rugby)']",The New York Times,SpecialSections,1241
Chinese Government Employee Arrested in Visa Fraud Scheme,2019-09-17,article,News,,"['Politics and Government', 'Frauds and Swindling', 'International Trade and World Market', 'Research', 'United States Politics and Government']",The New York Times,Express,507
Andrew Yang Knows You May Disagree With Him About Shane Gillis,2019-09-17,article,News,,"['Asian-Americans', 'Television', 'Discrimination', 'Race and Ethnicity', 'Comedy and Humor', 'Minorities', 'Presidential Election of 2020', 'Blacks', 'Black People']",The New York Times,Culture,1300
Warren and Trump Speeches Lay Out Competing Visions of Populism,2019-09-17,article,News,,"['Presidential Election of 2020', 'United States Politics and Government', 'Corruption (Institutional)']",The New York Times,Politics,1265
A Look at the Teams in the Rugby World Cup,2019-09-17,article,News,,['Rugby'],The New York Times,SpecialSections,1453
Loneliness and Its Antidote on Orcas Island,2019-09-17,article,News,,"['Travel and Vacations', 'Whales and Whaling', 'Hikes and Hiking']",The New York Times,Travel,1899
Coronavirus in N.Y.: Ask Your Questions About the Pandemic,2019-09-17,article,News,,[],The New York Times,Metro,187
A Milan Design Firm Shakes Things Up in Florence,2019-09-17,multimedia,Slideshow,,['Design'],The New York Times,T Magazine,0
"The Governor, the Seneca Nation and the Completely Rotten Highway",2019-09-17,article,News,,"['Seneca Indians', 'Roads and Traffic', 'Native Americans', 'Casinos']",The New York Times,Metro,1193
Where the Past Meets the Present in Park Slope,2019-09-17,multimedia,Slideshow,,"['Real Estate and Housing (Residential)', 'Theater']",The New York Times,Real Estate,0
"Amid the Renaissance Architecture of Florence, an Unexpected Villa",2019-09-17,article,News,,"['Historic Buildings and Sites', 'Zoning', 'ARCHITECTURE', 'Design', 'Interior Design and Furnishings']",The New York Times,TStyle,1519
"For One Playwright, It Wouldn’t Be Home Without a Little Melodrama",2019-09-17,article,News,,"['Real Estate and Housing (Residential)', 'Theater', 'Interior Design and Furnishings']",The New York Times,RealEstate,901
"Putin Says Saudis Should Buy Russian Missiles, to Laughter From Iran",2019-09-17,article,News,,"['Politics and Government', 'Arms Trade']",The New York Times,Foreign,255
Taliban Make Good on Pledge to Strike Afghan Election Campaign,2019-09-17,article,News,,['Terrorism'],The New York Times,Foreign,1193
"Iran, Israel, General Motors: Your Tuesday Briefing",2019-09-17,article,briefing,,[],The New York Times,NYTNow,1376
WeWork Delays I.P.O. After Chilly Reception From Investors,2019-09-17,article,News,,"['Initial Public Offerings', 'Co-Working', 'Stocks and Bonds', 'Venture Capital']",The New York Times,Business,1130
"As Amazon Smolders, Indonesia Fires Choke the Other Side of the World",2019-09-17,article,News,,"['Wildfires', 'Forests and Forestry', 'Politics and Government']",The New York Times,Foreign,531
How Giuliani’s Third Marriage Imploded Very Publicly,2019-09-17,article,briefing,,"['Divorce, Separations and Annulments', 'Cycling, Road']",The New York Times,Metro,1290
The Autoworkers Strike Is Bigger Than G.M.,2019-09-17,article,Op-Ed,,"['Strikes', 'Organized Labor', 'Labor and Jobs']",The New York Times,OpEd,927
The Abortion Mysticism of Pete Buttigieg,2019-09-17,article,Op-Ed,,"['ABORTION', 'Presidential Election of 2020', 'Debates (Political)', 'Pregnancy and Childbirth', 'Bible']",The New York Times,OpEd,1367
Chris Rock Is Writing a Book on Race and Relationships,2019-09-17,article,News,,"['Books and Literature', 'Comedy and Humor', 'Writing and Writers']",The New York Times,Culture,492
Who Really Attacked Saudi Arabia?,2019-09-17,article,News,,"['Oil (Petroleum) and Gasoline', 'Politics and Government', 'United States Defense and Military Forces', 'Defense and Military Forces']",The New York Times,Podcasts,250
Trump’s Childhood Home Goes Back on the Auction Block,2019-09-17,article,News,,['Real Estate and Housing (Residential)'],The New York Times,RealEstate,983
Something Special Is Happening in Rural America,2019-09-17,article,Op-Ed,,"['Rural Areas', 'Population']",The New York Times,OpEd,1109
Mad About Kavanaugh and Gorsuch? The Best Way to Get Even Is to Pack the Court,2019-09-17,article,Op-Ed,,"['United States Politics and Government', 'Federal Courts (US)', 'Courts and the Judiciary', 'Constitution (US)', 'Appointments and Executive Changes']",The New York Times,OpEd,1188
The James Beard Awards Redraws Its Map,2019-09-17,article,News,,"['Restaurants', 'Chefs']",The New York Times,Dining,846
"Hurricanes May Kill Some Birds, but Humans Are the Real Threat",2019-09-17,article,News,,"['Birds', 'Hurricane Dorian (2019)', 'your-feed-science']",The New York Times,Science,1317
IPhone 11 and 11 Pro Review: Thinking Differently in the Golden Age of Smartphones,2019-09-17,article,News,,"['Smartphones', 'Batteries', 'Privacy', 'iPhone', 'Photography', 'Cameras']",The New York Times,Business,1235
‘Daytona Beach Serial Killer’ Suspect Is Arrested,2019-09-17,article,News,,"['Murders, Attempted Murders and Homicides', 'Forensic Science', 'DNA (Deoxyribonucleic Acid)', 'Serial Murders', 'Women and Girls']",The New York Times,Express,553
Alexandria Ocasio-Cortez to Back First 2020 Challenger to Sitting Democrat,2019-09-17,article,News,,"['Endorsements', 'United States Politics and Government', 'Primaries and Caucuses', 'Elections, House of Representatives']",The New York Times,Washington,912
DealBook Briefing: An I.P.O. of WeWork Will Have to Wait,2019-09-17,article,News,,['Initial Public Offerings'],The New York Times,Business,2191
More and More Children Are Feeling Anxious. This Graphic Novelist Is Trying to Help.,2019-09-17,article,Review,,['Books and Literature'],The New York Times,BookReview,1416
"Almost Everywhere, Fewer Children Are Dying",2019-09-17,multimedia,Interactive Feature,,"['Population', 'Children and Childhood', 'Deaths (Fatalities)', 'Global Warming']",The New York Times,The Upshot,0
Chronicling New York’s Muslim History,2019-09-17,article,News,,"['Muslims and Islam', 'History (Academic Subject)', 'Immigration and Emigration']",The New York Times,National,827
"Weekly News Quiz For Students: Felicity Huffman, Purdue Pharma, Justice Kavanaugh",2019-09-17,multimedia,Interactive Feature,,[],The New York Times,The Learning Network,0
A Nazi Design Show Draws Criticism. Its Curator’s Comments Didn’t Help.,2019-09-17,article,News,,"['Design', 'Propaganda', 'Holocaust and the Nazi Era']",The New York Times,Culture,1102
Amazon Offers Millions of Songs in High-Quality Audio. Even Neil Young Approves.,2019-09-17,article,News,,"['Music', 'Audio Recordings, Downloads and Streaming', 'Prices (Fares, Fees and Rates)']",The New York Times,Business,777
"NBCUniversal Introduces Peacock, Its New Streaming Service",2019-09-17,article,News,,"['Video Recordings, Downloads and Streaming', 'Television']",The New York Times,Business,609
Train Delayed? Relax With a Bolivian Pastry and Bubble Tea,2019-09-17,article,News,,"['Subways', 'Shopping and Retail', 'Real Estate (Commercial)', 'Restaurants']",The New York Times,Business,1276
Ask Us Your Questions About Inequality in California,2019-09-17,article,briefing,,[],The New York Times,National,1269
Fall’s Most Dazzling Bronze Timepieces,2019-09-17,article,News,,[],The New York Times,TStyle,34
Dressing for the Great British Identity Crisis,2019-09-17,article,Review,,"['Fashion and Apparel', 'Great Britain Withdrawal from EU (Brexit)', 'your-feed-fashion', 'London Fashion Week']",The New York Times,Styles,1274
Why I’m Rooting for the G.M. Strikers,2019-09-17,article,Op-Ed,,"['Strikes', 'Wages and Salaries', 'Organized Labor', 'Labor and Jobs', 'Income Inequality', 'Automobiles']",The New York Times,OpEd,770
"To Find Clues in Saudi Oil Attacks, U.S. Examines Missile and Drone Parts",2019-09-17,article,News,,"['Oil (Petroleum) and Gasoline', 'United States Defense and Military Forces', 'United States International Relations']",The New York Times,Washington,1296
"Giants Name Daniel Jones the Starter, Sending Eli Manning to the Bench",2019-09-17,article,News,,['Football'],The New York Times,Sports,879
"For Libyan Jews, This Spicy Fish Stew Is the Taste of Rosh Hashana",2019-09-17,article,News,,"['Cooking and Cookbooks', 'Rosh Hashana', 'Jews and Judaism']",The New York Times,Dining,660
"The Bahamas’ Big Need Is Tourists, It Says",2019-09-17,article,News,,"['Travel and Vacations', 'Hurricane Dorian (2019)', 'Hurricanes and Tropical Storms', 'Hotels and Travel Lodgings']",The New York Times,Travel,1139
The U.S. Should Act Before a Global Downturn Destabilizes Latin America,2019-09-17,article,Op-Ed,,"['Refugees and Displaced Persons', 'Recession and Depression', 'Economic Conditions and Trends', 'Immigration and Emigration']",The New York Times,OpEd,978
The Dim Sum Chef Who Plays With His Dough,2019-09-17,article,News,,"['Chefs', 'Restaurants', 'Art', 'Hobbies']",The New York Times,TStyle,876
The Ups and Downs of Life Without Wheels of My Own,2019-09-17,article,Op-Ed,,"['Car Services and Livery Cabs', 'Transit Systems']",The New York Times,OpEd,1134
She Escaped From Nxivm. Now She’s Written a Book About the Sex Cult.,2019-09-17,article,Review,,['Books and Literature'],The New York Times,BookReview,885
"Fed Jumps Into Market to Push Down Rates, a First Since the Financial Crisis",2019-09-17,article,News,,"['Interest Rates', 'United States Economy', 'Banking and Financial Institutions']",The New York Times,Business,1056
Meat Is Murder. But You Know That Already.,2019-09-17,article,News,,"['Animal Abuse, Rights and Welfare', 'Meat', 'Food', 'Greenhouse Gas Emissions', 'ANIMALS', 'Global Warming']",The New York Times,BookReview,1334
‘The Nightcrawlers’ and ‘Lost and Found’ Review: Short Documentaries Tackle Big Issues,2019-09-17,article,Review,,['Documentary Films and Programs'],The New York Times,Culture,300
Precision Dim Sum and More From a Hong Kong Import,2019-09-17,multimedia,Slideshow,,"['Chinese Food (Cuisine)', 'Restaurants']",The New York Times,Food,0
Cokie Roberts Dies; Veteran Broadcast Journalist Was 75,2019-09-17,article,Obituary (Obit),,"['Deaths (Obituaries)', 'News and News Media']",The New York Times,Obits,1762
A New Destination for Dim Sum and Culinary Discipline,2019-09-17,article,Review,,"['Restaurants', 'Chinese Food (Cuisine)']",The New York Times,Dining,1158
The Office: An In-Depth Analysis of Workplace User Behavior,2019-09-17,multimedia,Interactive Feature,,"['Workplace Environment', 'your-feed-work', 'Millennial Generation']",The New York Times,Style,0
Young People Are Going to Save Us All From Office Life,2019-09-17,article,News,,"['Work-Life Balance', 'Paid Time Off', 'Labor and Jobs', 'Millennial Generation', 'Workplace Environment', 'Generation Z', 'your-feed-work']",The New York Times,Styles,2220
Personality Tests Are the Astrology of the Office,2019-09-17,article,News,,"['Hiring and Promotion', 'Workplace Environment', 'Psychology and Psychologists', 'Tests and Examinations', 'your-feed-selfcare', 'your-feed-work']",The New York Times,Styles,2178
The Plight of the Office Introvert,2019-09-17,article,News,,"['Workplace Environment', 'your-feed-selfcare', 'your-feed-work']",The New York Times,Styles,1244
Company Socializing Has Become Work,2019-09-17,article,News,,"['Workplace Environment', 'your-feed-selfcare', 'your-feed-work']",The New York Times,Styles,1140
