headline,date,doc_type,material_type,section,keywords,source,news_desk,word_count
The Coronavirus Bailout Stalled. And It’s Mitch McConnell’s Fault.,2020-03-23,article,Editorial,,"['United States Economy', 'United States Politics and Government', 'Layoffs and Job Reductions', 'Coronavirus (2019-nCoV)', 'Wages and Salaries', 'Stimulus (Economic)', 'Law and Legislation']",The New York Times,Editorial,840
New York Philharmonic Cancels Season Because of Coronavirus,2020-03-23,article,News,,"['Classical Music', 'Coronavirus (2019-nCoV)', 'Shutdowns (Institutional)']",The New York Times,Culture,668
Trump’s Leadership in the Coronavirus Crisis,2020-03-23,article,Letter,,"['Coronavirus (2019-nCoV)', 'Defense Production Act', 'Ventilators (Medical)', 'United States Politics and Government']",The New York Times,Letters,601
The Best Canned Tomatoes,2020-03-23,article,News,,"['Cooking and Cookbooks', 'Tomatoes', 'Organic Foods and Products', 'Coronavirus (2019-nCoV)']",The New York Times,Dining,1025
Party Zero: How a Soirée in Connecticut Became a ‘Super Spreader’,2020-03-23,article,News,,"['Coronavirus (2019-nCoV)', 'Parties (Social)', 'Epidemics', 'Quarantines', 'Shutdowns (Institutional)']",The New York Times,Washington,1577
Grieving the Losses of Coronavirus,2020-03-23,article,News,,"['Grief (Emotion)', 'Coronavirus (2019-nCoV)', 'Anxiety and Stress', 'Quarantines', 'Funerals and Memorials', 'Mental Health and Disorders', 'Death and Dying']",The New York Times,Well,1153
The Wrong Way to Fight Coronavirus,2020-03-23,article,Letter,,"['Coronavirus (2019-nCoV)', 'Quarantines', 'Disabilities', 'Deaths (Fatalities)', 'AMERICANS WITH DISABILITIES ACT', 'Blindness', 'Infrastructure (Public Works)']",The New York Times,Letters,763
"Lil Uzi Vert Holds at No. 1, and Streaming Habits Are Shifting",2020-03-23,article,News,,"['Pop and Rock Music', 'Rap and Hip-Hop', 'Coronavirus (2019-nCoV)']",The New York Times,Culture,324
Local News Outlets Dealt a Crippling Blow by This Biggest of Stories,2020-03-23,article,News,,"['Coronavirus (2019-nCoV)', 'Newspapers', 'Layoffs and Job Reductions', 'News and News Media', 'Online Advertising']",The New York Times,Business,1274
Britain Placed Under a Virtual Lockdown by Boris Johnson,2020-03-23,article,News,,"['Coronavirus (2019-nCoV)', 'Shutdowns (Institutional)', 'Quarantines', 'Politics and Government']",The New York Times,Foreign,1101
"‘The Glass Hotel,’ by Emily St. John Mandel: An Excerpt",2020-03-23,article,Review,,[],The New York Times,BookReview,360
"Boris Stankovic, Who Paved Way for N.B.A.’s ‘Dream Team,’ Dies at 94",2020-03-23,article,Obituary (Obit),,"['Basketball', 'Olympic Games', 'Deaths (Obituaries)']",The New York Times,Obits,1004
An Argumentative-Writing Unit for Students Doing Remote Learning,2020-03-23,article,News,,[],The New York Times,Learning,1747
Dip in Italy’s Cases Does Not Come Fast Enough for Swamped Hospitals,2020-03-23,article,News,,"['Coronavirus (2019-nCoV)', 'Ventilators (Medical)', 'Ethics and Official Misconduct', 'Medical Devices', 'Hospitals', 'Quarantines', 'Epidemics', 'Oxygen', 'Deaths (Fatalities)']",The New York Times,Foreign,1778
Whatever It Takes: How the Fed Aims to Rescue the Economy,2020-03-23,article,News,,"['United States Economy', 'Interest Rates', 'Quantitative Easing', 'Stimulus (Economic)', 'Banking and Financial Institutions', 'Shutdowns (Institutional)', 'Credit and Debt', 'Recession and Depression', 'Coronavirus (2019-nCoV)', 'Layoffs and Job Reductions']",The New York Times,Business,1413
The Coronavirus Revives Facebook as a News Powerhouse,2020-03-23,article,News,,"['News and News Media', 'Social Media', 'Computers and the Internet', 'Coronavirus (2019-nCoV)', 'Rumors and Misinformation']",The New York Times,Business,1381
"Shouting, Finger-Pointing and Threats in a Florida City on Edge",2020-03-23,article,News,,"['Coronavirus (2019-nCoV)', 'Government Employees']",The New York Times,National,931
Man Convicted of Trying to Blow Up Oklahoma City Bank Gets 25 Years in Prison,2020-03-23,article,News,,"['Sentences (Criminal)', 'Bombs and Explosives', 'Terrorism']",The New York Times,Express,621
"As Fox News Played Down the Coronavirus, Its Chief Protected Himself",2020-03-23,article,News,,"['News and News Media', 'Coronavirus (2019-nCoV)', 'Television']",The New York Times,Business,555
Republicans Add Insult to Illness,2020-03-23,article,Op-Ed,,"['Layoffs and Job Reductions', 'United States Politics and Government', 'United States Economy', 'Stimulus (Economic)', 'Recession and Depression', 'Coronavirus (2019-nCoV)']",The New York Times,OpEd,868
"To Help Performers in Need, Funky Videos at Your Fingertips",2020-03-23,article,News,,"['Coronavirus (2019-nCoV)', 'Theater']",The New York Times,Weekend,588
"Coronavirus Relief, PG&E, Woody Allen: Your Monday Evening Briefing",2020-03-23,article,briefing,,[],The New York Times,NYTNow,1012
Rand Paul’s Positive Coronavirus Test Sets the (Still Meeting) Senate on Edge,2020-03-23,article,News,,"['United States Politics and Government', 'Quarantines', 'Coronavirus (2019-nCoV)']",The New York Times,Washington,1204
"Eric Weissberg, ‘Dueling Banjos’ Musician, Dies at 80",2020-03-23,article,Obituary (Obit),,"['Folk Music', 'Banjos', 'Deaths (Obituaries)']",The New York Times,Obits,883
Feeling Powerless About Coronavirus? Join a Mutual-Aid Network,2020-03-23,article,Op-Ed,,"['Coronavirus (2019-nCoV)', 'Computers and the Internet', 'Epidemics', 'Elderly', 'Quarantines']",The New York Times,OpEd,1052
Texas and Ohio Include Abortion as Medical Procedures That Must Be Delayed,2020-03-23,article,News,,"['ABORTION', 'Coronavirus (2019-nCoV)', 'Medicine and Health']",The New York Times,National,818
Why Mundane Moments Truly Matter,2020-03-23,article,News,,"['Writing and Writers', 'Computers and the Internet', 'Psychology and Psychologists']",The New York Times,Smarter Living,1240
Fourteen Days. That’s the Most Time We Have to Defeat Coronavirus.,2020-03-23,article,Op-Ed,,"['Quarantines', 'Shutdowns (Institutional)', 'Coronavirus (2019-nCoV)', 'Shortages', 'Tests (Medical)', 'Ventilators (Medical)', 'United States Economy', 'Defense Production Act', 'Medical Devices', 'Wages and Salaries', 'Hospitals', 'Labor and Jobs', 'Deaths (Fatalities)', 'Unemployment', 'Protective Clothing and Gear']",The New York Times,OpEd,1413
"20-Somethings Now Realizing That They Can Get Coronavirus, Too",2020-03-23,article,News,,"['Coronavirus (2019-nCoV)', 'Age, Chronological', 'Youth', 'Bars and Nightclubs', 'Quarantines']",The New York Times,Metro,1272
"Bankers Pledge Mortgage Help, but Want Billions",2020-03-23,article,News,,"['Mortgages', 'Real Estate and Housing (Residential)', 'Banking and Financial Institutions', 'Mortgage-Backed Securities', 'United States Economy', 'Coronavirus (2019-nCoV)', 'Federal Aid (US)']",The New York Times,Business,1027
"As Coronavirus Cases Add Up, California Frantically Counts Tests, Beds and Masks",2020-03-23,article,News,,"['Coronavirus (2019-nCoV)', 'Ventilators (Medical)', 'Tests (Medical)', 'Hospitals', 'Protective Clothing and Gear', 'Shortages']",The New York Times,National,1736
"In Daily Coronavirus Briefing, Trump Tries to Redefine Himself",2020-03-23,article,News,,"['Coronavirus (2019-nCoV)', 'News and News Media', 'Speeches and Statements', 'United States Politics and Government', 'White House Building (Washington, DC)']",The New York Times,Washington,1346
A Handy Measure,2020-03-23,article,News,,"['Cooking and Cookbooks', 'Weights and Measures']",The New York Times,Dining,126
Meal Kits From the Chef Dan Barber,2020-03-23,article,News,,['Cooking and Cookbooks'],The New York Times,Dining,150
Add a Sprinkle to Breakfast,2020-03-23,article,News,,['Snack Foods'],The New York Times,Dining,185
Japanese Food From a Swedish Kitchen,2020-03-23,article,News,,"['Cooking and Cookbooks', 'Japanese Food (Cuisine)']",The New York Times,Dining,182
Spanish Broths for More Than Paella,2020-03-23,article,News,,['Cooking and Cookbooks'],The New York Times,Dining,109
Density Is New York City’s Big ‘Enemy’ in the Coronavirus Fight,2020-03-23,article,News,,"['Coronavirus (2019-nCoV)', 'Shutdowns (Institutional)', 'Quarantines', 'Population']",The New York Times,Metro,1335
Coronavirus Briefing: What Happened Today,2020-03-23,article,briefing,,['Coronavirus (2019-nCoV)'],The New York Times,NewsDesk,1574
The View From Your Window,2020-03-23,article,News,,['Presidential Election of 2020'],The New York Times,Politics,1796
"At Least 13,500 Americans Abroad Need Help Getting Home, State Dept. Says",2020-03-23,article,News,,"['Coronavirus (2019-nCoV)', 'Evacuations and Evacuees', 'United States Politics and Government', 'Passports', 'Quarantines', 'Cruises']",The New York Times,Washington,820
Webinar Wednesdays: Opportunities for Teachers and Parents on Remote Learning With The Times,2020-03-23,article,News,,[],The New York Times,Learning,174
Call It ‘Coronavirus’,2020-03-23,article,Editorial,,"['Discrimination', 'Coronavirus (2019-nCoV)', 'Politics and Government', 'Chinese-Americans', 'Epidemics', 'Asian-Americans']",The New York Times,Editorial,798
Bored in Quarantine? Here’s a New York Scene You Can Color,2020-03-24,multimedia,Interactive Feature,,['Quarantines'],The New York Times,Opinion,0
"Trump Considers Reopening Economy, Over Health Experts’ Objections",2020-03-24,article,News,,"['United States Economy', 'Quarantines', 'United States Politics and Government', 'Coronavirus (2019-nCoV)', 'Epidemics', 'Shutdowns (Institutional)']",The New York Times,Washington,1988
Here Come the Death Panels,2020-03-24,article,Op-Ed,,"['Coronavirus (2019-nCoV)', 'Patient Protection and Affordable Care Act (2010)', 'Epidemics', 'Health Insurance and Managed Care', 'Rationing and Allocation of Resources', 'Medical Devices', 'Hospitals']",The New York Times,OpEd,899
"Trump Has Given Unusual Leeway to Fauci, but Aides Say He’s Losing His Patience",2020-03-24,article,News,,"['Coronavirus (2019-nCoV)', 'United States Politics and Government', 'Rumors and Misinformation', 'News and News Media']",The New York Times,Washington,1086
"In Pandemic, Justice Dept. Seeks Video Court Hearings and Home Detention",2020-03-24,article,News,,"['Law and Legislation', 'United States Politics and Government', 'Immigration and Emigration', 'Asylum, Right of', 'Coronavirus (2019-nCoV)', 'Illegal Immigration', 'Presidents and Presidency (US)', 'War and Emergency Powers (US)']",The New York Times,Washington,956
Colorado Abolishes Death Penalty and Commutes Sentences of Death Row Inmates,2020-03-24,article,News,,"['Amnesties, Commutations and Pardons', 'Capital Punishment', 'Law and Legislation']",The New York Times,Express,427
Start-Ups Jump the Gun on Home Kits for Coronavirus Testing,2020-03-24,article,News,,"['Tests (Medical)', 'Coronavirus (2019-nCoV)', 'Start-ups', 'Epidemics', 'Medicine and Health', 'Regulation and Deregulation of Industry']",The New York Times,Business,1186
"As Federal Government Mobilizes, Local Officials Say Response Remains Too Slow",2020-03-24,article,News,,"['Disasters and Emergencies', 'Masks', 'Medical Devices', 'Protective Clothing and Gear', 'Shortages', 'Federal-State Relations (US)', 'Coronavirus (2019-nCoV)', 'Hospitals', 'Epidemics', 'Governors (US)']",The New York Times,Washington,1785
Proof That God Loves Us,2020-03-24,article,News,,['Crossword Puzzles'],The New York Times,Games,592
How to Stay Sane When the World Seems Crazy,2020-03-24,article,News,,"['Coronavirus (2019-nCoV)', 'Anxiety and Stress']",The New York Times,Smarter Living,1150
See Which States and Cities Have Told Residents to Stay at Home,2020-03-24,multimedia,Interactive Feature,,['Coronavirus (2019-nCoV)'],The New York Times,U.S.,0
"‘Better Call Saul’ Season 5, Episode 6 Recap: A Modest Proposal",2020-03-24,article,Review,,['Television'],The New York Times,Culture,1241
3 Newspapers Ask China to Reverse Decision to Expel American Journalists,2020-03-24,article,News,,"['News and News Media', 'United States Politics and Government', 'Freedom of the Press']",The New York Times,Business,574
Stocks Surge on Hopes for Economic Rescue Deal,2020-03-24,article,News,,"['Coronavirus (2019-nCoV)', 'Stimulus (Economic)', 'United States Economy', ""Standard & Poor's 500-Stock Index""]",The New York Times,Business,1883
"Corrections: March 24, 2020",2020-03-24,article,Quote,,[],The New York Times,Corrections,387
"Quotation of the Day: Joining Athletes, U.S. Committee Pushes for Delay of Tokyo Games",2020-03-24,article,Quote,,[],The New York Times,Summary,38
Trump Expresses Outrage at Having to ‘Close the Country’ to Slow Virus,2020-03-24,article,News,,"['Coronavirus (2019-nCoV)', 'States (US)']",The New York Times,Foreign,3640
"Man Fatally Poisons Himself While Self-Medicating for Coronavirus, Doctor Says",2020-03-24,article,News,,"['Coronavirus (2019-nCoV)', 'Clinical Trials', 'Quarantines', 'Drugs (Pharmaceuticals)', 'Epidemics']",The New York Times,Express,579
What’s on TV Tuesday: ‘One Day at a Time’ and ‘Council of Dads’,2020-03-24,article,News,,"['Movies', 'Television']",The New York Times,Culture,482
How Trump Sanctions on Iran Will Worsen the Pandemic,2020-03-24,article,Op-Ed,,"['United States International Relations', 'Economic Conditions and Trends', 'Nuclear Weapons', 'Coronavirus (2019-nCoV)', 'Embargoes and Sanctions']",The New York Times,OpEd,846
"Coronavirus, United Kingdom, Disney Plus: Your Tuesday Briefing",2020-03-24,article,briefing,,[],The New York Times,NYTNow,1512
Word + Quiz: fuselage,2020-03-24,article,News,,[],The New York Times,Learning,202
Why Olympic Leaders Clung to the Plan to Have the Summer Games in Tokyo,2020-03-24,article,News,,"['Olympic Games (2020)', 'Coronavirus (2019-nCoV)']",The New York Times,Sports,1072
Welcome to the Virosphere,2020-03-24,article,News,,"['Coronavirus (2019-nCoV)', 'Genetics and Heredity', 'Biodiversity', 'Science and Technology', 'Epidemics', 'Microbiology', 'your-feed-health', 'your-feed-science']",The New York Times,Science,1148
Brady’s Big Move,2020-03-24,article,News,,[],The New York Times,Learning,139
Golf Rounds Surged as Coronavirus Advanced. Now the Game Is Retreating.,2020-03-24,article,News,,"['Golf', 'Coronavirus (2019-nCoV)']",The New York Times,Sports,975
Lesson of the Day: ‘Photos From a Century of Epidemics’,2020-03-24,article,News,,[],The New York Times,Learning,462
‘Unworthy Republic’ Takes an Unflinching Look at Indian Removal in the 1830s,2020-03-24,article,Review,,"['Books and Literature', 'Native Americans']",The New York Times,Culture,935
"Set in a Notorious Prison, a Novel Probes Iran’s Torturers and Their Victims",2020-03-24,article,Review,,['Books and Literature'],The New York Times,BookReview,673
What Does Our Body Temperature Say About Our Health?,2020-03-24,article,News,,"['Medicine and Health', 'Temperature', 'Longevity', 'Fever', 'Coronavirus (2019-nCoV)']",The New York Times,Magazine,1349
How to Harvest Caviar,2020-03-24,article,News,,"['Fish and Other Marine Life', 'Caviar', 'Fish Farming', 'Sturgeon (Fish)']",The New York Times,Magazine,356
"I’m a Calamity Obsessive. After My Trip to Italy, I Was the Calamity.",2020-03-24,multimedia,Interactive Feature,,"['Travel and Vacations', 'Epidemics', 'Coronavirus (2019-nCoV)', 'Quarantines', 'Travel Warnings']",The New York Times,Magazine,0
"The Sometimes Amusing, Sometimes Appalling Life of a Lady-in-Waiting",2020-03-24,article,Review,,"['Books and Literature', 'Royal Families']",The New York Times,BookReview,1030
"New & Noteworthy Visual Books, From Los Angeles Graffiti to Korean Art",2020-03-24,article,News,,"['Books and Literature', 'Art']",The New York Times,BookReview,399
"Getting Through, Making Memories and Being the Grown-Ups",2020-03-24,article,News,,"['Children and Childhood', 'Quarantines', 'Coronavirus (2019-nCoV)', 'Shutdowns (Institutional)']",The New York Times,Well,1305
I Think Sex for Pay Is Wrong. Should I Stay With a Partner Who Disagrees?,2020-03-24,article,News,,"['Dating and Relationships', 'Prostitution', 'Sex', 'Ethics (Personal)']",The New York Times,Magazine,1434
"When a Sinister Enemy Attacks New York, the City Fights Back",2020-03-24,article,Review,,['Books and Literature'],The New York Times,BookReview,1097
The Right Way to Fight Fake News,2020-03-24,article,Op-Ed,,"['Rumors and Misinformation', 'Social Media', 'Psychology and Psychologists']",The New York Times,OpEd,975
Should More Defendants Be Claiming Insanity?,2020-03-24,article,Review,,"['Books and Literature', 'Mental Health and Disorders', 'Criminal Justice']",The New York Times,BookReview,1189
"In a Time of Crisis, Her Voice Was the One That Galvanized Alaska",2020-03-24,article,Review,,['Books and Literature'],The New York Times,BookReview,1213
"Wresting Insight, and Poetry, From Pain",2020-03-24,article,Review,,"['Books and Literature', 'Women and Girls', 'Migraine Headaches']",The New York Times,BookReview,1406
Readers’ Ideas for Finding Community and Cheer at Home,2020-03-24,article,News,,"['Coronavirus (2019-nCoV)', 'Quarantines']",The New York Times,Travel,604
I’m on the Front Lines. I Have No Plan for This.,2020-03-24,article,Op-Ed,,"['Coronavirus (2019-nCoV)', 'Hospitals', 'Quarantines', 'Deaths (Fatalities)']",The New York Times,OpEd,1174
The Comfort of Childhood Media During Lockdown,2020-03-24,article,News,,"['Coronavirus (2019-nCoV)', 'Quarantines', 'Computer and Video Games']",The New York Times,Culture,725
This Is the Face of an Undocumented Immigrant. Don’t Look Away.,2020-03-24,article,Review,,"['Books and Literature', 'Immigration and Emigration', 'Foreign Workers']",The New York Times,BookReview,1284
"Cooking Through a Crisis With Grandma, Virtually",2020-03-24,article,News,,"['Coronavirus (2019-nCoV)', 'Cooking and Cookbooks', 'Grandparents', 'Families and Family Life']",The New York Times,Well,986
"How to Get Money to Small Businesses, Fast",2020-03-24,article,Op-Ed,,"['United States Economy', 'Law and Legislation', 'Debt Collection', 'Small Business', 'Stimulus (Economic)', 'Credit and Debt', 'Layoffs and Job Reductions', 'United States Politics and Government', 'Coronavirus (2019-nCoV)', 'Quarantines']",The New York Times,OpEd,731
Economic Stimulus Is the Wrong Prescription,2020-03-24,article,Op-Ed,,"['United States Economy', 'Recession and Depression', 'Coronavirus (2019-nCoV)']",The New York Times,OpEd,1308
How to See the World When You’re Stuck at Home,2020-03-24,article,News,,"['Travel and Vacations', 'Computers and the Internet', 'Coronavirus (2019-nCoV)']",The New York Times,Travel,2063
Trump Doesn’t Have the Attention Span to Fight Coronavirus,2020-03-24,article,Op-Ed,,"['Presidential Election of 2020', 'Coronavirus (2019-nCoV)', 'United States Politics and Government', 'Recession and Depression']",The New York Times,OpEd,1639
"Stay Vigilant, Says a Curfew Veteran",2020-03-24,article,Op-Ed,,"['Coronavirus (2019-nCoV)', 'Quarantines', 'Curfews', 'Palestinians']",The New York Times,OpEd,1088
Some Pregnant Women in New York City Will Have to Deliver Babies Alone,2020-03-24,article,News,,"['Pregnancy and Childbirth', 'Hospitals', 'Midwives and Doulas', 'Coronavirus (2019-nCoV)', 'Parenting']",The New York Times,Parenting,1504
You’ve Got Mail. Will You Get the Coronavirus?,2020-03-24,article,News,,"['Coronavirus (2019-nCoV)', 'Postal Service and Post Offices', 'Delivery Services', 'SARS (Severe Acute Respiratory Syndrome)', 'Hygiene and Cleanliness', 'Preventive Medicine', 'Plague', 'Epidemics', 'Banking and Financial Institutions', 'Textiles', 'your-feed-science', 'your-feed-health']",The New York Times,Science,1534
Who Should Be Saved First? Experts Offer Ethical Guidance,2020-03-24,article,News,,"['Coronavirus (2019-nCoV)', 'Rationing and Allocation of Resources', 'Shortages', 'Ethics and Official Misconduct', 'Ventilators (Medical)']",The New York Times,Upshot,1166
"Virus Brings States to a Standstill: Sessions Halt, Budgets Crater, Plans Wait",2020-03-24,article,News,,"['Coronavirus (2019-nCoV)', 'State Legislatures', 'Budgets and Budgeting', 'Law and Legislation', 'Politics and Government', 'States (US)', 'Shutdowns (Institutional)']",The New York Times,National,1430
Trump Thinks He Knows Better Than the Doctors About Coronavirus,2020-03-24,article,Op-Ed,,"['United States Economy', 'Quarantines', 'United States Politics and Government', 'Coronavirus (2019-nCoV)', 'Presidential Election of 2020', 'Socialism (Theory and Philosophy)']",The New York Times,OpEd,1100
‘I Just Don’t Think We Have the Luxury to Have Dreams Anymore’,2020-03-24,article,Op-Ed,,"['Millennial Generation', 'Generation Z', 'United States Economy', 'Recession and Depression', 'Colleges and Universities', 'Income Inequality', 'Coronavirus (2019-nCoV)']",The New York Times,OpEd,1158
Is Marijuana an ‘Essential’ Like Milk or Bread? Some States Say Yes,2020-03-24,article,News,,"['Marijuana', 'Medical Marijuana', 'Coronavirus (2019-nCoV)', 'Quarantines', 'Stockpiling', 'States (US)', 'Shopping and Retail']",The New York Times,National,998
Nearly a Million Children Left Behind in Venezuela as Parents Migrate,2020-03-24,article,News,,"['Children and Childhood', 'Women and Girls', 'Immigration and Emigration', 'Foreign Workers', 'Refugees and Displaced Persons', 'Parenting', 'Families and Family Life']",The New York Times,Foreign,1626
"One City’s Road to Recovery Offers Lessons, and Hope",2020-03-24,article,News,,"['Economic Conditions and Trends', 'Area Planning and Renewal', 'Urban Areas', 'Labor and Jobs', 'Small Business', 'Vocational Training', 'Real Estate and Housing (Residential)', 'Factories and Manufacturing', 'Coronavirus (2019-nCoV)']",The New York Times,Business,1640
A Medical Class ‘Minted by the Pandemic’,2020-03-24,article,News,,"['Coronavirus (2019-nCoV)', 'Medical Schools', 'Doctors', 'Shortages', 'Hospitals', 'Labor and Jobs', 'your-feed-science', 'your-feed-health']",The New York Times,Science,1279
Should Public Preschool Be a Right for All Children?,2020-03-24,article,News,,[],The New York Times,Learning,862
"‘The City We Became,’ by N.K. Jemisin: An Excerpt",2020-03-24,article,Review,,[],The New York Times,BookReview,3450
"For Drive-In Theaters, an Unexpected Revival",2020-03-24,article,News,,"['Movies', 'Drive-in Theaters', 'Shutdowns (Institutional)', 'Coronavirus (2019-nCoV)']",The New York Times,Styles,1477
"Falling Ill, Testing Negative",2020-03-24,article,Op-Ed,,"['Quarantines', 'Coronavirus (2019-nCoV)', 'Fever']",The New York Times,OpEd,1201
A Teardown? Not Even Close,2020-03-24,multimedia,Slideshow,,"['Real Estate and Housing (Residential)', 'Restoration and Renovation', 'Home Repairs and Improvements', 'Interior Design and Furnishings', 'Furniture']",The New York Times,Real Estate,0
"Instead of Tearing It Down, They Rescued It",2020-03-24,article,News,,"['Real Estate and Housing (Residential)', 'Interior Design and Furnishings', 'Home Repairs and Improvements', 'Restoration and Renovation']",The New York Times,RealEstate,871
"Facebook, Don’t Exploit Us in Our Time of Need",2020-03-24,article,Op-Ed,,"['Social Media', 'Data-Mining and Database Marketing', 'Computers and the Internet', 'Epidemics', 'Privacy', 'Coronavirus (2019-nCoV)']",The New York Times,OpEd,1019
"Coronavirus, Anthony Fauci, Olympics: Your Tuesday Briefing",2020-03-24,article,briefing,,[],The New York Times,NYTNow,1491
"Virus Cases Approaching 21,000 in N.Y.",2020-03-24,article,briefing,,"['Coronavirus (2019-nCoV)', 'Tests (Medical)', 'Ventilators (Medical)', 'Medical Devices', 'Quarantines']",The New York Times,Metro,1227
Why the American Approach Is Failing,2020-03-24,article,News,,"['Coronavirus (2019-nCoV)', 'Quarantines']",The New York Times,Podcasts,273
"As the Coronavirus Approaches, Mexico Looks the Other Way",2020-03-24,multimedia,Video,,"['Coronavirus (2019-nCoV)', 'Ventilators (Medical)', 'Medical Devices', 'Deaths (Fatalities)', 'Epidemics']",The New York Times,,0
Is Pausing Contributions to SEP I.R.A.s a Good Move?,2020-03-24,article,News,,"['Individual Retirement Accounts', 'Coronavirus (2019-nCoV)', 'Federal Taxes (US)', 'Personal Finances', 'Pensions and Retirement Plans', 'Freelancing, Self-Employment and Independent Contracting']",The New York Times,Business,365
Turning Back the Clock on Aging Cells,2020-03-24,article,News,,"['Genetics and Heredity', 'Osteoarthritis', 'Proteins', 'your-feed-health', 'your-feed-science']",The New York Times,Science,685
Rome’s Homeless Don’t Have the Luxury of Staying Home,2020-03-24,article,News,,"['Coronavirus (2019-nCoV)', 'Homeless Persons', 'Quarantines', 'Hygiene and Cleanliness', 'Soup Kitchens', 'Volunteers and Community Service', 'Deaths (Fatalities)']",The New York Times,Foreign,655
Restarting the Economy Is About Lives Versus Livelihoods,2020-03-24,article,News,,"['United States Economy', 'Stimulus (Economic)', 'Shutdowns (Institutional)', 'Coronavirus (2019-nCoV)']",The New York Times,Business,1251
On Politics: The Economy Won’t Distance,2020-03-24,article,News,,"['Presidential Election of 2020', 'Quarantines']",The New York Times,Politics,761
White House Tells Travelers From New York to Isolate as City Cases Soar,2020-03-24,article,News,,"['Coronavirus (2019-nCoV)', 'Tests (Medical)']",The New York Times,Metro,1803
Real Estate’s Spring Sales Season Slows to a Trickle,2020-03-24,article,News,,"['Real Estate and Housing (Residential)', 'Spring (Season)', 'Real Estate Brokers', 'Coronavirus (2019-nCoV)']",The New York Times,RealEstate,1041
"Cathy Yan on the Rerelease of ‘Birds of Prey,’ the Harley Quinn Movie",2020-03-24,article,News,,['Movies'],The New York Times,Culture,1687
"A Good Death Is a Rite of Irish Life. Amid Coronavirus, That Looks Different.",2020-03-24,article,News,,"['Funerals and Memorials', 'Families and Family Life', 'Coronavirus (2019-nCoV)']",The New York Times,Foreign,1169
