headline,date,doc_type,material_type,section,keywords,source,news_desk,word_count
"Hurricane Sally, Masks, Chris Rock: Your Wednesday Evening Briefing",2020-09-16,article,briefing,,[],The New York Times,NYTNow,1202
Does Wearing Glasses Protect You From Coronavirus?,2020-09-16,article,News,,"['Eyes and Eyesight', 'Eyeglasses', 'Coronavirus (2019-nCoV)', 'Face', 'Protective Clothing and Gear']",The New York Times,Well,966
Guggenheim Cuts Staff by 11 Percent Ahead of Reopening,2020-09-16,article,News,,"['Layoffs and Job Reductions', 'Museums', 'Art', 'Coronavirus (2019-nCoV)']",The New York Times,Culture,460
Hurricane Sally’s Fierce Rain Shows How Climate Change Raises Storm Risks,2020-09-16,article,News,,"['Global Warming', 'Environment', 'Hurricane Sally (2020)', 'Rain']",The New York Times,Climate,798
Inquiry Ordered Into Claims Immigrants Had Unwanted Gynecology Procedures,2020-09-16,article,News,,"['Immigration Detention', 'Hysterectomies', 'Uterus', 'Malpractice', 'Surgery and Surgeons', 'Women and Girls', 'Whistle-Blowers']",The New York Times,National,1189
Candace Parker Wants You to Know She’s Not Done Yet,2020-09-16,article,News,,['Basketball'],The New York Times,Sports,1254
Let Trump Be Trump?,2020-09-16,article,News,,"['Presidential Election of 2020', 'Polls and Public Opinion']",The New York Times,Politics,1119
Backlash Grows to TikTok-Oracle Deal,2020-09-16,article,News,,"['United States Politics and Government', 'Social Media', 'Executive Orders and Memorandums', 'Computers and the Internet', 'Foreign Investments', 'Mergers, Acquisitions and Divestitures']",The New York Times,Washington,1071
"Biden, Seizing on Worries of a Rushed Vaccine, Warns Trump Can’t Be Trusted",2020-09-16,article,News,,"['Coronavirus (2019-nCoV)', 'Vaccination and Immunization', 'Presidential Election of 2020']",The New York Times,Politics,864
"A Cataclysm of Hunger, Disease and Illiteracy",2020-09-16,article,Op-Ed,,"['Coronavirus (2019-nCoV)', 'Food Insecurity', 'Poverty', 'Coronavirus Aid, Relief, and Economic Security Act (2020)', 'Women and Girls', 'Third World and Developing Countries', 'Shutdowns (Institutional)', 'Malnutrition', 'Illiteracy', 'Unemployment']",The New York Times,OpEd,946
Coronavirus Briefing: What Happened Today,2020-09-16,article,briefing,,['Coronavirus (2019-nCoV)'],The New York Times,NYTNow,1095
"In the Big Ten, Football Gets to Play by Its Own Rules",2020-09-16,article,News,,['Football (College)'],The New York Times,Sports,1003
Trump’s Middle East Deal Is Good. But Not That Good.,2020-09-16,article,Editorial,,"['United States International Relations', 'International Relations', 'Palestinians']",The New York Times,Editorial,915
"Presidentially, Two Parties Is Plenty",2020-09-17,article,Op-Ed,,"['Third-Party Politics (US)', 'Presidential Election of 2020', 'United States Politics and Government', 'Elections, Senate', 'Voting and Voters', 'Libertarianism (US Politics)']",The New York Times,OpEd,932
Officer Who Ordered Police Dog to Bite a Black Man Is Charged With Assault,2020-09-17,article,News,,"['Police Brutality, Misconduct and Shootings', 'Dogs']",The New York Times,Express,869
Is TikTok a Music Industry Friend or Troll?,2020-09-17,article,News,,"['Music', 'Social Media']",The New York Times,Culture,142
Trump Scorns His Own Scientists Over Virus Data,2020-09-17,article,News,,"['Coronavirus (2019-nCoV)', 'Masks', 'Vaccination and Immunization', 'Presidential Election of 2020', 'United States Politics and Government']",The New York Times,Washington,1719
Hurricane Sally Slams the Florida Panhandle With Deluge of Rain,2020-09-17,article,News,,"['Hurricane Sally (2020)', 'Floods', 'Wind', 'Rescues']",The New York Times,National,1459
It’s a Wrap,2020-09-17,article,News,,['Crossword Puzzles'],The New York Times,Games,1111
U.S. Prosecutors’ Bid to ‘Bury’ Evidence Draws Judge’s Wrath,2020-09-17,article,News,,"['Decisions and Verdicts', 'Prosecutorial Misconduct', 'United States Attorneys', 'Embargoes and Sanctions', 'United States Politics and Government', 'United States International Relations']",The New York Times,Metro,896
"Europe’s Economy, German Police, China: Your Thursday Briefing",2020-09-17,article,briefing,,[],The New York Times,National,1634
"Corrections: Sept. 17, 2020",2020-09-17,article,Correction,,[],The New York Times,Corrections,131
Quotation of the Day: Saudi Strikes in Yemen Put U.S. in Danger of War Crime Charges,2020-09-17,article,Quote,,[],The New York Times,Summary,46
N.F.L. Week 2 Predictions: Our Picks Against the Spread,2020-09-17,article,News,,['Football'],The New York Times,Sports,2463
"Military Police Considered Using Heat Ray on White House Protesters, Whistle-Blower Says",2020-09-17,article,News,,"['Demonstrations, Protests and Riots', 'George Floyd Protests (2020)', 'United States Politics and Government', 'United States Defense and Military Forces']",The New York Times,Washington,758
What Trump’s Environmental Rollbacks Mean for Global Warming,2020-09-17,multimedia,Interactive Feature,,"['Greenhouse Gas Emissions', 'Air Pollution', 'Methane']",The New York Times,Climate,0
Word + Quiz: aphasia,2020-09-17,article,News,,[],The New York Times,Learning,240
Barr Defends Right to Intrude in Cases as He Sees Fit,2020-09-17,article,News,,"['United States Politics and Government', 'Russian Interference in 2016 US Elections and Ties to Trump Associates', 'Attorneys General']",The New York Times,Washington,934
The iPhone,2020-09-17,article,News,,[],The New York Times,Learning,180
"Martha Stewart, Blissed Out on CBD, Is Doing Just Fine",2020-09-17,article,News,,"['Cannabis Foods and Products', 'Quarantine (Life and Culture)']",The New York Times,Styles,1935
New-Era Golfers Prepare to Be Humbled at Winged Foot,2020-09-17,article,News,,"['Golf', 'United States Open (Golf)']",The New York Times,Sports,853
A Desperate Bid for Survival as Fire Closed In on an Oregon Mountain Town,2020-09-17,article,News,,"['Wildfires', 'Evacuations and Evacuees', 'Rescues', 'Fires and Firefighters']",The New York Times,National,1786
Stephen Colbert Can’t Believe There Are Undecided Voters,2020-09-17,article,News,,[],The New York Times,Culture,624
Lesson of the Day: ‘The Complex History of the Women’s Suffrage Movement’,2020-09-17,article,News,,[],The New York Times,Learning,907
Judge John Hodgman on Hollering Around the House,2020-09-17,article,News,,['Comedy and Humor'],The New York Times,Magazine,150
Do Your Parents Overpraise You?,2020-09-17,article,News,,[],The New York Times,Learning,730
Why Michael Ian Black Doesn’t Like Mystery Novels,2020-09-17,article,News,,"['Books and Literature', 'Writing and Writers']",The New York Times,BookReview,2179
"Florida Was Nice, but This Couple Was Ready to Come Home to New York",2020-09-17,multimedia,Interactive Feature,,['Real Estate and Housing (Residential)'],The New York Times,Real Estate,0
Revisiting the ‘Violent Ballets’ of Jack Kirby,2020-09-17,article,News,,"['Books and Literature', 'Comic Books and Strips', 'Graphic Novels']",The New York Times,BookReview,1078
The Back Story Behind ‘Transcendent Kingdom’: Yaa Gyasi Is a Solid Friend,2020-09-17,article,List,,"['Books and Literature', 'Writing and Writers']",The New York Times,BookReview,427
"When the Economy Stalled, They Needed Laptops to Move Ahead",2020-09-17,article,News,,[],The New York Times,Metro,956
How Covid Has Altered the Conversation About Money,2020-09-17,article,News,,"['Coronavirus (2019-nCoV)', 'Marriages', 'Women and Girls', 'Personal Finances']",The New York Times,Styles,1427
"In an Unlikely Covid Survivor’s Case, More Questions Than Answers",2020-09-17,article,News,,"['Coronavirus (2019-nCoV)', 'Hospitals', 'Lungs', 'Doctors', 'Therapy and Rehabilitation']",The New York Times,Well,1419
How to Get a Virus Test in N.Y.C. Without Waiting for Hours,2020-09-17,article,News,,"['Tests (Medical)', 'Coronavirus (2019-nCoV)', 'Teachers and School Employees', 'Content Type: Service', 'Education (K-12)', 'Coronavirus Reopenings', 'Parenting']",The New York Times,Metro,927
What’s at Stake in This Election? The American Democratic Experiment,2020-09-17,article,Op-Ed,,"['Presidential Election of 2020', 'Presidential Elections (US)', 'United States Politics and Government']",The New York Times,OpEd,915
Should We Fast-Track a Vaccine for the Coronavirus?,2020-09-17,article,Op-Ed,,"['Coronavirus (2019-nCoV)', 'Medicine and Health', 'Vaccination and Immunization']",The New York Times,OpEd,713
I’m a Muslim and Arab American. Will I Ever Be an Equal Citizen?,2020-09-17,article,News,,"['Muslim Americans', 'Discrimination', 'Race and Ethnicity', 'Immigration and Emigration', 'Citizenship and Naturalization', 'United States Politics and Government']",The New York Times,Magazine,4319
A $1.5 Trillion Compromise Democrats Can’t Ignore,2020-09-17,article,Op-Ed,,"['United States Economy', 'United States Politics and Government', 'Unemployment', 'Labor and Jobs', 'Coronavirus (2019-nCoV)']",The New York Times,OpEd,894
Navigating the Emotional Turf of Fall Family Gatherings,2020-09-17,article,News,,"['Coronavirus Risks and Safety Concerns', 'Content Type: Service', 'Holidays and Special Occasions', 'Coronavirus (2019-nCoV)', 'Families and Family Life', 'Thanksgiving Day', 'Quarantine (Life and Culture)']",The New York Times,Well,1477
I Am Not a Brave Person. I Am Also Patient 1133.,2020-09-17,article,Op-Ed,,"['Vaccination and Immunization', 'Hospitals', 'Coronavirus (2019-nCoV)', 'Clinical Trials']",The New York Times,OpEd,993
Trump’s Secret Health Plan Is a Promise Voters Have Heard Before,2020-09-17,article,News,,"['Health Insurance and Managed Care', 'Patient Protection and Affordable Care Act (2010)', 'Presidential Election of 2020', 'United States Politics and Government']",The New York Times,Washington,1553
Poem: Late,2020-09-17,article,News,,"['Poetry and Poets', 'Emancipation Proclamation (1863)']",The New York Times,Magazine,287
Small Tech Stocks Soar as the Future Arrives Early,2020-09-17,article,News,,"['Stocks and Bonds', 'E-Commerce', 'Computers and the Internet', 'Coronavirus (2019-nCoV)', 'Quarantine (Life and Culture)']",The New York Times,Business,1037
‘Antebellum’ and the Horrors of History That Persist Today,2020-09-17,article,News,,"['Movies', 'Black People', 'Blacks', 'Race and Ethnicity', 'Black Lives Matter Movement']",The New York Times,Arts&Leisure,1463
Saying Goodbye to Century 21,2020-09-17,article,News,,"['Shopping and Retail', 'Fashion and Apparel', 'Shutdowns (Institutional)', 'Discount Selling', 'Bankruptcies']",The New York Times,Styles,656
Senate Democrats Present $350 Billion Strategy to Counter China,2020-09-17,article,News,,"['United States International Relations', 'United States Politics and Government', 'Science and Technology']",The New York Times,Washington,810
Is This the End of the New York Yoga Studio?,2020-09-17,article,News,,"['Yoga', 'Shutdowns (Institutional)', 'Small Business', 'Renting and Leasing (Real Estate)', 'Coronavirus (2019-nCoV)', 'Quarantine (Life and Culture)']",The New York Times,Metropolitan,1688
Charge That Maxwell ‘Groomed’ Girls for Epstein Is Central to Case,2020-09-17,article,News,,"['#MeToo Movement', 'Prostitution', 'Sex Crimes', 'Women and Girls']",The New York Times,Metro,1368
This Is How Bad It’s Gotten at the Justice Department,2020-09-17,article,Op-Ed,,"['Presidents and Presidency (US)', 'Russian Interference in 2016 US Elections and Ties to Trump Associates', 'Trump-Ukraine Whistle-blower Complaint and Impeachment Inquiry', 'Presidential Election of 2020', 'United States Politics and Government', 'Appointments and Executive Changes']",The New York Times,OpEd,1037
A College Football Conference Can Choose Players Over Profits for a Change,2020-09-17,article,News,,"['Football (College)', 'Coronavirus Reopenings', 'Coronavirus (2019-nCoV)', 'Disease Rates']",The New York Times,Sports,1014
"Private Tutors, Pop-Up Schools or Nothing at All: How Employers Are Helping Parents",2020-09-17,article,News,,"['Quarantine (Life and Culture)', 'Paid Time Off', 'E-Learning', 'Employee Fringe Benefits', 'Coronavirus (2019-nCoV)', 'Labor and Jobs', 'Child Care', 'Parenting']",The New York Times,Upshot,1282
Does Biden Need a Higher Gear? Some Democrats Think So,2020-09-17,article,News,,"['States (US)', 'Voting and Voters', 'Polls and Public Opinion', 'Presidential Election of 2020', 'United States Politics and Government']",The New York Times,Politics,1662
Why French Politicians Can’t Stop Talking About Crime,2020-09-17,article,News,,"['Politics and Government', 'Elections', 'Crime and Criminals', 'Demonstrations, Protests and Riots', 'Immigration and Emigration', 'Race and Ethnicity']",The New York Times,Foreign,1558
Fall’s Here. Can We Still Go Apple Picking?,2020-09-17,article,News,,"['Labyrinths and Mazes', 'Autumn (Season)', 'Agriculture and Farming', 'Halloween', 'APPLES', 'Travel and Vacations', 'Pumpkins', 'Wines']",The New York Times,Travel,2074
Inside One N.F.L. Team’s Attempt to Turn Protest Into Action,2020-09-17,article,News,,"['Football', 'Black Lives Matter Movement', 'Black People', 'Blacks', 'George Floyd Protests (2020)', 'United States National Anthem Protests (2016- )', 'Voter Registration and Requirements', 'Voting and Voters', 'Presidential Election of 2020']",The New York Times,Sports,1807
He Killed a Transgender Woman in the Philippines. Why Was He Freed?,2020-09-17,article,News,,"['United States Defense and Military Forces', 'Amnesties, Commutations and Pardons', 'Military Bases and Installations', 'Transgender and Transsexuals', 'Murders, Attempted Murders and Homicides', 'United States International Relations', 'Treaties']",The New York Times,Magazine,2300
"Unable to Pay Rent, Small Businesses Hope for a Deal With Their Landlord",2020-09-17,article,News,,"['Shutdowns (Institutional)', 'Renting and Leasing (Real Estate)', 'Landlords', 'Shopping and Retail', 'Coronavirus Reopenings', 'Restaurants', 'Credit and Debt', 'Small Business', 'Coronavirus (2019-nCoV)', 'Coronavirus Aid, Relief, and Economic Security Act (2020)']",The New York Times,Business,1499
A New Ship’s Mission: Let the Deep Sea Be Seen,2020-09-17,article,News,,"['Oceans and Seas', 'Ships and Shipping', 'Fish and Other Marine Life', 'Science and Technology', 'Oil (Petroleum) and Gasoline', 'Robots and Robotics', 'Diving and Divers', 'Documentary Films and Programs', 'your-feed-science']",The New York Times,Science,1439
Trump Is Wrong About TikTok. China’s Plans Are Much More Sinister.,2020-09-17,article,Op-Ed,,"['United States International Relations', 'Embargoes and Sanctions', '5G (Wireless Communications)', 'Propaganda', 'Computers and the Internet', 'Blacklisting', 'United States Politics and Government', 'Military Bases and Installations', 'Espionage and Intelligence Services', 'Mobile Applications']",The New York Times,OpEd,1472
The Evangelicals Who Are Taking On QAnon,2020-09-17,article,Op-Ed,,"['Conspiracy Theories', 'QAnon', 'Evangelical Movement', 'Whites', 'United States Politics and Government']",The New York Times,OpEd,1371
C.D.C.’s Contentious Testing Guidance on Covid-19 Was Not Written by Its Scientists,2020-09-17,article,News,,['Coronavirus (2019-nCoV)'],The New York Times,Foreign,4847
"Aleksei Navalny Was Poisoned at His Hotel, His Team Says",2020-09-17,article,News,,"['Biological and Chemical Warfare', 'Poisoning and Poisons', 'Politics and Government', 'Assassinations and Attempted Assassinations']",The New York Times,Foreign,858
A ‘Textbook Example’ of a College Outbreak in N.Y.,2020-09-17,article,briefing,,"['Coronavirus Reopenings', 'Colleges and Universities', 'Museums', 'Art']",The New York Times,Metro,1369
Obama’s Memoir ‘A Promised Land’ Coming in November,2020-09-17,article,News,,"['Books and Literature', 'Book Trade and Publishing', 'United States Politics and Government']",The New York Times,Books,662
The Forgotten Refugee Crisis in Europe,2020-09-17,article,News,,"['Middle East and Africa Migrant Crisis', 'Immigration and Emigration', 'Refugees and Displaced Persons']",The New York Times,Podcasts,366
A Car Insurance Claim Estimate Before the Tow Truck Is Called,2020-09-17,article,News,,"['Automobile Insurance and Liability', 'Traffic Accidents and Safety', 'Artificial Intelligence', 'Computer Vision', 'Mobile Applications']",The New York Times,Business,1292
Many business owners are too deeply in debt to survive without rent concessions.,2020-09-17,article,News,,[],The New York Times,Business,289
The College Money Crisis,2020-09-17,article,briefing,,[],The New York Times,NYTNow,1620
Nobody Knows What’s Happening With TikTok,2020-09-17,article,News,,"['Mergers, Acquisitions and Divestitures', 'Coronavirus (2019-nCoV)', 'Initial Public Offerings']",The New York Times,Business,2348
‘Alone’ Review: Catch Her if You Can,2020-09-17,article,Review,,['Movies'],The New York Times,Weekend,303
‘Residue’ Review: When the Old Neighborhood Is No Longer Yours,2020-09-17,article,Review,,['Movies'],The New York Times,Weekend,394
"‘The Nest’ Review: New Home, Old Wounds",2020-09-17,article,Review,,['Movies'],The New York Times,Weekend,309
"‘I’ve Got Issues’ Review: Seeking a Point, Starting to Break",2020-09-17,article,Review,,['Movies'],The New York Times,Weekend,262
‘Blackbird’ Review: The Goodbye Girl,2020-09-17,article,Review,,['Movies'],The New York Times,Weekend,329
‘A Chef’s Voyage’ Review: Not the Freshest Ingredients,2020-09-17,article,Review,,"['Documentary Films and Programs', 'Chefs']",The New York Times,Weekend,248
‘God of the Piano’ Review: How Far Will Mother Go?,2020-09-17,article,Review,,['Movies'],The New York Times,Weekend,322
‘The Way I See It’ Review: Hailing Days Not Too Far Past,2020-09-17,article,Review,,"['Documentary Films and Programs', 'United States Politics and Government', 'Photography']",The New York Times,Weekend,331
Trump Hits Out at the C.D.C. Director,2020-09-17,article,News,,"['Coronavirus (2019-nCoV)', 'Vaccination and Immunization', 'Presidential Election of 2020']",The New York Times,Politics,1050
Small tech stocks are posting eye-popping gains.,2020-09-17,article,News,,[],The New York Times,Business,280
First the Pandemic. Now the Storm. Gulf Shores High School Can’t Catch a Break.,2020-09-17,article,News,,['Hurricane Sally (2020)'],The New York Times,National,1054
"In a Fitting Tribute, the Fed Cup Is Renamed After Billie Jean King",2020-09-17,article,News,,['Tennis'],The New York Times,Sports,1264
Fall Fashion With Personality,2020-09-17,article,News,,['Fashion and Apparel'],The New York Times,TStyle,76
Trump scorns his own scientists over coronavirus data.,2020-09-17,article,News,,[],The New York Times,Politics,373
Here’s where the candidates will be today.,2020-09-17,article,News,,[],The New York Times,Politics,108
Ohio’s secretary of state challenges a court ruling allowing more ballot drop boxes.,2020-09-17,article,News,,[],The New York Times,Politics,382
"Warning of Russian disinformation, Senate Democrats tried to squelch Republicans’ report on Hunter Biden.",2020-09-17,article,News,,[],The New York Times,Politics,243
Does Biden need a higher gear? Some Democrats think so.,2020-09-17,article,News,,[],The New York Times,Politics,305
Expect vote-by-mail fireworks today as the postmaster general talks with dozens of secretaries of state.,2020-09-17,article,News,,[],The New York Times,Politics,302
McClatchy’s 30 newspapers probably won’t be endorsing this year.,2020-09-17,article,News,,[],The New York Times,Politics,327
Opera Star Anna Netrebko Is Hospitalized With Covid-19,2020-09-17,article,News,,"['Opera', 'Coronavirus (2019-nCoV)']",The New York Times,Culture,708
"U.S. Official Visits Taiwan, and China Warns of Consequences",2020-09-17,article,News,,"['Defense and Military Forces', 'United States Defense and Military Forces', 'United States International Relations']",The New York Times,Foreign,1047
Moderna and Pfizer Reveal Secret Blueprints for Coronavirus Vaccine Trials,2020-09-17,article,News,,"['Coronavirus (2019-nCoV)', 'Vaccination and Immunization', 'Clinical Trials']",The New York Times,Science,1745
Taking Stock After a Historic Month of Fire,2020-09-17,article,briefing,,['Wildfires'],The New York Times,National,1055
"China’s Communists to Private Business: You Heed Us, We’ll Help You",2020-09-17,article,News,,"['Politics and Government', 'Economic Conditions and Trends', 'Entrepreneurship']",The New York Times,Business,1307
A wave of job searches has yet to come.,2020-09-17,article,News,,[],The New York Times,Business,247
"‘Two steps backward.’ With jobless pay but still no job, financial stress takes a toll.",2020-09-17,article,News,,[],The New York Times,Business,263
What Can I Say to the ‘QAnon Mom’ Next Door?,2020-09-17,article,News,,"['Customs, Etiquette and Manners', 'Content Type: Service']",The New York Times,Styles,868
The T List: Five Things We Recommend This Week,2020-09-17,article,News,,"['Sunglasses', 'Hotels and Travel Lodgings', 'Photography']",The New York Times,TStyle,1008
The New Apple Watch Measures Your Blood Oxygen. Now What?,2020-09-17,article,News,,"['Wearable Computing', 'Watches and Clocks', 'Oxygen', 'Coronavirus (2019-nCoV)', 'Sleep', 'Content Type: Service', 'Pulse Oximetry']",The New York Times,Business,971
Art About Waiting — and What It Takes to Endure,2020-09-17,article,News,,"['Art', 'Quarantine (Life and Culture)', 'Theater', 'Museums']",The New York Times,TStyle,2456
On the Market in the New York Region,2020-09-17,multimedia,Slideshow,,['Real Estate and Housing (Residential)'],The New York Times,Real Estate,0
On the Market in New York City,2020-09-17,multimedia,Slideshow,,['Real Estate and Housing (Residential)'],The New York Times,Real Estate,0
"Homes for Sale in Manhattan, Brooklyn and Queens",2020-09-17,article,News,,['Real Estate and Housing (Residential)'],The New York Times,RealEstate,144
Homes for Sale in New York and Connecticut,2020-09-17,article,News,,['Real Estate and Housing (Residential)'],The New York Times,RealEstate,132
"For a working couple, one income isn’t enough to keep the 401(k) intact.",2020-09-17,article,News,,[],The New York Times,Business,319
Wildfires Are Among 4 Recent Disasters Costing at Least $1 Billion,2020-09-17,article,News,,"['Fires and Firefighters', 'Wildfires', 'Rescues', 'Rumors and Misinformation']",The New York Times,National,2506
Obama is publishing the first half of his memoir right after the election.,2020-09-17,article,News,,[],The New York Times,Politics,394
The Most Popular Listings of August,2020-09-17,article,News,,['Real Estate and Housing (Residential)'],The New York Times,RealEstate,323
Deal Reached in N.J. for ‘Millionaires Tax’ to Address Fiscal Crisis,2020-09-17,article,News,,"['Income Tax', 'High Net Worth Individuals', 'Income Inequality', 'Budgets and Budgeting', 'State Legislatures', 'Politics and Government', 'Coronavirus (2019-nCoV)', 'Coronavirus Aid, Relief, and Economic Security Act (2020)']",The New York Times,Metro,1428
Lindsey Graham says Comey will testify before a Senate committee the day after the first presidential debate.,2020-09-17,article,News,,[],The New York Times,Politics,184
"On This Island, Everyone Knows Your Name (if You Have Covid-19)",2020-09-17,article,News,,"['Coronavirus (2019-nCoV)', 'Contact Tracing (Public Health)', 'Gossip', 'Masks']",The New York Times,Foreign,1196
19 Ways to Teach the 100th Anniversary of the 19th Amendment,2020-09-17,article,News,,[],The New York Times,Learning,6188
Steel Timepieces That Are Built to Last,2020-09-17,article,News,,['Watches and Clocks'],The New York Times,TStyle,0
"Róisín Murphy, a Disco Queen Ruling Her Own Galaxy",2020-09-17,article,News,,['Pop and Rock Music'],The New York Times,Arts&Leisure,1763
Police Move Migrants From Greek Camp to Temporary Lesbos Site After Fires,2020-09-17,article,News,,"['Middle East and Africa Migrant Crisis', 'Refugees and Displaced Persons']",The New York Times,Foreign,671
"Election results will take longer, but not because of ‘unsolicited ballots,’ despite Trump’s claims.",2020-09-17,article,News,,[],The New York Times,Politics,544
"The Van Gundy Brothers Walk, Talk and Bond in the N.B.A. Bubble",2020-09-17,article,News,,"['Basketball', 'Television']",The New York Times,Sports,1034
N.Y.C. Will Again Delay Start of In-Person Classes for Most Students,2020-09-17,article,News,,"['Coronavirus (2019-nCoV)', 'Education (K-12)', 'Coronavirus Reopenings']",The New York Times,Metro,1657
A Climate Center on Governors Island? Could Be a Game Changer,2020-09-17,article,News,,"['Global Warming', 'Historic Buildings and Sites', 'ARCHITECTURE', 'Zoning', 'Area Planning and Renewal']",The New York Times,Culture,1106
A September Wine Romance,2020-09-17,article,News,,"['Wines', 'Grapes', 'Autumn (Season)', 'Beaujolais Wine', 'Customs (Tariff)']",The New York Times,Dining,1678
"Racing Fire Truck Hits Ambulance, Killing Patient",2020-09-17,article,News,,"['Traffic Accidents and Safety', 'Deaths (Fatalities)', 'Fires and Firefighters', 'AMBULANCES', 'Emergency Medical Treatment']",The New York Times,Metro,715
Reproductive Life Span May Affect a Woman’s Heart Risks,2020-09-17,article,News,,"['Heart', 'Menopause', 'Women and Girls', 'Reproduction (Biological)']",The New York Times,Well,234
"Alicia Keys Has Passion, Advice and Aplomb on ‘Alicia’",2020-09-17,article,Review,,['RHYTHM AND BLUES (MUSIC)'],The New York Times,Weekend,663
‘H Is for Happiness’ Review: Using Fuss to Fight Off a Funk,2020-09-17,article,Review,,['Movies'],The New York Times,Weekend,276
Advice from Home-Schooling Parents for Remote Learning,2020-09-17,multimedia,Interactive Feature,,"['Content Type: Service', 'Home Schooling', 'Parenting']",The New York Times,Parenting,0
