headline,date,doc_type,material_type,section,keywords,source,news_desk,word_count
Why Would a Grown Man Play With Toy Soldiers?,2020-09-09,article,News,,"['Quarantine (Life and Culture)', 'Hobbies']",The New York Times,Magazine,934
Doctor Dolittle’s Talking Animals Still Have Much to Say,2020-09-09,article,News,,"['Books and Literature', 'ANIMALS', 'Children and Childhood']",The New York Times,BookReview,1304
How Should We Balance Safety and Urgency in Developing a Covid-19 Vaccine?,2020-09-09,article,News,,[],The New York Times,Learning,1172
Exercise May Make It Easier to Bounce Back From Stress,2020-09-09,article,News,,"['Anxiety and Stress', 'Mental Health and Disorders', 'Exercise', 'Running', 'Mice', 'Rats', 'Research']",The New York Times,Well,859
The Best Answer to Chaos in Bolivia Is Socialism,2020-09-09,article,Op-Ed,,"['Lithium (Metal)', 'Human Rights and Human Rights Violations']",The New York Times,OpEd,995
"With Freedom at Stake, Courts Are Collapsing",2020-09-09,article,Op-Ed,,"['Elections, Courts and the Judiciary', 'Constitutions', 'Politics and Government', 'Courts and the Judiciary', 'Civil Rights and Liberties']",The New York Times,OpEd,1144
Voters Seem to Think Biden Is the ‘Law and Order’ Candidate,2020-09-09,article,Op-Ed,,"['Presidential Election of 2020', 'George Floyd Protests (2020)', 'Black People', 'Blacks', 'Discrimination', 'Race and Ethnicity', 'United States Politics and Government', 'Polls and Public Opinion', 'Demonstrations, Protests and Riots', 'Presidential Election of 1988', 'Presidential Election of 1968']",The New York Times,OpEd,2777
Central Park Birder Turns Clash Into Graphic Novel About Racism,2020-09-09,article,News,,"['Comic Books and Strips', 'Graphic Novels', 'Police Brutality, Misconduct and Shootings', 'Black People', 'Blacks', 'Discrimination', 'Books and Literature']",The New York Times,Metro,685
2020 U.S. Open: What to Watch on Wednesday,2020-09-09,article,News,,"['Tennis', 'United States Open (Tennis)']",The New York Times,Sports,1316
Reform the Police? Guess Who Funds My State’s Officials,2020-09-09,article,Op-Ed,,"['Police Reform', 'George Floyd Protests (2020)', 'Black Lives Matter Movement', 'Black People', 'Blacks', 'Police', 'Police Brutality, Misconduct and Shootings', 'Demonstrations, Protests and Riots']",The New York Times,OpEd,937
Strike. This Could Be Our Last Stand.,2020-09-09,article,Op-Ed,,"['United States Economy', 'Labor and Jobs', 'Strikes', 'Income Inequality', 'Wages and Salaries', 'Recession and Depression', 'Unemployment', 'Coronavirus Aid, Relief, and Economic Security Act (2020)', 'Federal Aid (US)']",The New York Times,OpEd,1092
College Quarantine Breakdowns Leave Some at Risk,2020-09-09,article,News,,"['Coronavirus Reopenings', 'Colleges and Universities', 'Quarantines', 'Dormitories', 'Disease Rates']",The New York Times,National,1776
Putting ‘The Marvelous Mrs. Maisel’ in Motion,2020-09-09,article,News,,"['Television', 'Dancing']",The New York Times,Arts&Leisure,1675
The Town Defined by Penn State Football Becomes a Void,2020-09-09,article,News,,"['Football (College)', 'Colleges and Universities', 'Coronavirus (2019-nCoV)', 'Shutdowns (Institutional)']",The New York Times,Sports,1723
Byron Lars Is Still Here,2020-09-09,article,News,,"['Fashion and Apparel', 'Black People', 'Blacks', 'Race and Ethnicity', 'Shopping and Retail']",The New York Times,Styles,1893
Coronavirus Tests Are Supposed to Be Free. The Surprise Bills Come Anyway.,2020-09-09,article,News,,"['Coronavirus (2019-nCoV)', 'Tests (Medical)', 'Health Insurance and Managed Care', 'Consumer Protection', 'Prices (Fares, Fees and Rates)']",The New York Times,Upshot,1542
How One Man Conned the Beltway,2020-09-09,article,Op-Ed,,"['Government Contracts and Procurement', 'Classified Information and State Secrets', 'Espionage and Intelligence Services', 'Industrial Espionage']",The New York Times,OpEd,6539
‘It’s 8 P.M. on Election Day.’ Experts Share Their Nightmare Scenarios.,2020-09-09,article,Op-Ed,,"['Absentee Voting', 'Presidential Election of 2020', 'United States Politics and Government', 'Polls and Public Opinion', 'Social Media', 'Voting Machines', 'Computer Security', 'Voting and Voters', 'Rumors and Misinformation', 'Cyberwarfare and Defense', 'Voter Registration and Requirements']",The New York Times,OpEd,2292
New Wedding Date? Here’s How to Update Your Look,2020-09-09,article,News,,"['Fashion and Apparel', 'Dresses', 'Winter (Season)', 'Weddings and Engagements', 'Coronavirus (2019-nCoV)']",The New York Times,Styles,829
"Living In ... Pawling, N.Y.",2020-09-09,multimedia,Slideshow,,['Real Estate and Housing (Residential)'],The New York Times,Real Estate,0
"Pawling, N.Y.: A Quaint Place With Acres of Open Space",2020-09-09,article,News,,"['Real Estate and Housing (Residential)', 'Quarantine (Life and Culture)']",The New York Times,RealEstate,1544
N.I.H. Director Undercuts Trump’s Comments on Covid-19 Vaccines,2020-09-09,article,News,,['Coronavirus (2019-nCoV)'],The New York Times,Foreign,6536
What to Know About the N.Y.C. Mayoral Race,2020-09-09,article,briefing,,"['Elections, Mayors', 'Quarantine (Life and Culture)', 'Art', 'George Floyd Protests (2020)', 'Black Lives Matter Movement']",The New York Times,Metro,1371
"Afghan Vice President, Staunch Opponent of Taliban, Survives Blast",2020-09-09,article,News,,"['Politics and Government', 'Terrorism', 'Afghanistan War (2001- )', 'United States International Relations']",The New York Times,Foreign,965
"Fire Destroys Most of Europe’s Largest Refugee Camp, on Greek Island of Lesbos",2020-09-09,article,News,,"['Middle East and Africa Migrant Crisis', 'Fires and Firefighters', 'Refugees and Displaced Persons']",The New York Times,Foreign,1296
Meet the New Caregiver: Your Home,2020-09-09,article,News,,"['Home Automation and Smart Homes', 'Real Estate and Housing (Residential)', 'Telemedicine', 'Coronavirus (2019-nCoV)', 'Quarantine (Life and Culture)']",The New York Times,RealEstate,1394
"The Killing of Breonna Taylor, Part 1",2020-09-09,article,News,,"['Black Lives Matter Movement', 'Police Brutality, Misconduct and Shootings']",The New York Times,Podcasts,502
The Pandemic Is a ‘Mental Health Crisis’ for Parents,2020-09-09,article,News,,"['Anxiety and Stress', 'Children and Childhood', 'Parenting', 'Mental Health and Disorders', 'Coronavirus (2019-nCoV)', 'Pregnancy and Childbirth', 'Women and Girls', 'Therapy and Rehabilitation']",The New York Times,Parenting,1242
The Virus Moves Off Campus,2020-09-09,article,briefing,,[],The New York Times,NYTNow,1705
‘All In: The Fight for Democracy’ Review: Electoral Collage,2020-09-09,article,Review,,"['Documentary Films and Programs', 'Voting Rights Act (1965)', 'Voting and Voters', 'Voter Registration and Requirements', 'Presidential Election of 2020']",The New York Times,Weekend,569
‘The Social Dilemma’ Review: Unplug and Run,2020-09-09,article,Review,,"['Documentary Films and Programs', 'Social Media', 'Computers and the Internet', 'Data-Mining and Database Marketing', 'Mental Health and Disorders', 'Privacy']",The New York Times,Weekend,540
The ‘Great Environmentalist’ President,2020-09-09,article,News,,"['Environment', 'Presidential Election of 2020', 'United States Politics and Government']",The New York Times,Politics,1567
What if There Isn’t a Vaccine for Years?,2020-09-09,article,News,,"['Mergers, Acquisitions and Divestitures', 'Electric and Hybrid Vehicles', 'Coronavirus (2019-nCoV)', 'Vaccination and Immunization']",The New York Times,Business,2358
Small Earthquake Rattles New Jersey,2020-09-09,article,News,,['Earthquakes'],The New York Times,Express,559
"U.S. to Reduce Troop Levels in Iraq to 3,000",2020-09-09,article,News,,"['United States Defense and Military Forces', 'Terrorism', 'United States International Relations', 'United States Politics and Government']",The New York Times,Washington,1281
Basketball and Social Justice: Bucks Say ‘It’s Harder to Do Both’,2020-09-09,article,News,,['Basketball'],The New York Times,Sports,958
The Justice Dept. intervened to help Trump in a lawsuit brought by E. Jean Carroll.,2020-09-09,article,News,,[],The New York Times,Politics,349
"A New Hampshire lawmaker, Dan Feltes, beat a Sanders-backed candidate in the Democratic primary for governor.",2020-09-09,article,News,,[],The New York Times,Politics,426
"A Florida poll found the candidates tied, but with shifting sources of support.",2020-09-09,article,News,,[],The New York Times,Politics,258
"Michigan seemed to be slipping from Trump, but now he’s competing again there.",2020-09-09,article,News,,[],The New York Times,Politics,304
The N.R.A.’s new candidate grades show a continuing decline in support.,2020-09-09,article,News,,[],The New York Times,Politics,529
"A Man, a Pint and a Timer Become Symbols of Ireland’s Pandemic Rules",2020-09-09,article,News,,"['Coronavirus (2019-nCoV)', 'Disease Rates', 'Restaurants', 'Bars and Nightclubs', 'Quarantines', 'Quarantine (Life and Culture)', 'Photography']",The New York Times,Foreign,522
Newsom Vows to ‘Face Climate Change Head On’ in California,2020-09-09,article,briefing,,[],The New York Times,National,1261
Jerry Lewis Telethon Will Return With Kevin Hart,2020-09-09,article,News,,['Television'],The New York Times,Culture,482
An Operatic Innovator Takes On Detroit,2020-09-09,article,News,,"['Opera', 'Appointments and Executive Changes']",The New York Times,Culture,1190
Continue Your Life’s Education With Free Online Classes,2020-09-09,article,News,,"['Content Type: Service', 'E-Learning', 'Education', 'Colleges and Universities', 'Computers and the Internet', 'Smartphones']",The New York Times,Business,769
What You Get for $1.85 Million,2020-09-09,multimedia,Slideshow,,['Real Estate and Housing (Residential)'],The New York Times,Real Estate,0
"$1.85 Million Homes in Massachusetts, Hawaii and Georgia",2020-09-09,article,News,,['Real Estate and Housing (Residential)'],The New York Times,RealEstate,1311
"Sitting in Silence With 5,000 Fans: The New Sound of Japanese Sports",2020-09-09,article,News,,"['Soccer', 'Quarantine (Life and Culture)', 'Stadiums and Arenas', 'Coronavirus (2019-nCoV)']",The New York Times,Foreign,1341
A 19th-Century Rowhouse in Historic Old Montreal,2020-09-09,multimedia,Slideshow,,['Real Estate and Housing (Residential)'],The New York Times,Real Estate,0
House Hunting in Canada: A Rowhouse in Old Montreal With Income Potential,2020-09-09,article,News,,['Real Estate and Housing (Residential)'],The New York Times,RealEstate,1534
He Loves Pakistani Cricket. It Doesn’t Love Him Back.,2020-09-09,article,News,,['Cricket (Game)'],The New York Times,Sports,1602
How to Stay Safer on Mass Transit,2020-09-09,multimedia,Interactive Feature,,"['Content Type: Service', 'Transit Systems', 'Commuting', 'Buses']",The New York Times,At Home,0
"Texas’ system for verifying signatures on mail-in ballots is unconstitutional, a judge ruled.",2020-09-09,article,News,,[],The New York Times,Politics,294
"Tom Brady, Florida Man in Full",2020-09-09,article,News,,['Football'],The New York Times,Sports,1649
Summer Jet-Setters Turned Sardinia Into a Virus Hot Spot,2020-09-09,article,News,,"['Bars and Nightclubs', 'Coronavirus (2019-nCoV)', 'Disease Rates', 'Travel and Vacations', 'Parties (Social)']",The New York Times,Foreign,1369
Chicken! Plums! Red Onions!,2020-09-09,article,News,,"['Cooking and Cookbooks', 'Recipes']",The New York Times,Dining,750
7 People Die in West Coast Wildfires,2020-09-09,article,News,,['Wildfires'],The New York Times,National,2013
A Marist poll shows Biden widening his lead in Pennsylvania.,2020-09-09,article,News,,[],The New York Times,Politics,253
Drag Queens Deliver Dinner and a Show in San Francisco,2020-09-09,article,News,,"['Small Business', 'Bars and Nightclubs', 'Homosexuality and Bisexuality']",The New York Times,Express,912
N.Y.C. Gynecologist Faces Federal Charges Over 6 Sex Abuse Accusations,2020-09-09,article,News,,"['Sex Crimes', 'Child Abuse and Neglect', 'Gynecology and Gynecologists']",The New York Times,Metro,1005
"Ron Gorchov, Painter Who Challenged Viewers’ Perceptions, Dies at 90",2020-09-09,article,Obituary (Obit),,"['Deaths (Obituaries)', 'Art']",The New York Times,Obits,1258
Trump’s decision to go maskless at a North Carolina rally concerns Dr. Fauci.,2020-09-09,article,News,,[],The New York Times,Politics,251
How Are You Keeping Your Students Engaged?,2020-09-09,article,News,,"['Coronavirus (2019-nCoV)', 'Education (K-12)']",The New York Times,Dining,88
Schools Briefing: Coronavirus Dorms and Super Spreaders,2020-09-09,article,News,,"['Coronavirus Reopenings', 'Quarantines', 'Colleges and Universities', 'Education (K-12)', 'Coronavirus (2019-nCoV)', 'Education']",The New York Times,NYTNow,1403
The ‘Straightforward’ Link Between Climate and California’s Fires,2020-09-09,article,News,,"['Global Warming', 'Wildfires', 'United States Politics and Government']",The New York Times,Climate,905
‘I Knew All the Words’: Your First Favorite Musicals,2020-09-09,article,News,,['Theater'],The New York Times,Culture,1153
‘Impossible Objects’ That Reveal a Hidden Power,2020-09-09,article,News,,"['Art', 'Photography', 'Computer Vision', 'Computer Security', 'Surveillance of Citizens by Government', 'Privacy']",The New York Times,Arts&Leisure,1249
Refinery29 Finds Next Top Editor at Facebook,2020-09-09,article,News,,"['Fashion and Apparel', 'Appointments and Executive Changes', 'Workplace Hazards and Violations']",The New York Times,Business,497
The Met Hires Its First Full-Time Native American Curator,2020-09-09,article,News,,"['Native Americans', 'Indigenous People', 'Museums', 'Art', 'Appointments and Executive Changes']",The New York Times,Culture,373
A Year of Heartbreak and Bloodshed at Fort Hood,2020-09-09,article,News,,"['United States Defense and Military Forces', 'Murders, Attempted Murders and Homicides', 'Suicides and Suicide Attempts', 'Sexual Harassment', 'Drownings', 'Deaths (Fatalities)', 'Mental Health and Disorders', 'Military Bases and Installations']",The New York Times,National,1820
"No, Facebook Does Not Reflect Reality",2020-09-09,article,News,,"['Social Media', 'Mobile Applications', 'Coronavirus (2019-nCoV)']",The New York Times,NewsDesk,1093
"N.Y.C. to Allow Indoor Dining, in Milestone on Recovery From Pandemic",2020-09-09,article,News,,"['Coronavirus Reopenings', 'Restaurants']",The New York Times,Metro,1570
Too Pop? Too Weird? A.G. Cook of PC Music Is Stepping Out on His Own,2020-09-09,article,News,,['Pop and Rock Music'],The New York Times,Culture,1257
How Quarantine Killed the Weekend,2020-09-09,article,News,,"['Quarantine (Life and Culture)', 'Seasons and Months', 'Working Hours', 'Travel and Vacations', 'Leisure', 'Telecommuting']",The New York Times,Styles,1069
‘A Fearless Virus Hunter’ Tackles a Coronavirus Mystery in Children,2020-09-09,article,News,,"['Doctors', 'Pediatric Inflammatory Multisystem Syndrome (PIMS)', 'Coronavirus (2019-nCoV)', 'Dengue Fever', 'Kawasaki Disease', 'Black People', 'Blacks', 'Children and Childhood', 'Race and Ethnicity', 'Genetics and Heredity', 'Hispanic-Americans', 'Parenting']",The New York Times,Parenting,2032
"Trump Attacked Generals as Weak and Too Focused on Allies, Woodward’s Book Says",2020-09-09,article,News,,"['United States Politics and Government', 'United States Defense and Military Forces', 'Books and Literature']",The New York Times,Washington,985
Pay People to Get Vaccinated,2020-09-09,article,News,,"['Coronavirus (2019-nCoV)', 'Vaccination and Immunization', 'Consumer Behavior', 'United States Economy', 'Economics (Theory and Philosophy)']",The New York Times,SundayBusiness,925
"Kenny Ortega, Teen Whisperer",2020-09-09,article,News,,"['Television', 'Teenagers and Adolescence', 'ACTORS AND ACTRESSES', 'Music']",The New York Times,Culture,1528
A Cheesy Toast to Dream About,2020-09-09,article,News,,"['Quarantine (Life and Culture)', 'Cooking and Cookbooks']",The New York Times,Dining,470
Trump Admits Downplaying the Virus Knowing It Was ‘Deadly Stuff’,2020-09-09,article,News,,"['Coronavirus (2019-nCoV)', 'United States Politics and Government', 'Books and Literature']",The New York Times,Washington,1242
British Prime Minister Bans Gatherings of More Than 6,2020-09-09,multimedia,Video,,"['Politics and Government', 'Coronavirus (2019-nCoV)', 'Quarantines']",The New York Times,,0
A Striking Reversal: Trump’s Attacks on the Military and Defense Contractors,2020-09-09,article,News Analysis,,"['United States Defense and Military Forces', 'United States Politics and Government', 'Arms Trade', 'Veterans']",The New York Times,Washington,1669
Rediscovering an Ambitious Sketch Comedy That Never Caught On,2020-09-09,article,News,,"['Television', 'Comedy and Humor']",The New York Times,Culture,1099
"Women on the Scottish Coast, at the Whims of Male Violence",2020-09-09,article,Review,,['Books and Literature'],The New York Times,Culture,1121
Theater to Stream: More Fringe and a Noël Coward ‘Party’,2020-09-09,article,News,,"['Theater', 'Video Recordings, Downloads and Streaming', 'Quarantine (Life and Culture)']",The New York Times,Weekend,949
How the Coronavirus Attacks the Brain,2020-09-09,article,News,,"['your-feed-science', 'Stroke', 'Delirium', 'Brain', 'Coronavirus (2019-nCoV)', 'Immune System', 'Nerves and Nervous System', 'Zika Virus']",The New York Times,Science,925
Tiffany’s $16 Billion Sale Falls Apart in Face of Pandemic and Tariffs,2020-09-09,article,News,,"['Mergers, Acquisitions and Divestitures', 'Jewels and Jewelry', 'Luxury Goods and Services', 'Shopping and Retail', 'Suits and Litigation (Civil)', 'Customs (Tariff)', 'Coronavirus (2019-nCoV)']",The New York Times,Business,1261
The Oscars’ New Diversity Rules Are Sweeping but Safe,2020-09-09,article,News,,"['Movies', 'Academy Awards (Oscars)', 'Minorities']",The New York Times,Culture,981
"Boris Johnson, Covid, Brexit and the Art of Policy Improvisation",2020-09-09,article,News,,"['Great Britain Withdrawal from EU (Brexit)', 'Coronavirus (2019-nCoV)', 'Coronavirus Reopenings']",The New York Times,Foreign,1081
Is Voting Twice a Felony?,2020-09-09,article,News,,"['Absentee Voting', 'Voter Registration and Requirements', 'Elections', 'Voter Fraud (Election Fraud)', 'Elections, Secretary of State']",The New York Times,Politics,1288
"Biden, in Michigan to Push a Jobs Plan, Tears Into Trump’s Virus Response",2020-09-09,article,News,,"['Labor and Jobs', 'Federal Taxes (US)', 'Corporate Taxes', 'Outsourcing', 'Coronavirus (2019-nCoV)']",The New York Times,Politics,1358
Will You Know Me if I’m Wearing a Mask?,2020-09-09,article,Letter,,"['Coronavirus (2019-nCoV)', 'Masks', 'Face']",The New York Times,Letters,169
Serena Williams Is on Another U.S. Open Run. Is a Record Finish in Store?,2020-09-09,article,News,,"['Tennis', 'United States Open (Tennis)']",The New York Times,Sports,1247
Measuring Trump’s Culpability for Covid Deaths,2020-09-09,article,Letter,,['Coronavirus (2019-nCoV)'],The New York Times,Letters,697
"D.H.S. Downplayed Threats From Russia and White Supremacists, Whistle-Blower Says",2020-09-09,article,News,,"['Whistle-Blowers', 'United States Politics and Government', 'Ethics and Official Misconduct', 'Espionage and Intelligence Services', 'Presidential Election of 2020', 'Russian Interference in 2016 US Elections and Ties to Trump Associates', 'Conspiracy Theories', 'Right-Wing Extremism and Alt-Right', 'Discrimination', 'Race and Ethnicity', 'Whites', 'Black Lives Matter Movement', 'George Floyd Protests (2020)']",The New York Times,Washington,2002
Amtrak Chief Pleads for Nearly $5 Billion to Survive Pandemic,2020-09-09,article,News,,"['Layoffs and Job Reductions', 'Labor and Jobs', 'Federal Aid (US)', 'Stimulus (Economic)', 'Coronavirus Aid, Relief, and Economic Security Act (2020)', 'Coronavirus (2019-nCoV)', 'United States Politics and Government', 'Railroads', 'Transit Systems', 'Transportation']",The New York Times,Washington,745
"Pandemic Has Cut Modern and Contemporary Gallery Sales 36%, Report Says",2020-09-09,article,News,,"['Art', 'Finances', 'Coronavirus (2019-nCoV)', 'Art Basel Hong Kong', 'ART BASEL (FESTIVAL)', 'Frieze Art Fair', 'E-Commerce', 'Layoffs and Job Reductions', 'Shutdowns (Institutional)']",The New York Times,Culture,586
Gucci Heir Alleges Child Sexual Abuse,2020-09-09,article,News,,"['Sex Crimes', 'Suits and Litigation (Civil)', 'Child Abuse and Neglect', 'your-feed-fashion']",The New York Times,Styles,1845
"White House Asked Justice Dept. to Take Over Defamation Suit Against Trump, Barr Says",2020-09-09,article,News,,"['Sex Crimes', 'Libel and Slander', 'Suits and Litigation (Civil)', 'Law and Legislation', 'United States Politics and Government']",The New York Times,Washington,1123
White House Press Secretary Claims Trump “Never Lied” to Public on Coronavirus,2020-09-09,multimedia,Video,,['Coronavirus (2019-nCoV)'],The New York Times,,0
‘The Walking Dead’ Is Set to End in 2022,2020-09-09,article,News,,"['Television', 'Comic Books and Strips']",The New York Times,Culture,328
"George Bizos, Anti-Apartheid Lawyer Who Defended Mandela, Dies at 92",2020-09-09,article,Obituary (Obit),,"['Deaths (Obituaries)', 'Apartheid (Policy)', 'Human Rights and Human Rights Violations', 'Legal Profession']",The New York Times,Obits,1869
Steve Nash: ‘I’m Going to Be Myself’ as Nets Head Coach,2020-09-09,article,News,,"['Basketball', 'Coaches and Managers', 'Labor and Jobs']",The New York Times,Sports,684
I Need You to Care That Our Country Is on Fire,2020-09-09,article,Op-Ed,,"['Wildfires', 'Hurricanes and Tropical Storms', 'Global Warming']",The New York Times,OpEd,1005
Your Thursday Briefing,2020-09-09,article,briefing,,[],The New York Times,NYTNow,1569
Franchise Workers Win Victory Over U.S. Effort to Curb Lawsuits,2020-09-09,article,News,,"['Workplace Hazards and Violations', 'Labor and Jobs', 'Wages and Salaries', 'Franchises', 'Decisions and Verdicts', 'Suits and Litigation (Civil)', 'Regulation and Deregulation of Industry', 'Fast Food Industry', 'Minimum Wage', 'Overtime']",The New York Times,Business,479
A whistle-blower accuses top Homeland Security officials of playing down threats from Russia and white supremacists.,2020-09-09,article,News,,[],The New York Times,Politics,383
Wildfires Blot Out Sun in the Bay Area,2020-09-09,article,News,,"['Wildfires', 'Air Pollution']",The New York Times,National,246
Why Are Men Still Explaining Things to Women?,2020-09-09,article,News,,"['Women and Girls', 'Men and Boys']",The New York Times,Gender,1283
Biden Accuses Trump of Lying to the Public About Coronavirus Threat,2020-09-09,multimedia,Video,,['Presidential Election of 2020'],The New York Times,,0
Facebook May Be Ordered to Change Data Practices in Europe,2020-09-09,article,News,,"['Social Media', 'Politics and Government', 'Computers and the Internet', 'Surveillance of Citizens by Government', 'Privacy', 'Data-Mining and Database Marketing', 'Regulation and Deregulation of Industry']",The New York Times,Business,396
"Professor Investigated for Posing as Black Has Resigned, University Says",2020-09-09,article,News,,"['Colleges and Universities', 'Black People', 'Blacks']",The New York Times,Express,324
Watch These 15 Movies Before They Leave Netflix This Month,2020-09-09,article,News,,['Movies'],The New York Times,Culture,1627
"Lady Gaga and Katy Perry, Preserving Pop’s Old Guard",2020-09-09,article,News,,['Pop and Rock Music'],The New York Times,Culture,169
‘It Looks Like Doomsday’: California Residents React to Orange Sky,2020-09-09,multimedia,Video,,['Wildfires'],The New York Times,,0
Pinehurst Awarded Four More U.S. Opens,2020-09-09,article,News,,"['Golf', 'United States Open (Golf)']",The New York Times,Sports,295
On-Demand Webinar: Documenting Teenage Lives in Extraordinary Times,2020-09-09,article,News,,[],The New York Times,Learning,285
"E-Cigarette Use Falls Sharply Among Teenagers, C.D.C. Finds",2020-09-09,article,News,,"['Teenagers and Adolescence', 'E-Cigarettes', 'Smoking and Tobacco', 'your-feed-healthcare']",The New York Times,Science,480
"Where the Wildfires Are Burning, and Other Answers You Need",2020-09-09,article,News,,"['Wildfires', 'Fires and Firefighters', 'Coronavirus Risks and Safety Concerns']",The New York Times,National,1587
Trump Reveals List for Possible Supreme Court Picks,2020-09-09,multimedia,Video,,"['Presidential Election of 2020', 'United States Politics and Government']",The New York Times,,0
Endless Summer vs. Hurry-Up Fall,2020-09-09,article,News,,['Quarantine (Life and Culture)'],The New York Times,AtHome,959
Kevin Spacey Accused of Sex Offenses Against Teenagers in New Lawsuit,2020-09-09,article,News,,"['Sex Crimes', 'Sexual Harassment', 'Child Abuse and Neglect', 'Suits and Litigation (Civil)', 'New York Child Victims Act (2019)']",The New York Times,Weekend,639
How ‘Keeping Up With the Kardashians’ Changed Everything,2020-09-09,article,News,,"['Reality Television', 'Social Media', 'Celebrities', 'ADVERTISING AND MARKETING', 'Transgender and Transsexuals', 'Content Type: Personal Profile']",The New York Times,Styles,1934
Barr says it’s normal for the Justice Dept. to defend the president in a defamation suit.,2020-09-09,article,News,,[],The New York Times,Politics,377
Bankrupt J.C. Penney Is Bought by Mall Operators in Need of Tenants,2020-09-09,article,News,,"['Shopping and Retail', 'Shopping Centers and Malls', 'Bankruptcies']",The New York Times,Business,898
"Coronavirus, Indoor Dining, Toy Soldiers: Your Wednesday Evening Briefing",2020-09-09,article,briefing,,"['Coronavirus (2019-nCoV)', 'Coronavirus Reopenings', 'Coronavirus Aid, Relief, and Economic Security Act (2020)']",The New York Times,NYTNow,1238
"At the U.S. Open, Players From Belarus Eye Unrest at Home",2020-09-09,article,News,,"['Tennis', 'United States Open (Tennis)']",The New York Times,Sports,1003
