headline,date,doc_type,material_type,section,keywords,source,news_desk,word_count
Coronavirus Restrictions Force Cancellation of Arctic Research Flights,2020-03-16,article,News,,"['Global Warming', 'Coronavirus (2019-nCoV)']",The New York Times,Climate,399
Grieving for My Sick City,2020-03-16,article,Op-Ed,,"['Coronavirus (2019-nCoV)', 'Epidemics', 'Urban Areas', 'United States Economy', 'Small Business']",The New York Times,OpEd,902
"Trump Urges Limits Amid Pandemic, but Stops Short of National Mandates",2020-03-16,article,News,,"['United States Politics and Government', 'Quarantines', 'United States Economy', 'Coronavirus (2019-nCoV)', 'Epidemics', 'Governors (US)']",The New York Times,Washington,1700
The World of Books Braces for a Newly Ominous Future,2020-03-16,article,News,,"['Book Trade and Publishing', 'Books and Literature', 'Writing and Writers', 'Shutdowns (Institutional)', 'Coronavirus (2019-nCoV)', 'Epidemics']",The New York Times,BookReview,1397
Inside the Coronavirus Response: A Case Study in the White House Under Trump,2020-03-16,article,News,,"['United States Politics and Government', 'Coronavirus (2019-nCoV)', 'Quarantines', 'Epidemics']",The New York Times,Washington,1840
‘Our Lives Are at Stake’: U.S. Residents Scramble to Find Coronavirus Testing,2020-03-17,multimedia,Video,,"['Coronavirus (2019-nCoV)', 'Quarantines', 'Deaths (Fatalities)', 'Tests (Medical)']",The New York Times,,0
Connecticut Man Charged With Threatening to Kill Adam Schiff,2020-03-17,article,News,,"['United States Politics and Government', 'Trump-Ukraine Whistle-blower Complaint and Impeachment Inquiry', 'Politics and Government', 'Russian Interference in 2016 US Elections and Ties to Trump Associates', 'Threats and Threatening Messages', 'Impeachment']",The New York Times,Express,508
‘Saturday Night Live’ Halts Its Season,2020-03-17,article,News,,"['Television', 'Coronavirus (2019-nCoV)']",The New York Times,Culture,214
New Liqueurs Adopt the Buzz of Coffee Culture,2020-03-17,article,News,,"['ALCOHOLIC BEVERAGES', 'Liquor', 'Coffee']",The New York Times,Dining,696
"Senate, Bidding for Time, Tries to Temporarily Revive Spy Tools",2020-03-17,article,News,,"['Surveillance of Citizens by Government', 'Foreign Intelligence Surveillance Act (FISA)', 'Wiretapping and Other Eavesdropping Devices and Methods', 'Civil Rights and Liberties', 'Privacy', 'Law and Legislation', 'United States Politics and Government', 'Classified Information and State Secrets', 'Terrorism', 'Search and Seizure', 'September 11 (2001)', 'Telephones and Telecommunications']",The New York Times,Washington,935
Clean Elections,2020-03-17,article,News,,"['Presidential Election of 2020', 'Coronavirus (2019-nCoV)', 'Primaries and Caucuses']",The New York Times,Politics,1535
"No More Than 10 People in One Place, Trump Said. But Why?",2020-03-17,article,News,,"['Coronavirus (2019-nCoV)', 'Quarantines', 'Parties (Social)', 'Medicine and Health', 'Research']",The New York Times,Science,969
Hackers Attack Health and Human Services Computer System,2020-03-17,article,News,,"['Computers and the Internet', 'Computer Security', 'Coronavirus (2019-nCoV)', 'Cyberattacks and Hackers']",The New York Times,Washington,920
What Should I Look for When Buying Whole Grains?,2020-03-17,article,News,,"['Grain', 'Diet and Nutrition', 'Cooking and Cookbooks', 'Labeling and Labels (Product)', 'Flour', 'Obesity', 'Weight', 'Sustainable Living']",The New York Times,Well,901
Trump’s Call With Governors on the Coronavirus,2020-03-17,multimedia,Video,,"['Coronavirus (2019-nCoV)', 'Emergency Medical Treatment', 'Governors (US)']",The New York Times,,0
White House Takes New Line After Dire Report on Death Toll,2020-03-17,article,News,,"['Quarantines', 'Deaths (Fatalities)', 'Coronavirus (2019-nCoV)', 'Travel Warnings', 'Epidemics', 'United States Politics and Government']",The New York Times,Investigative,856
"Man Who Stabbed Sisters on BART Platform Was Sane at Time, Judge Says",2020-03-17,article,News,,"['Murders, Attempted Murders and Homicides', 'Decisions and Verdicts']",The New York Times,Express,525
Palmer With an ‘Army’,2020-03-17,article,News,,['Crossword Puzzles'],The New York Times,Games,1060
"‘Better Call Saul’ Season 5, Episode 5 Recap: A Tale of Two Coots",2020-03-17,article,Review,,['Television'],The New York Times,Culture,1191
"As Market Convulses, Big Banks Plan to Borrow Funds From Fed",2020-03-17,article,News,,"['Banking and Financial Institutions', 'Coronavirus (2019-nCoV)']",The New York Times,Business,564
Kentucky Derby Is Postponed Until September Because of Coronavirus,2020-03-17,article,News,,"['Horse Racing', 'Kentucky Derby', 'Triple Crown (Horse Racing)', 'Coronavirus (2019-nCoV)']",The New York Times,Sports,420
Stocks Rebound From Monday’s Collapse,2020-03-17,article,News,,"['Coronavirus (2019-nCoV)', 'Stocks and Bonds', 'United States Economy', ""Standard & Poor's 500-Stock Index"", 'Economic Conditions and Trends']",The New York Times,Business,1619
"Corrections: March 17, 2020",2020-03-17,article,Correction,,[],The New York Times,Corrections,292
Quotation of the Day: Top Court Rules Putin Can Bypass Term Limits,2020-03-17,article,Quote,,[],The New York Times,Summary,41
Crackdown on Southern Border Is Planned; U.S. Records 100th Death,2020-03-17,article,News,,"['Coronavirus (2019-nCoV)', 'Quarantines', 'Kentucky Derby']",The New York Times,Foreign,3360
Germany Has More Than Enough Ventilators. It Should Share Them.,2020-03-17,article,Op-Ed,,"['Coronavirus (2019-nCoV)', 'Ventilators (Medical)', 'Shortages']",The New York Times,OpEd,862
What’s on TV Tuesday: ‘Jumanji: The Next Level’ and ‘Inside No. 9’,2020-03-17,article,News,,"['Movies', 'Television']",The New York Times,Culture,482
Your Tuesday Briefing,2020-03-17,article,briefing,,[],The New York Times,NYTNow,1505
Word + Quiz: genome,2020-03-17,article,News,,[],The New York Times,Learning,227
Why Birds Are the World’s Best Engineers,2020-03-17,article,News,,"['Animal Behavior', 'Birds', 'Building (Construction)', 'Engineering and Engineers', 'ARCHITECTURE', 'Art', 'Physics', 'your-feed-science']",The New York Times,Science,1749
St. Patrick’s Day,2020-03-17,article,News,,[],The New York Times,Learning,118
Can the Olympics Take Place in July? (This July?),2020-03-17,multimedia,Interactive Feature,,"['Olympic Games (2020)', 'Fencing (Sport)', 'Swimming', 'Gymnastics', 'Track and Field']",The New York Times,Sports,0
Fix Everything Wrong at 23 Subway Stations? It Beats His Last Job,2020-03-17,article,News,,"['Subways', 'Transit Systems', 'Customer Relations']",The New York Times,Metro,1737
"India Scrambles to Escape a Coronavirus Crisis. So Far, It’s Working.",2020-03-17,article,News,,"['Coronavirus (2019-nCoV)', 'Politics and Government', 'Immigration and Emigration', 'Epidemics', 'Urban Areas']",The New York Times,Foreign,1237
"Lesson of the Day: ‘Procrastinate Much? Manage Your Emotions, Not Your Time.’",2020-03-17,article,News,,[],The New York Times,Learning,504
Tom Hanks and Rita Wilson Are Released From the Hospital,2020-03-17,article,News,,['Coronavirus (2019-nCoV)'],The New York Times,Foreign,281
A Sobering Look at How Quickly Hitler Transformed Germany,2020-03-17,article,Review,,"['Books and Literature', 'Holocaust and the Nazi Era']",The New York Times,Culture,1041
How to Read Faster,2020-03-17,article,News,,['Reading and Writing Skills (Education)'],The New York Times,Magazine,396
Is It Wrong to Donate to Candidates You Can’t Vote for?,2020-03-17,article,News,,"['Discrimination', 'Campaign Finance', 'Transgender and Transsexuals', 'Race and Ethnicity', 'Marriages']",The New York Times,Magazine,1621
"Thinking About Empire and Economy, With a Poet’s Mind and a Lawyer’s Words",2020-03-17,article,Review,,"['Books and Literature', 'Poetry and Poets']",The New York Times,BookReview,1025
The Jewish Race-Car Driver Who Outpaced the Nazis,2020-03-17,article,Review,,"['Automobile Racing', 'Books and Literature']",The New York Times,BookReview,652
How the White Working Class Is Being Destroyed,2020-03-17,article,Review,,"['Books and Literature', 'Whites', 'Drug Abuse and Traffic', 'Suicides and Suicide Attempts', 'Men and Boys']",The New York Times,BookReview,1257
"New & Noteworthy Audiobooks, From ‘The Office’ to Eating Well",2020-03-17,article,News,,"['Books and Literature', 'Audiobooks']",The New York Times,BookReview,398
This Evangelical Megachurch in Ohio Isn’t What You Think,2020-03-17,article,Op-Ed,,"['Race and Ethnicity', 'Christians and Christianity', 'Evangelical Movement']",The New York Times,OpEd,1042
The Class of COVID-19,2020-03-17,multimedia,Interactive Feature,,"['Coronavirus (2019-nCoV)', 'Colleges and Universities']",The New York Times,U.S.,0
U.S. Lags in Coronavirus Testing After Slow Response to Outbreak,2020-03-17,multimedia,Interactive Feature,,['Coronavirus (2019-nCoV)'],The New York Times,U.S.,0
What Role Does Poetry Play in Your Life?,2020-03-17,article,News,,"['Poetry and Poets', 'Writing and Writers', 'Books and Literature']",The New York Times,Learning,955
When Mies van der Rohe Went on Trial,2020-03-17,article,Review,,"['Books and Literature', 'ARCHITECTURE']",The New York Times,BookReview,759
"For Black and Mixed-Race Women, Hair and Identity Are Tangled Together",2020-03-17,article,Review,,['Books and Literature'],The New York Times,BookReview,614
Why We Should Abolish the Electoral College,2020-03-17,article,Review,,"['Books and Literature', 'Electoral College', 'Constitutional Amendments', 'United States Politics and Government']",The New York Times,BookReview,829
The Ghost Writer: An Author Imagines a Letter From Her Late Grandmother,2020-03-17,article,Review,,['Books and Literature'],The New York Times,BookReview,987
Is Closing the Schools a Good Idea?,2020-03-17,article,News,,"['Coronavirus (2019-nCoV)', 'Shutdowns (Institutional)', 'Education (K-12)', 'Epidemics', 'Hygiene and Cleanliness', 'E-Learning']",The New York Times,Upshot,978
Has Physics Lost Its Way?,2020-03-17,article,Review,,"['Books and Literature', 'Physics']",The New York Times,BookReview,941
Samsung: The Tech Monster That Conquered the World,2020-03-17,article,Review,,['Books and Literature'],The New York Times,BookReview,642
Is There Cosmic Meaning in Life’s Randomness?,2020-03-17,article,Review,,"['Books and Literature', 'Love (Emotion)', 'Art']",The New York Times,BookReview,752
He Questioned the Meaning of Life. William James Answered.,2020-03-17,article,Review,,['Books and Literature'],The New York Times,BookReview,667
"Someday, We’ll Look Back on All of This and Write a Novel",2020-03-17,article,News,,"['Books and Literature', 'Coronavirus (2019-nCoV)', 'Quarantines', 'Writing and Writers']",The New York Times,Culture,880
Our Internet Isn’t Ready for Coronavirus,2020-03-17,article,Op-Ed,,"['Computers and the Internet', 'E-Learning', 'Computer Network Outages', 'Coronavirus (2019-nCoV)', 'Videophones and Videoconferencing']",The New York Times,OpEd,756
The Wing Is a Women’s Utopia. Unless You Work There.,2020-03-17,article,News,,"['Organizations, Societies and Clubs', 'Women and Girls', 'Workplace Environment', ""Women's Rights"", 'Discrimination', 'Black People', 'Blacks']",The New York Times,Magazine,5090
"His Nation in Turmoil, One Boy Finds Refuge and Adventure in Friendship",2020-03-17,article,Review,,['Books and Literature'],The New York Times,BookReview,689
A Stirring Family Saga Tells a Taboo History of Vietnam,2020-03-17,article,Review,,['Books and Literature'],The New York Times,BookReview,951
The Mask,2020-03-17,article,News,,"['Masks', 'Protective Clothing and Gear', 'Fashion and Apparel', 'Coronavirus (2019-nCoV)', 'Fashion Shows', 'Customs, Etiquette and Manners', 'Discrimination', 'your-feed-fashion']",The New York Times,Styles,1790
Why Telling People They Don’t Need Masks Backfired,2020-03-17,article,Op-Ed,,"['Protective Clothing and Gear', 'Masks', 'Coronavirus (2019-nCoV)', 'Epidemics', 'SARS (Severe Acute Respiratory Syndrome)', 'Quarantines', 'Shortages']",The New York Times,OpEd,1372
How Much Does Voting Spread Viruses?,2020-03-17,article,News,,"['Coronavirus (2019-nCoV)', 'Voting and Voters', 'Research', 'Influenza', 'Viruses']",The New York Times,Upshot,987
"N.Y. May Need 18,000 Ventilators Very Soon. It Is Far Short of That.",2020-03-17,article,News,,"['Coronavirus (2019-nCoV)', 'Hospitals', 'Life-Sustaining Support Systems, Withdrawal Of', 'Shortages', 'Elderly', 'Ventilators (Medical)']",The New York Times,Metro,1501
Why the Coronavirus Might Not Hit Turnout Hard in Tuesday’s Primaries,2020-03-17,article,News,,"['Primaries and Caucuses', 'Coronavirus (2019-nCoV)', 'Elections', 'United States Politics and Government', 'Polls and Public Opinion']",The New York Times,Upshot,865
How to Be Together Apart In the Time of Coronavirus,2020-03-17,article,Op-Ed,,"['Computers and the Internet', 'Social Media', 'Birthdays', 'Coronavirus (2019-nCoV)', 'Parties (Social)', 'Weddings and Engagements', 'Epidemics', 'Book Clubs', 'Quarantines']",The New York Times,OpEd,1133
"In Italy, ‘Io Resto a Casa,’ but Still I Dance",2020-03-17,article,News,,['Dancing'],The New York Times,Culture,1345
I Deliver Your Food. Don’t I Deserve Basic Protections?,2020-03-17,article,Op-Ed,,"['Coronavirus (2019-nCoV)', 'Delivery Services', 'Wages and Salaries', 'Freelancing, Self-Employment and Independent Contracting', 'Mobile Applications', 'Restaurants', 'Unemployment Insurance', 'Paid Time Off']",The New York Times,OpEd,822
One Simple Idea That Explains Why the Economy Is in Great Danger,2020-03-17,article,News,,"['Coronavirus (2019-nCoV)', 'Economic Conditions and Trends', 'Recession and Depression', 'Shutdowns (Institutional)', 'Consumer Behavior', 'Restaurants', 'Gambling', 'Hotels and Travel Lodgings', 'Credit and Debt']",The New York Times,Upshot,1106
The Universal Language of Caring,2020-03-17,article,News,,"['Leukemia', 'Translation and Interpreters', 'ARSENIC', 'Hospitals', 'Drugs (Pharmaceuticals)', 'Bone Marrow', 'Chemotherapy', 'Doctors']",The New York Times,Well,844
Concerts Are on Hold. Workers Behind the Stars Are Hurting.,2020-03-17,article,News,,"['Coronavirus (2019-nCoV)', 'Labor and Jobs', 'Pop and Rock Music', 'Freelancing, Self-Employment and Independent Contracting']",The New York Times,Culture,995
‘All Around Us Is Chaos’: Inside a Rural Town Upended by the Virus,2020-03-17,article,News,,"['Coronavirus (2019-nCoV)', 'Quarantines']",The New York Times,National,1777
Is There a Wizard Behind the Curtain?,2020-03-17,article,Op-Ed,,"['Presidential Election of 2020', 'United States Politics and Government', 'Coronavirus (2019-nCoV)', 'Recession and Depression']",The New York Times,OpEd,1329
Stop Saying That Everything Is Under Control. It Isn’t.,2020-03-17,article,Editorial,,"['Coronavirus (2019-nCoV)', 'Quarantines', 'Hospitals', 'Protective Clothing and Gear']",The New York Times,Editorial,1524
The Coronavirus Exposes Education’s Digital Divide,2020-03-17,article,News,,"['E-Learning', 'Education (K-12)', 'Coronavirus (2019-nCoV)', 'Computers and the Internet', 'Smartphones', 'Rural Areas', 'Homework', 'Quarantines', 'Teachers and School Employees']",The New York Times,Business,1346
A Movie Theater Family Says a Tearful Goodbye,2020-03-17,article,News,,"['Coronavirus (2019-nCoV)', 'Theaters (Buildings)', 'Shutdowns (Institutional)', 'your-feed-onlyinnewyork']",The New York Times,Metro,311
Can City Life Survive Coronavirus?,2020-03-17,article,News,,"['Urban Areas', 'Coronavirus (2019-nCoV)']",The New York Times,Foreign,924
‘Nothing Like Normal’: Covering an Infected Global Economy,2020-03-17,article,News,,"['Economic Conditions and Trends', 'Banking and Financial Institutions', 'United States Economy', 'Shutdowns (Institutional)', 'Coronavirus (2019-nCoV)', 'Quarantines', 'United States Politics and Government', 'Cruises', 'Credit and Debt', 'Epidemics', 'SARS (Severe Acute Respiratory Syndrome)', 'Stocks and Bonds']",The New York Times,Summary,970
She Was Abused by Her Husband. So Is the Narrator of Her New Book.,2020-03-17,article,Review,,['Books and Literature'],The New York Times,BookReview,1088
I Fled Yugoslavia in 1941. Then I Returned to Join the Resistance.,2020-03-17,article,News,,['World War II (1939-45)'],The New York Times,SpecialSections,1256
Which Consumer Lenders Are (and Aren’t) Helping the Most,2020-03-17,article,News,,"['Banking and Financial Institutions', 'Mortgages', 'Credit Cards', 'Credit and Debt', 'Personal Finances', 'Coronavirus (2019-nCoV)']",The New York Times,Business,1085
Handmade Visions on the Crafts Trail in Mexico,2020-03-17,article,News,,"['Handicrafts', 'Travel and Vacations', 'Textiles']",The New York Times,Travel,2498
A ‘Billions’ Star’s ‘Little Lady’ Apartment,2020-03-17,multimedia,Slideshow,,['Real Estate and Housing (Residential)'],The New York Times,Real Estate,0
"Samantha Mathis, Self-Isolating Downtown",2020-03-17,article,News,,"['Real Estate and Housing (Residential)', 'ACTORS AND ACTRESSES', 'Coronavirus (2019-nCoV)']",The New York Times,RealEstate,1063
"‘Nobody Will Tell You This but Me: A True (as Told to Me) Story,’ by Bess Kalb: An Excerpt",2020-03-17,article,Review,,['Books and Literature'],The New York Times,BookReview,2353
"‘Faster: How a Jewish Driver, an American Heiress, and a Legendary Car Beat Hitler’s Best,’ by Neal Bascomb: An Excerpt",2020-03-17,article,Review,,['Books and Literature'],The New York Times,BookReview,1486
Coronavirus in N.Y.: The Latest,2020-03-17,article,briefing,,"['Coronavirus (2019-nCoV)', 'Shutdowns (Institutional)', 'Bars and Nightclubs', 'Art', 'Culture (Arts)', 'Opera', 'Unemployment', 'Museums']",The New York Times,Metro,1166
"Coronavirus, Stock Markets, Primary Elections: Your Tuesday Briefing",2020-03-17,article,briefing,,[],The New York Times,NYTNow,1433
‘It’s Like a War’,2020-03-17,article,News,,"['Politics and Government', 'Deaths (Fatalities)', 'Coronavirus (2019-nCoV)']",The New York Times,Podcasts,363
"Here Come the Bailouts, Starting With the Airlines",2020-03-17,article,News,,"['United States Economy', 'AIRLINES AND AIRPLANES', 'Banking and Financial Institutions', 'Coronavirus (2019-nCoV)']",The New York Times,Business,1178
"On Politics: Somehow, There’s Still an Election",2020-03-17,article,News,,"['Presidential Election of 2020', 'Primaries and Caucuses']",The New York Times,Politics,1320
"As the Coronavirus Spreads, a Question: ‘Will Mortgage Rates Stay Low?’",2020-03-17,article,News,,"['Mortgages', 'Interest Rates', 'Credit and Debt', 'Real Estate and Housing (Residential)', 'Coronavirus (2019-nCoV)', 'Personal Finances']",The New York Times,Business,389
"N.Y.C. May ‘Shelter in Place,’ and M.T.A. Seeks $4 Billion Federal Bailout",2020-03-17,article,News,,['Coronavirus (2019-nCoV)'],The New York Times,Metro,1942
Stephen Colbert Makes a Surprise Return to Late Night,2020-03-17,article,News,,"['Television', 'Coronavirus (2019-nCoV)', 'Quarantines']",The New York Times,Business,617
Rick Atkinson Wins American History Book Prize,2020-03-17,article,News,,"['Museums', 'Books and Literature', 'History (Academic Subject)', 'Awards, Decorations and Honors', 'Revolutionary War, American (1775-83)', 'Culture (Arts)']",The New York Times,Culture,248
"Joe Biden Wins Primaries in Florida, Illinois and Arizona: Highlights",2020-03-17,article,News,,"['Presidential Election of 2020', 'Voting and Voters', 'United States Politics and Government']",The New York Times,Politics,2299
Weekly News Quiz for Students: Special Coronavirus Edition,2020-03-17,multimedia,Interactive Feature,,[],The New York Times,The Learning Network,0
Euro 2020 and Copa América Are Postponed for a Year,2020-03-17,article,News,,"['Soccer', 'UEFA European Football Championship']",The New York Times,Sports,1518
Their School Musicals Were Canceled. Then They Found a Bigger Stage.,2020-03-17,article,News,,"['Theater', 'Education (K-12)', 'Colleges and Universities', 'Coronavirus (2019-nCoV)', 'Social Media', 'Video Recordings, Downloads and Streaming']",The New York Times,Culture,1183
Recent Commercial Real Estate Transactions,2020-03-17,article,News,,"['Real Estate and Housing (Residential)', 'Real Estate (Commercial)']",The New York Times,Business,311
The Designer Who Wore Double-Breasted Suits as a Pre-Schooler,2020-03-17,article,News,,['Fashion and Apparel'],The New York Times,TStyle,1290
The Coronavirus Crisis Is Showing Us How to Live Online,2020-03-17,article,News,,"['Social Media', 'Computers and the Internet', 'Mobile Applications', 'Coronavirus (2019-nCoV)', 'Computer and Video Games', 'Virtual Reality (Computers)', 'Recession and Depression']",The New York Times,Business,1318
"Living In ... Normal Heights, San Diego",2020-03-17,multimedia,Slideshow,,['Real Estate and Housing (Residential)'],The New York Times,Real Estate,0
A Plan to Develop Farmland in Amish Country Meets Resistance,2020-03-17,article,News,,"['AMISH', 'Mennonite Churches', 'Agriculture and Farming', 'Supermarkets and Grocery Stores', 'Mixed-Use Developments', 'Land Use Policies', 'Zoning', 'Area Planning and Renewal', 'Real Estate and Housing (Residential)', 'Real Estate (Commercial)']",The New York Times,Business,1231
"Normal Heights, San Diego: A Tight-Knit Community Within Reach of Downtown",2020-03-17,article,News,,['Real Estate and Housing (Residential)'],The New York Times,RealEstate,1641
What Does It Mean to ‘Shelter in Place’ in California?,2020-03-17,article,briefing,,[],The New York Times,National,1353
Tom Brady Lifted the Patriots. Now Comes a Second Act.,2020-03-17,article,News,,"['Football', 'Free Agents (Sports)']",The New York Times,Sports,1383
"Here’s Looking at You, Grid: A History of Crosswords and Their Fans",2020-03-17,article,Review,,"['Books and Literature', 'Crossword Puzzles']",The New York Times,BookReview,1339
Sugar Is Not the Enemy,2020-03-17,article,News,,"['Sugar', 'Children and Childhood', 'Parenting', 'Diet and Nutrition']",The New York Times,Parenting,1275
A Big List of Podcasts for Little Kids,2020-03-17,article,News,,"['Podcasts', 'Parenting', 'Education (K-12)']",The New York Times,Parenting,808
‘More Severe Than the Great Recession’,2020-03-17,article,Op-Ed,,"['United States Economy', 'Recession and Depression', 'Labor and Jobs', 'United States Politics and Government', 'Federal Aid (US)', 'Layoffs and Job Reductions', 'Law and Legislation', 'Coronavirus (2019-nCoV)', 'Tax Credits, Deductions and Exemptions', 'Economic Conditions and Trends', 'Consumer Behavior']",The New York Times,OpEd,980
"‘Go Big’ on Coronavirus Stimulus, Trump Says, Pitching Checks for Americans",2020-03-17,article,News,,"['Coronavirus (2019-nCoV)', 'Stimulus (Economic)', 'United States Economy', 'United States Politics and Government', 'Federal Taxes (US)', 'Federal Budget (US)', 'Paid Time Off', 'Law and Legislation', 'Epidemics']",The New York Times,Washington,2094
"On the Political Right, Anger and Suspicion Over Virus Precautions",2020-03-17,article,News,,"['United States Politics and Government', 'Shutdowns (Institutional)', 'Quarantines', 'Coronavirus (2019-nCoV)', 'Social Media', 'Fringe Groups and Movements']",The New York Times,Washington,1375
Grace VanderWaal Doesn’t Want to Exist Without ‘Breakfast at Tiffany’s’,2020-03-17,article,News,,['Music'],The New York Times,Arts&Leisure,895
How Coronavirus Has Affected Real Estate,2020-03-17,article,News,,"['Real Estate and Housing (Residential)', 'Real Estate Brokers', 'Quarantines', 'Coronavirus (2019-nCoV)']",The New York Times,RealEstate,1505
Flamenco Dancers Who ‘Move Between Genders’,2020-03-17,article,News,,"['Dancing', 'Flamenco (Dance)', 'Homosexuality and Bisexuality']",The New York Times,Arts&Leisure,1470
The Last Workout,2020-03-17,article,News,,"['Exercise', 'Health Clubs', 'Coronavirus (2019-nCoV)']",The New York Times,Styles,488
‘It Is a Nightmare Out Here’: Seattle Parents Struggle to Balance Work and Child Care,2020-03-17,article,News,,"['Families and Family Life', 'Quarantines', 'Children and Childhood', 'Education (K-12)', 'Coronavirus (2019-nCoV)', 'Child Care', 'Parenting', 'Shutdowns (Institutional)', 'Day Care Centers']",The New York Times,Parenting,1324
Fed Unveils Emergency Lending Programs as Companies Struggle to Raise Cash,2020-03-17,article,News,,"['Coronavirus (2019-nCoV)', 'United States Economy', 'Commercial Paper (Finance)', 'Banking and Financial Institutions']",The New York Times,Business,1383
She Tracked Nazi-Looted Art. She Quit When No One Returned It.,2020-03-17,article,News,,"['Arts and Antiquities Looting', 'Reparations', 'Holocaust and the Nazi Era', 'Museums', 'Jews and Judaism']",The New York Times,Culture,1538
"Having Brushed Off Coronavirus Threat, Southeast Asia Begins to Confront It",2020-03-17,article,News,,"['Coronavirus (2019-nCoV)', 'Politics and Government', 'Epidemics']",The New York Times,Foreign,1041
"In Upstate New York, a Hotel Dedicated to Creatives",2020-03-17,article,News,,"['Travel and Vacations', 'Hotels and Travel Lodgings', 'Culture (Arts)']",The New York Times,TStyle,275
"Africa Braces for Coronavirus, but Slowly",2020-03-17,article,News,,"['Coronavirus (2019-nCoV)', 'Shutdowns (Institutional)', 'Travel Warnings']",The New York Times,Foreign,1110
"10 Accessories in Green, Spring’s Liveliest Hue",2020-03-17,article,News,,['Fashion and Apparel'],The New York Times,TStyle,0
"A Baltimore Barber Who’s With His Clients Through Life, and Death",2020-03-17,article,News,,"['Barbers and Barbering', 'Hair', 'Black People', 'Blacks', 'Murders, Attempted Murders and Homicides', 'Men and Boys', 'Deaths (Fatalities)']",The New York Times,National,878
"In the I.C.U., Before the Coronavirus Storm",2020-03-17,article,News,,"['Coronavirus (2019-nCoV)', 'Quarantines', 'Hospitals']",The New York Times,Well,891
