headline,date,doc_type,material_type,section,keywords,source,news_desk,word_count
"The Green Party’s biggest fan? In some states, it’s the G.O.P.",2020-09-23,article,News,,[],The New York Times,Politics,277
"In Secret Ceremony, Embattled Belarus Strongman Is Sworn In as President",2020-09-23,article,News,,"['Inaugurations', 'Demonstrations, Protests and Riots']",The New York Times,Foreign,655
White House Accused of Improperly Politicizing Review of John Bolton’s Book,2020-09-23,article,News,,"['Books and Literature', 'United States Politics and Government', 'Classified Information and State Secrets', 'Trump-Ukraine Whistle-blower Complaint and Impeachment Inquiry', 'Manuscripts']",The New York Times,Washington,1574
Biden goes to North Carolina and Trump addresses Catholic officials and Bay of Pigs veterans.,2020-09-23,article,News,,[],The New York Times,Politics,68
What to Know About California’s Ballot Propositions,2020-09-23,article,briefing,,[],The New York Times,National,1260
A landslide and a close race are both easy to imagine as polls show Biden competing in red states.,2020-09-23,article,News,,[],The New York Times,Politics,342
"With Proposal to Curb Presidential Power, Democrats Eye an Era After Trump",2020-09-23,article,News,,"['United States Politics and Government', 'Law and Legislation', 'Presidential Election of 2020']",The New York Times,Washington,892
"What You Get for $725,000",2020-09-23,multimedia,Slideshow,,['Real Estate and Housing (Residential)'],The New York Times,Real Estate,0
"$725,000 Homes in Kentucky, Missouri and Minnesota",2020-09-23,article,News,,['Real Estate and Housing (Residential)'],The New York Times,RealEstate,1379
Uncle Ben’s rice products will be rebranded as Ben’s Originals.,2020-09-23,article,News,,"['Names, Organizational', 'ADVERTISING AND MARKETING']",The New York Times,Business,317
"‘Vote or Die’ T-shirts are back, with a twist.",2020-09-23,article,News,,[],The New York Times,Politics,444
A Penthouse in the Mountains of Austria,2020-09-23,multimedia,Slideshow,,"['Real Estate and Housing (Residential)', 'Salzburg Festival']",The New York Times,Real Estate,0
House Hunting in Austria: Skiing Heaven in the Austrian Alps for $1.5 Million,2020-09-23,article,News,,['Real Estate and Housing (Residential)'],The New York Times,RealEstate,1440
A Republican inquiry into Hunter Biden and Ukraine finds no evidence of wrongdoing by his father.,2020-09-23,article,News,,[],The New York Times,Politics,474
Theater to Stream: Catty Birthdays and ‘Lessons in Survival’,2020-09-23,article,News,,"['Theater', 'Quarantine (Life and Culture)']",The New York Times,Weekend,940
Gale Sayers Dies; Elusive Hall of Fame Running Back Was 77,2020-09-23,article,Obituary (Obit),,"['Deaths (Obituaries)', 'Football', 'Football (College)']",The New York Times,Obits,1644
How Lenny Kravitz Keeps His Cool,2020-09-23,article,News,,"['Pop and Rock Music', 'Books and Literature', 'Race and Ethnicity', 'Content Type: Personal Profile']",The New York Times,Arts&Leisure,1877
"Come to Vote, Stay for the Art",2020-09-23,article,News,,"['Art', 'Museums', 'United States Politics and Government', 'Coronavirus (2019-nCoV)', 'Murals', 'Presidential Election of 2020', 'Voting and Voters']",The New York Times,Culture,1163
We’ll Have to Learn to Live With Smoke. Here’s Why.,2020-09-23,article,News,,"['Global Warming', 'Environment', 'Wildfires', 'Respiratory Diseases', 'Air Pollution']",The New York Times,Climate,884
356 Elephants Dropped Dead. Did This Bacteria Poison Them?,2020-09-23,article,News,,"['Elephants', 'Wildlife Die-Offs', 'ALGAE', 'Hazardous and Toxic Substances', 'Conservation of Resources', 'Laboratories and Scientific Equipment', 'your-feed-science', 'your-feed-animals']",The New York Times,Science,798
10 Unusual Streaming Movies for Unusual Times,2020-09-23,article,News,,"['Movies', 'Quarantine (Life and Culture)']",The New York Times,Culture,1080
Three Cheers for Melissa Clark,2020-09-23,article,News,,"['Quarantine (Life and Culture)', 'Cooking and Cookbooks', 'Recipes']",The New York Times,Dining,528
Harry and Meghan Encourage Americans to Vote,2020-09-23,article,News,,"['Voter Registration and Requirements', 'Royal Families', 'Elections', 'Presidential Election of 2020']",The New York Times,Express,536
A Tall Tale About Big Fish Leads to Felonies in Utah,2020-09-23,article,News,,"['Fish and Other Marine Life', 'Wildlife Trade and Poaching', 'Fishing, Sport', 'Bass (Fish)', 'ANIMALS']",The New York Times,Express,886
Republican Inquiry Finds No Evidence of Wrongdoing by Biden,2020-09-23,article,News,,"['Presidential Election of 2020', 'United States Politics and Government', 'Trump-Ukraine Whistle-blower Complaint and Impeachment Inquiry', 'Corruption (Institutional)']",The New York Times,Washington,1432
A Monmouth poll of Georgia shows tight races for president and both Senate seats.,2020-09-23,article,News,,[],The New York Times,Politics,293
"Ron Cobb, a Pioneer in Science Fiction Design, Dies at 83",2020-09-23,article,Obituary (Obit),,"['Deaths (Obituaries)', 'Science Fiction', 'Movies', 'Design']",The New York Times,Obits,885
"‘When She Spoke, People Listened’: Roberts Remembers Ginsburg",2020-09-23,multimedia,Video,,['Funerals and Memorials'],The New York Times,,0
"United States is the richest country in the world, and it has the biggest wealth gap.",2020-09-23,article,News,,[],The New York Times,Business,262
Ginsburg’s ‘Brilliance and Vision’ Honored at Supreme Court Ceremony,2020-09-23,multimedia,Video,,['Funerals and Memorials'],The New York Times,,0
"Democrats, You Can’t Count On the Hispanic Vote",2020-09-23,article,Op-Ed,,"['Hispanic-Americans', 'Minorities', 'Presidential Election of 2020', 'Race and Ethnicity', 'Voting and Voters']",The New York Times,OpEd,739
The Nose Needed for This Coronavirus Test Isn’t Yours. It’s a Dog’s.,2020-09-23,article,News,,"['Coronavirus (2019-nCoV)', 'Dogs', 'Tests (Medical)', 'Research', 'Service Dogs and Other Animals', 'Airport Security']",The New York Times,Foreign,922
The Metropolitan Opera Won’t Reopen for Another Year,2020-09-23,article,News,,"['Opera', 'Coronavirus (2019-nCoV)', 'Shutdowns (Institutional)', 'Race and Ethnicity']",The New York Times,Culture,1830
Hooray (Mostly) for the Government!,2020-09-23,article,News,,"['Computers and the Internet', 'Social Media', 'United States Politics and Government', 'Antitrust Laws and Competition Issues', 'Freedom of Speech and Expression', 'E-Commerce']",The New York Times,NewsDesk,1122
Capturing How Ruth Bader Ginsburg Was Honored in Washington,2020-09-23,article,News,,['Funerals and Memorials'],The New York Times,Washington,310
"Jackie Stallone, Celebrity Astrologer and Sylvester’s Mother, Dies at 98",2020-09-23,article,Obituary (Obit),,"['Astrology', 'Deaths (Obituaries)', 'Celebrities']",The New York Times,Obits,511
Getting Climate Into the Presidential Debates,2020-09-23,article,News,,"['Global Warming', 'Wildfires', 'Air Pollution', 'Medicine and Health', 'Respiratory Diseases']",The New York Times,Climate,763
‘A Wilderness of Error’ Review: Errol Morris in the Fog of Murder,2020-09-23,article,Review,,['Television'],The New York Times,Culture,828
A Kids’ Vaccine Isn’t Coming Anytime Soon,2020-09-23,article,News,,"['E-Learning', 'Quarantine (Life and Culture)', 'Coronavirus Reopenings', 'Education (K-12)', 'Shutdowns (Institutional)', 'Personal Finances', 'Coronavirus (2019-nCoV)', 'Clinical Trials', 'Content Type: Service', 'Children and Childhood', 'Vaccination and Immunization', 'Football (College)', 'ACT (Examination)', 'Parenting', 'Budgets and Budgeting', 'Colleges and Universities', 'Computers and the Internet', 'Education']",The New York Times,National,1198
Spontaneous Nosebleeds Tied to High Blood Pressure,2020-09-23,article,News,,"['Blood Pressure', 'Nosebleed', 'Hypertension']",The New York Times,Well,230
Meet the State Senator Shifting California’s Workplace Culture,2020-09-23,article,News,,"['Discrimination', 'Women and Girls', 'State Legislatures', 'Law and Legislation', 'Workplace Hazards and Violations', 'Family Leaves']",The New York Times,Gender,1479
"Beyond TikTok, Walmart Looks to Transform",2020-09-23,article,News,,"['Shopping and Retail', 'Delivery Services', 'Supermarkets and Grocery Stores', 'E-Commerce']",The New York Times,Business,896
Gillian Flynn Takes Her Paranoia to Television,2020-09-23,article,News,,['Television'],The New York Times,Culture,1649
2 Officers Shot in Louisville Protests Over Breonna Taylor Charging Decision,2020-09-23,article,News,,"['Black Lives Matter Movement', 'Police Brutality, Misconduct and Shootings']",The New York Times,National,3703
How Trump’s Race-Baiting Lets Liberals Off the Hook,2020-09-23,article,News,,"['Race and Ethnicity', 'Affordable Housing', 'Discrimination', 'Segregation and Desegregation']",The New York Times,Magazine,1194
Harry and Meghan encouraged Americans to register to vote and to reject hate speech.,2020-09-23,article,News,,[],The New York Times,Politics,287
"M.L.B. Awards: In a Short Season, Veterans Are Standing Out",2020-09-23,article,News,,"['Awards, Decorations and Honors', 'Baseball', 'Cy Young Award']",The New York Times,Sports,1248
"Progressives Defeat Brooklyn Project That Promised 20,000 Jobs",2020-09-23,article,News,,"['Zoning', 'Gentrification', 'Area Planning and Renewal']",The New York Times,Metro,1296
"Saudi King, in First U.N. Speech, Assails Longtime Nemesis Iran",2020-09-23,article,News,,"['Beirut, Lebanon, Explosions (2020)']",The New York Times,Foreign,1067
"M.L.B.’s Unusual Postseason: 16 Teams, Neutral Sites and No Days Off",2020-09-23,article,News,,"['Playoff Games', 'Baseball', 'World Series']",The New York Times,Sports,1029
"Heat and Drought Team Up More Frequently, With Disastrous Results",2020-09-23,article,News,,"['Global Warming', 'Weather', 'Drought', 'Research', 'Wildfires']",The New York Times,Climate,778
We Want to Hear From You: How Would You Change the Supreme Court?,2020-09-23,article,Letter,,"['Appointments and Executive Changes', 'United States Politics and Government']",The New York Times,Letters,73
"False Claims, Spread by a Trump Son, That Biden Used a Teleprompter",2020-09-23,article,News,,"['Presidential Election of 2020', 'Rumors and Misinformation', 'Video Recordings, Downloads and Streaming']",The New York Times,Business,163
The Home Schoolfluencers,2020-09-23,article,News,,"['Home Schooling', 'Parenting', 'Families and Family Life']",The New York Times,Styles,1984
"200,000 Covid Dead: An American Tragedy",2020-09-23,article,Letter,,"['Coronavirus (2019-nCoV)', 'United States Politics and Government']",The New York Times,Letters,790
Judge Orders Eric Trump to Testify in N.Y. Fraud Inquiry,2020-09-23,article,News,,"['Presidential Election of 2020', 'Trump Tax Returns']",The New York Times,Metro,900
E.P.A. Rejects Its Own Findings That a Pesticide Harms Children’s Brains,2020-09-23,article,News,,"['Environment', 'Hazardous and Toxic Substances', 'Pesticides', 'United States Politics and Government', 'Regulation and Deregulation of Industry', 'Children and Childhood', 'Babies and Infants']",The New York Times,Climate,800
Experts Warn a Rare Pediatric Condition May Re-emerge This Fall,2020-09-23,article,News,,"['Acute Flaccid Myelitis', 'Content Type: Service', 'Fever', 'Parenting', 'Enterovirus 68', 'Therapy and Rehabilitation', 'Physical Therapy', 'Brain', 'Children and Childhood']",The New York Times,Parenting,1243
How Memes and a Good Laugh Can Help People in Recovery,2020-09-23,article,News,,"['Drug Abuse and Traffic', 'Alcohol Abuse', 'Comedy and Humor', 'Mental Health and Disorders', 'Social Media', 'Content Type: Service', 'your-feed-selfcare']",The New York Times,Styles,723
Biden Could Be Our Second Catholic President. Does It Matter?,2020-09-23,article,Op-Ed,,"['Liberalism (US Politics)', 'United States Politics and Government', 'Discrimination', 'ABORTION', 'Presidential Election of 2020']",The New York Times,OpEd,1551
Justice Dept. Urges Congress to Limit Tech’s Legal Shield,2020-09-23,article,News,,"['Freedom of Speech and Expression', 'Law and Legislation', 'Computers and the Internet', 'United States Politics and Government', 'Social Media', 'Censorship']",The New York Times,Business,798
Your Thursday Briefing,2020-09-23,article,briefing,,[],The New York Times,NYTNow,1516
U.S. Rationale for Military Aid to Saudis in Yemen War Is Fraying,2020-09-23,article,News Analysis,,"['United States International Relations', 'United States Defense and Military Forces', 'Civilian Casualties', 'Defense and Military Forces', 'Arms Trade', 'War Crimes, Genocide and Crimes Against Humanity', 'United States Politics and Government']",The New York Times,Washington,1447
"Naomi Biden writes a personal tribute to her father, Hunter, after politicized Senate report.",2020-09-23,article,News,,[],The New York Times,Politics,382
Secrets of the Most Thankless N.B.A. Job: Referee,2020-09-23,article,News,,"['Officiating (Sports)', 'Basketball']",The New York Times,Sports,1165
Museum Fires Curator Who It Says Sexually Harassed Student Researcher,2020-09-23,article,News,,"['Museums', 'Sexual Harassment', 'Graduate Schools and Students']",The New York Times,Culture,1136
California Plans to Ban Sales of New Gas-Powered Cars in 15 Years,2020-09-23,article,News,,"['Global Warming', 'Greenhouse Gas Emissions', 'Automobiles', 'Fuel Emissions (Transportation)', 'Electric and Hybrid Vehicles', 'Oil (Petroleum) and Gasoline', 'Regulation and Deregulation of Industry', 'Executive Orders and Memorandums']",The New York Times,Climate,1151
Maybe the Best Home School Is … on a Boat?,2020-09-23,article,News,,"['Quarantine (Life and Culture)', 'Boats and Boating', 'Children and Childhood', 'Education (K-12)', 'Home Schooling']",The New York Times,Styles,1836
"Juliette Gréco, Grande Dame of Chanson Française, Dies at 93",2020-09-23,article,Obituary (Obit),,"['Deaths (Obituaries)', 'Music', 'ACTORS AND ACTRESSES']",The New York Times,Obits,1101
Journalists Are Leaving the Noisy Internet for Your Email Inbox,2020-09-23,article,News,,"['News and News Media', 'Newsletters']",The New York Times,Business,1096
Listening Closely to the Birds,2020-09-23,article,News,,['Quarantine (Life and Culture)'],The New York Times,AtHome,821
TikTok Files for Injunction to Stop Ban of App,2020-09-23,article,News,,"['Mobile Applications', 'Mergers, Acquisitions and Divestitures', 'Social Media', 'Executive Orders and Memorandums', 'Computers and the Internet', 'United States Politics and Government']",The New York Times,Business,526
One Officer Charged in Breonna Taylor Case,2020-09-23,multimedia,Video,,"['Murders, Attempted Murders and Homicides']",The New York Times,,0
Biden Gives Cautious Answers on Breonna Taylor and the Supreme Court,2020-09-23,article,News,,"['Presidential Election of 2020', ""Women's Rights"", 'ABORTION', 'Appointments and Executive Changes', 'United States Politics and Government', 'Black People', 'Blacks']",The New York Times,Politics,862
Trump says he wants a conservative majority on the Supreme Court in case of an Election Day dispute.,2020-09-23,article,News,,['United States Politics and Government'],The New York Times,Politics,286
A Capital Engulfed by Sadness and Rage,2020-09-23,article,News,,"['United States Politics and Government', 'Presidential Election of 2020', 'Funerals and Memorials']",The New York Times,Washington,1092
Americans Have Lost $145 Million to Coronavirus Fraud,2020-09-23,article,News,,"['Coronavirus (2019-nCoV)', 'Frauds and Swindling', 'Identity Theft', 'Rumors and Misinformation', 'Elderly', 'Content Type: Service']",The New York Times,Express,694
"At Cal, Every Sport but Football Feels Like Second String",2020-09-23,article,News,,"['Football (College)', 'Coronavirus Reopenings', 'Volleyball', 'Track and Field', 'College Athletics', 'Basketball (College)']",The New York Times,Sports,1875
Trump Turns Attack on MSNBC Journalist Into Rally Fodder,2020-09-23,article,News,,"['News and News Media', 'United States Politics and Government', 'George Floyd Protests (2020)']",The New York Times,Business,654
"12,000 Feet Up, With a Storm Coming In",2020-09-23,multimedia,Interactive Feature,,"['Mountaineering', 'Rock Climbing', 'Photography']",The New York Times,Magazine,0
Gale Sayers’s Balletic Runs Obscure Football’s Brutal Endings,2020-09-23,article,Obituary (Obit),,"['Football', 'Sports Injuries', 'Dementia']",The New York Times,Sports,863
A Girl Wanted to Try Out for Boys’ Tennis. Ginsburg Helped Make It Happen.,2020-09-23,article,News,,"['Tennis', 'Discrimination', 'Women and Girls', 'Suits and Litigation (Civil)', 'Education (K-12)', 'Fourteenth Amendment (US Constitution)']",The New York Times,Sports,1181
Trump Thinks Nov. 3 Election ‘Will End Up in the Supreme Court’,2020-09-23,multimedia,Video,,"['United States Politics and Government', 'Appointments and Executive Changes', 'Presidential Election of 2020']",The New York Times,,0
Arthur Sulzberger Jr. to Retire as New York Times Company Chairman,2020-09-23,article,News,,"['Appointments and Executive Changes', 'News and News Media', 'Newspapers', 'Boards of Directors']",The New York Times,Business,1072
E.U. Offers Cash and More Deportations in New Plan for Migrants,2020-09-23,article,News,,"['Middle East and Africa Migrant Crisis', 'Immigration and Emigration', 'Refugees and Displaced Persons', 'Asylum, Right of']",The New York Times,Foreign,1056
News Groups: A Simple but Powerful Media Literacy Idea to Build Community,2020-09-23,article,News,,[],The New York Times,Learning,2341
Times Readers Reflect on Ruth Bader Ginsburg,2020-09-23,multimedia,Interactive Feature,,['Careers and Professions'],The New York Times,Reader Center,0
Coronavirus Briefing: What Happened Today,2020-09-23,article,briefing,,['Coronavirus (2019-nCoV)'],The New York Times,NYTNow,1112
"Argentina Spied on Families of Lost Submarine Crew, Officials Say",2020-09-23,article,News,,"['Submarines and Submersibles', 'Maritime Accidents and Safety']",The New York Times,Foreign,839
Beaked Whale Shatters Record With 3 Hour 42 Minute Dive,2020-09-23,article,News,,"['Whales and Whaling', 'Diving and Divers', 'Animal Behavior', 'Mammals', 'Fish and Other Marine Life', 'Biology and Biochemistry', 'Oceans and Seas', 'ANATOMY AND PHYSIOLOGY', 'Marine Biology', 'Research', 'your-feed-science', 'your-feed-animals']",The New York Times,Science,711
"Breonna Taylor, Justice Ginsburg, M.L.B.: Your Wednesday Evening Briefing",2020-09-23,article,briefing,,[],The New York Times,NYTNow,1279
Homeland Security Chief Denies Downplaying White Supremacist Threat,2020-09-23,article,News,,"['United States Politics and Government', 'Cyberwarfare and Defense', 'Fringe Groups and Movements', 'Right-Wing Extremism and Alt-Right']",The New York Times,Washington,1224
Soccer Player’s Bid for Italian Citizenship Prompts Claim of Rigged Test,2020-09-23,article,News,,"['Citizenship and Naturalization', 'Italian Language', 'Soccer', 'Immigration and Emigration']",The New York Times,Sports,996
"What Is ‘Wanton Endangerment,’ the Charge in the Breonna Taylor Case?",2020-09-23,article,News,,"['Murders, Attempted Murders and Homicides', 'Police Brutality, Misconduct and Shootings', 'Crime and Criminals']",The New York Times,National,362
Performing in a Pandemic,2020-09-23,multimedia,Interactive Feature,,"['Theater', 'Quarantine (Life and Culture)']",The New York Times,Theater,0
Can You Advise if You’ve Already Consented?,2020-09-23,article,News,,"['Appointments and Executive Changes', 'United States Politics and Government', 'Presidential Election of 2020']",The New York Times,Politics,1277
Protests Erupt in Louisville After Breonna Taylor Decision,2020-09-23,multimedia,Video,,"['Demonstrations, Protests and Riots', 'Murders, Attempted Murders and Homicides', 'Police Brutality, Misconduct and Shootings', 'Black Lives Matter Movement']",The New York Times,,0
100 N.Y.C. School Buildings Have Already Reported a Positive Case,2020-09-23,article,News,,"['Coronavirus (2019-nCoV)', 'Education (K-12)', 'Contact Tracing (Public Health)', 'Teachers and School Employees', 'Shutdowns (Institutional)', 'Education (Pre-School)', 'Coronavirus Reopenings', 'Disease Rates']",The New York Times,Metro,1326
F.D.A. Requires Stronger Warning Label for Xanax and Similar Drugs,2020-09-23,article,News,,"['Drug Abuse and Traffic', 'Drugs (Pharmaceuticals)', 'Mental Health and Disorders', 'Opioids and Opiates', 'your-feed-healthcare']",The New York Times,Science,321
Trump Nominates Former Nunes Aide to Intelligence Watchdog Post,2020-09-23,article,News,,"['Trump-Ukraine Whistle-blower Complaint and Impeachment Inquiry', 'Espionage and Intelligence Services', 'Appointments and Executive Changes', 'Inspectors General', 'United States Politics and Government', 'Ethics and Official Misconduct']",The New York Times,Washington,478
Ginsburg Clerks Remember Her as a Mentor Who Treated Them Like Family,2020-09-23,article,News,,"['Legal Profession', 'Families and Family Life', 'United States Politics and Government']",The New York Times,Washington,1093
"Trump May Reject Tougher F.D.A. Vaccine Standards, Calling Them ‘Political’",2020-09-23,article,News,,"['Coronavirus (2019-nCoV)', 'Masks', 'United States Politics and Government', 'Vaccination and Immunization', 'Presidential Election of 2020']",The New York Times,Washington,1250
Chief Executive of Embattled Alaskan Mine Project Resigns,2020-09-23,article,News,,"['Mines and Mining', 'Appointments and Executive Changes', 'Regulation and Deregulation of Industry', 'United States Politics and Government']",The New York Times,Climate,733
Fired Officer Is Indicted in Breonna Taylor Case; Protesters Wanted Stronger Charges,2020-09-24,article,News,,"['Police Brutality, Misconduct and Shootings', 'Black Lives Matter Movement', 'George Floyd Protests (2020)', 'Demonstrations, Protests and Riots']",The New York Times,National,1539
The Republican Irritation Olympics,2020-09-24,article,Op-Ed,,"['Appointments and Executive Changes', 'Presidential Election of 2020', 'United States Politics and Government', 'Presidential Election of 2016', 'Presidential Election of 2008', 'Courts and the Judiciary']",The New York Times,OpEd,940
Ginsburg Remembered as Champion of Justice as Struggle Continues Over Her Successor,2020-09-24,article,News,,"['United States Politics and Government', 'Presidential Election of 2020', ""Women's Rights"", 'Funerals and Memorials', 'Capitol Building (Washington, DC)', 'Patient Protection and Affordable Care Act (2010)', 'ABORTION', 'Appointments and Executive Changes']",The New York Times,Washington,1741
Trump Won’t Commit to ‘Peaceful’ Post-Election Transfer of Power,2020-09-24,article,News,,"['Presidential Election of 2020', 'United States Politics and Government', 'Absentee Voting']",The New York Times,Washington,986
‘Have I Ever Steered You Wrong?’,2020-09-24,article,News,,['Crossword Puzzles'],The New York Times,Games,1316
Quotation of the Day: Officer Charged and Two Cleared in Taylor Killing,2020-09-24,article,Quote,,[],The New York Times,Summary,62
"Corrections: Sept. 24, 2020",2020-09-24,article,Correction,,[],The New York Times,Corrections,214
"Breonna Taylor, Coronavirus Vaccine, Belarus: Your Thursday Briefing",2020-09-24,article,briefing,,[],The New York Times,NYTNow,1664
James Rodríguez Is Here to Entertain You,2020-09-24,article,News,,['Soccer'],The New York Times,Sports,1553
N.F.L. Week 3 Predictions: Our Picks Against the Spread,2020-09-24,article,News,,['Football'],The New York Times,Sports,2404
"Nothing Eats Viruses, Right? Meet Some Hungry Protists",2020-09-24,article,News,,"['Microbiology', 'Viruses', 'Oceans and Seas', 'Research', 'your-feed-science', 'Fish and Other Marine Life']",The New York Times,Science,923
Record Wildfires on the West Coast Are Capping a Disastrous Decade,2020-09-24,multimedia,Interactive Feature,,"['Wildfires', 'Global Warming']",The New York Times,Climate,0
"The Lightning Gain Stamkos, and the Lead",2020-09-24,article,News,,"['Playoff Games', 'Hockey, Ice', 'Stanley Cup']",The New York Times,Sports,943
There’s a Simple Reason Spain Has Been Hit Hard by Coronavirus,2020-09-24,article,Op-Ed,,"['Politics and Government', 'Coronavirus Reopenings', 'Coronavirus (2019-nCoV)', 'Polls and Public Opinion', 'Disease Rates', 'Contact Tracing (Public Health)']",The New York Times,OpEd,1098
North Korea Accused of Shooting and Burning South Korean Defector,2020-09-24,article,News,,"['Defense and Military Forces', 'Murders, Attempted Murders and Homicides', 'Coronavirus (2019-nCoV)']",The New York Times,Foreign,983
Word + Quiz: huckster,2020-09-24,article,News,,[],The New York Times,Learning,230
A Manila Barbershop’s Mirrors Reflect the Pain of the Pandemic,2020-09-24,article,News,,"['Coronavirus (2019-nCoV)', 'Barbers and Barbering', 'Deaths (Fatalities)', 'Recession and Depression']",The New York Times,Foreign,819
Wave Rider,2020-09-24,article,News,,[],The New York Times,Learning,218
Basketball Persists in Mexico Amid the Pandemic,2020-09-24,article,News,,"['Coronavirus Reopenings', 'Basketball']",The New York Times,Sports,1289
Now’s the Time for Wigs. If You Can Get the Hair for Them.,2020-09-24,article,News,,"['Wigs', 'Black People', 'Blacks', 'Quarantine (Life and Culture)', 'Hair', 'E-Commerce', 'Women and Girls']",The New York Times,Styles,1726
"Trump Rallies Are High-Risk Activities, Seth Meyers Says",2020-09-24,article,News,,[],The New York Times,Culture,684
Lesson of the Day: ‘Mind Games: The Conservation Test’,2020-09-24,article,News,,[],The New York Times,Learning,949
"Even as Virus Surges, Hungary Forges Ahead With Super Cup Soccer Game",2020-09-24,article,News,,"['Soccer', 'Coronavirus (2019-nCoV)', 'Stadiums and Arenas']",The New York Times,Foreign,753
