headline,date,doc_type,material_type,section,keywords,source,news_desk,word_count
"When You Hate Your Neighbor, and Then Your Kids Start Dating",2020-03-10,article,Review,,['Books and Literature'],The New York Times,BookReview,1212
What Happened When a Times Reporter Traded Brooklyn for Dakar,2020-03-10,article,Review,,"['Books and Literature', 'Women and Girls', 'Kidnapping and Hostages']",The New York Times,BookReview,1210
"New & Noteworthy: Lorrie Moore’s Collected Stories, and More",2020-03-10,article,News,,['Books and Literature'],The New York Times,BookReview,373
"For the First of 9 Children, a Quest to Understand Mother",2020-03-10,article,Review,,['Books and Literature'],The New York Times,BookReview,632
National Primary Results Map: Where Biden and Sanders Have Won,2020-03-10,multimedia,Interactive Feature,,"['Elections', 'Presidential Election of 2020']",The New York Times,U.S.,0
Two Lies and a Truth: Story Collections Exploring the Spectrum of Human Honesty,2020-03-10,article,News,,['Books and Literature'],The New York Times,BookReview,1169
Strikes and Attack Ads: The Hard Roads to Universal Health Care,2020-03-10,multimedia,Interactive Feature,,"['Health Insurance and Managed Care', 'Politics and Government', 'Law and Legislation']",The New York Times,The Upshot,0
Colombia Is Dealing With a Terrifying Refugee Crisis. Will Wealthy Nations Step Up to Help?,2020-03-10,article,Op-Ed,,"['Politics and Government', 'Refugees and Displaced Persons']",The New York Times,OpEd,896
How Siblings’ Gender Can Affect a Child’s Development,2020-03-10,article,News,,"['Families and Family Life', 'Children and Childhood', 'Parenting', 'Evolution (Biology)', 'Gender']",The New York Times,Well,1146
What if Gatsby Worked at a Tech Start-Up?,2020-03-10,article,Review,,['Books and Literature'],The New York Times,BookReview,660
"From Homelessness to Donald Trump, This Art Group Takes on All",2020-03-10,article,News,,"['Art', 'Presidential Election of 2020']",The New York Times,SpecialSections,1053
The Governor and the $6 Billion Budget Gap,2020-03-10,article,News,,"['Budgets and Budgeting', 'Medicaid', 'Politics and Government', 'Health Insurance and Managed Care', 'Minimum Wage', 'Home Health Care']",The New York Times,Metro,1148
"On ‘Love Is Blind,’ Love Is Earnest",2020-03-10,article,Op-Ed,,"['Reality Television', 'Dating and Relationships', 'Love (Emotion)']",The New York Times,OpEd,1362
"Epic, Ikon and Mountain Collective: Updates to Next Year’s Ski Passes",2020-03-10,article,News,,"['Skiing', 'Travel and Vacations']",The New York Times,Travel,819
Should Parents Track Their Children?,2020-03-10,article,News,,[],The New York Times,Learning,1176
God vs. Coronavirus,2020-03-10,article,Op-Ed,,"['Religion and Belief', 'Coronavirus (2019-nCoV)', 'Prayers and Prayer Books', 'Epidemics']",The New York Times,OpEd,1132
Sick Politicians and a Lack of Urgency: Tracking Iran’s Response to Coronavirus,2020-03-10,multimedia,Video,,"['Coronavirus (2019-nCoV)', 'Politics and Government', 'Epidemics']",The New York Times,,0
Coronavirus Brings a New Legislative Push for Paid Sick Leave,2020-03-10,article,News,,"['Paid Time Off', 'Coronavirus (2019-nCoV)', 'Epidemics', 'Law and Legislation', 'United States Politics and Government']",The New York Times,Upshot,780
UConn? Worried? Not as Long as Auriemma Is in Charge,2020-03-10,article,News,,"['Basketball (College)', 'Coaches and Managers']",The New York Times,Sports,1001
Afraid of Coronavirus? I Know What That Fear Is Like,2020-03-10,article,Op-Ed,,"['Coronavirus (2019-nCoV)', 'Anxiety and Stress']",The New York Times,OpEd,1153
"Stalkers, Chat Bots and Trolls: Stories From Our Lives Online",2020-03-10,article,Review,,['Books and Literature'],The New York Times,BookReview,672
I Wasted My Vote in a State That Finally Matters,2020-03-10,article,Op-Ed,,"['Presidential Election of 2020', 'Primaries and Caucuses']",The New York Times,OpEd,548
Joe Biden Is No Longer Toast,2020-03-10,article,Op-Ed,,"['Presidential Election of 2020', 'United States Politics and Government', 'Primaries and Caucuses', 'Coronavirus (2019-nCoV)']",The New York Times,OpEd,1366
A Fresh Take on the Mayflower’s History,2020-03-10,article,News,,"['Art', 'Native Americans', 'Pilgrims (Plymouth, Mass)', 'Museums', 'Immigration and Emigration', 'Indigenous People']",The New York Times,SpecialSections,1183
Philadelphia Museum Is in Reset Mode After Controversies,2020-03-10,article,News,,"['Museums', 'Workplace Environment', 'Sexual Harassment', 'Art']",The New York Times,Culture,1227
"Russia Trying to Stoke U.S. Racial Tensions Before Election, Officials Say",2020-03-10,article,News,,"['Presidential Election of 2020', 'Cyberwarfare and Defense', 'Espionage and Intelligence Services', 'Russian Interference in 2016 US Elections and Ties to Trump Associates', 'Race and Ethnicity', 'Black People', 'Blacks', 'Whites', 'Fringe Groups and Movements', 'Neo Nazi Groups', 'United States Politics and Government', 'Social Media', 'Discrimination']",The New York Times,Washington,1320
Politicians’ Use of ‘Wuhan Virus’ Starts a Debate Health Experts Wanted to Avoid,2020-03-10,article,News,,"['Coronavirus (2019-nCoV)', 'Epidemics', 'Discrimination', 'United States Politics and Government', 'Rumors and Misinformation']",The New York Times,Washington,1159
We’ve Been Looking in the Wrong Places to Understand Sanders’s Socialism,2020-03-10,article,Op-Ed,,"['Politics and Government', 'Presidential Election of 2020', 'United States Politics and Government']",The New York Times,OpEd,1166
She’s Been a Nurse for 10 Years. Panic Has Finally Arrived.,2020-03-10,article,Op-Ed,,"['Coronavirus (2019-nCoV)', 'Nursing and Nurses', 'Nursing Homes', 'Epidemics']",The New York Times,OpEd,1220
"Bloomberg’s Job Security Promises Are Falling Through, Campaign Workers Say",2020-03-10,article,News,,"['Labor and Jobs', 'Wages and Salaries', 'Presidential Election of 2020', 'Primaries and Caucuses', 'Nondisclosure Agreements']",The New York Times,Politics,804
Richly Decorated Memorials Emerge From Ancient Traditions,2020-03-10,article,News,,"['Indigenous Australians', 'Art', 'Museums']",The New York Times,SpecialSections,887
"For Me, Rewatching ‘Contagion’ Was Fun, Until It Wasn’t",2020-03-10,article,News,,"['Coronavirus (2019-nCoV)', 'Epidemics', 'Movies']",The New York Times,Culture,1156
Where to Celebrate the 50th Anniversary of Earth Day,2020-03-10,article,News,,"['Earth Day', 'Conventions, Fairs and Trade Shows', 'Geography', 'Cooking and Cookbooks', 'Travel and Vacations', 'Philanthropy']",The New York Times,Travel,829
"In Divided Michigan District, Debbie Dingell Straddles the Biden-Sanders Race",2020-03-10,article,News,,"['Elections, House of Representatives', 'Presidential Election of 2020', 'Voting and Voters']",The New York Times,Politics,1571
Bernie Sanders Versus the World,2020-03-10,article,Op-Ed,,"['Primaries and Caucuses', 'Poverty', 'Welfare (US)', 'North American Free Trade Agreement', 'International Trade and World Market', 'Organized Labor']",The New York Times,OpEd,1242
"When ‘Gentefied’ Straddles More Than One Culture, It Feels Real",2020-03-10,article,News,,"['Hispanic-Americans', 'Gentrification', 'Web-Original Programming', 'Families and Family Life']",The New York Times,Culture,1192
Is This What Post-MeToo Looks Like?,2020-03-10,article,News,,"['Women and Girls', 'Fashion and Apparel', 'Lingerie and Underwear', '#MeToo Movement', 'your-feed-fashion']",The New York Times,Styles,1113
It’s a ‘Swimming Naked’ Moment: The Financial System Has a Real Test,2020-03-10,article,News,,"['United States Economy', 'Banking and Financial Institutions', 'Credit and Debt', 'Recession and Depression', 'Stocks and Bonds', 'Interest Rates', 'Travel and Vacations', 'Collateralized Debt Obligations', 'Dow Jones Stock Average']",The New York Times,Business,1210
‘Proselytizing Robots’: Inside South Korean Church at Outbreak’s Center,2020-03-10,article,News,,"['Religious Cults', 'Coronavirus (2019-nCoV)', 'Epidemics']",The New York Times,Foreign,2031
Coronavirus Outbreak Has America’s Homeless at Risk of ‘Disaster’,2020-03-10,article,News,,"['Homeless Persons', 'Coronavirus (2019-nCoV)', 'Epidemics', 'Deaths (Fatalities)', 'Hygiene and Cleanliness', 'Hepatitis']",The New York Times,National,1119
"Lost, and Now Found, Art From the Civil Rights Era",2020-03-10,article,News,,"['Art', 'Black People', 'Blacks', 'Museums', 'Race and Ethnicity']",The New York Times,SpecialSections,1337
"Escape Into Cottagecore, Calming Ethos for Our Febrile Moment",2020-03-10,article,News,,"['Social Media', 'Interior Design and Furnishings', 'Agriculture and Farming', 'Flowers and Plants']",The New York Times,Styles,1605
New York City Museums Teach the History of Immigration,2020-03-10,article,News,,"['Museums', 'Chinese-Americans', 'Immigration and Emigration', 'Synagogues', 'Jews and Judaism']",The New York Times,SpecialSections,1348
An Indoor-Outdoor House with Catskill Views,2020-03-10,multimedia,Slideshow,,"['Real Estate and Housing (Residential)', 'Interior Design and Furnishings', 'Restoration and Renovation', 'Home Repairs and Improvements', 'Furniture']",The New York Times,Real Estate,0
"An Escape From Brooklyn, and a ‘Couple’s Project’",2020-03-10,article,News,,"['Real Estate and Housing (Residential)', 'Interior Design and Furnishings', 'Home Repairs and Improvements', 'Restoration and Renovation', 'Furniture']",The New York Times,RealEstate,814
Over 140 Confirmed Cases of Coronavirus in New York State,2020-03-10,article,briefing,,"['Coronavirus (2019-nCoV)', 'Quarantines', 'Blindness', 'Deafness', 'Movies']",The New York Times,Metro,1101
"Coronavirus, Michigan, Max von Sydow: Your Tuesday Briefing",2020-03-10,article,briefing,,[],The New York Times,NYTNow,1493
The Field: What Happened to Elizabeth Warren?,2020-03-10,article,News,,"['Presidential Election of 2020', 'United States Politics and Government']",The New York Times,Podcasts,319
Can I Boost My Immune System?,2020-03-10,article,News,,"['Immune System', 'Vitamins', 'Coronavirus (2019-nCoV)', 'Vitamin D', 'Anxiety and Stress', 'ALCOHOLIC BEVERAGES', 'Sleep']",The New York Times,Smarter Living,1385
"Xi Goes to Wuhan, Coronavirus Epicenter, in Show of Confidence",2020-03-10,article,News,,"['Coronavirus (2019-nCoV)', 'Politics and Government', 'Propaganda', 'Quarantines', 'Epidemics']",The New York Times,Foreign,1411
"Coronavirus Turmoil in 5 Charts, 10 Quotes, 5 Photos and 1 Map",2020-03-10,article,News,,"['Coronavirus (2019-nCoV)', 'Banking and Financial Institutions', 'Oil (Petroleum) and Gasoline']",The New York Times,Business,1304
"A Call to Arms: Under Attack, Pro-Vaccine Doctors Fight Back",2020-03-10,article,News,,"['Vaccination and Immunization', 'Social Media', 'Cyberharassment', 'Consumer Reviews', 'Demonstrations, Protests and Riots', 'Doctors', 'Computers and the Internet', 'Children and Childhood', 'Cyberattacks and Hackers', 'your-feed-healthcare']",The New York Times,Science,1496
N.Y. Creates ‘Containment Zone’ Limiting Large Gatherings in New Rochelle,2020-03-10,article,News,,['Coronavirus (2019-nCoV)'],The New York Times,Metro,2020
On Politics: A Big Day in Michigan,2020-03-10,article,News,,['Primaries and Caucuses'],The New York Times,Politics,1239
European Carmakers Worry Coronavirus Outbreak May Hurt Sales,2020-03-10,article,News,,"['Automobiles', 'Coronavirus (2019-nCoV)', 'Recession and Depression', 'Epidemics', 'Factories and Manufacturing']",The New York Times,Business,886
What if Galileo Had Dropped Bobsleds From the Tower of Pisa?,2020-03-10,article,News,,"['Weights and Measures', 'Bobsledding', 'Gravitation and Gravity', 'Physics', 'your-feed-science']",The New York Times,Science,560
We Don’t Need to Close Schools to Fight the Coronavirus,2020-03-10,article,Op-Ed,,"['Coronavirus (2019-nCoV)', 'Swine Influenza', 'Epidemics', 'Influenza', 'Education (K-12)', 'Children and Childhood', 'Shutdowns (Institutional)']",The New York Times,OpEd,864
"Weekly News Quiz for Students: Super Tuesday, Stock Markets, NASA Rover",2020-03-10,multimedia,Interactive Feature,,[],The New York Times,The Learning Network,0
7 Steps to Take Against the Coronavirus,2020-03-10,article,Op-Ed,,"['Hygiene and Cleanliness', 'Coronavirus (2019-nCoV)', 'Stockpiling', 'Elderly', 'Quarantines']",The New York Times,OpEd,715
Recent Commercial Real Estate Transactions,2020-03-10,article,News,,"['Real Estate and Housing (Residential)', 'Real Estate (Commercial)']",The New York Times,Business,293
Highlights From Democratic Primary Results: Joe Biden Wins Four States,2020-03-10,article,News,,"['Presidential Election of 2020', 'Primaries and Caucuses', 'United States Politics and Government']",The New York Times,Politics,2717
Spring’s New Romantic Look,2020-03-10,article,News,,['Fashion and Apparel'],The New York Times,TStyle,203
"Living In ... Alameda, Calif.",2020-03-10,multimedia,Slideshow,,['Real Estate and Housing (Residential)'],The New York Times,Real Estate,0
"Alameda, Calif.: On San Francisco Bay, With Great Views and Rising Prices",2020-03-10,article,News,,['Real Estate and Housing (Residential)'],The New York Times,RealEstate,1738
"Putin Endorses Brazen Remedy to Extend His Rule, Possibly for Life",2020-03-10,article,News,,"['Term Limits (Political Office)', 'Politics and Government', 'Constitutional Amendments']",The New York Times,Foreign,1134
What It Was Like Aboard the Grand Princess in Oakland,2020-03-10,article,briefing,,[],The New York Times,National,1192
What the Polls Say About Today’s Primaries,2020-03-10,article,News,,"['Presidential Election of 2020', 'Polls and Public Opinion', 'Primaries and Caucuses', 'United States Politics and Government']",The New York Times,Politics,735
"The Good, the Bad and the Ugly: A Neurotic Filmmaker’s Life Story",2020-03-10,article,Review,,"['Books and Literature', 'Movies']",The New York Times,BookReview,1342
Trump Pitches Coronavirus-Related Stimulus Package on Capitol Hill,2020-03-10,article,News,,"['United States Economy', 'Coronavirus (2019-nCoV)']",The New York Times,Washington,903
"Sorry, but Working From Home Is Overrated",2020-03-10,article,News,,"['Telecommuting', 'Work-Life Balance', 'Productivity', 'Workplace Environment', 'Coronavirus (2019-nCoV)', 'Videophones and Videoconferencing']",The New York Times,Business,1107
A Watch Brought Back From the Brink of Extinction,2020-03-10,article,News,,['Watches and Clocks'],The New York Times,TStyle,227
Halfhearted Millennial Coronavirus Prep in a New York City Apartment,2020-03-10,article,Op-Ed,,"['Quarantines', 'Coronavirus (2019-nCoV)', 'Income Inequality', 'Shutdowns (Institutional)', 'Labor and Jobs']",The New York Times,OpEd,958
Nursing Homes Becoming Islands of Isolation Amid ‘Shocking’ Mortality Rate,2020-03-10,article,News,,"['Coronavirus (2019-nCoV)', 'Nursing Homes', 'Retirement Communities and Assisted Living', 'Epidemics', 'Deaths (Fatalities)']",The New York Times,National,1606
"‘My Dark Vanessa,’ by Kate Elizabeth Russell: An Excerpt",2020-03-10,article,Review,,['Books and Literature'],The New York Times,BookReview,3070
A Deli With Something Extra,2020-03-10,multimedia,Slideshow,,"['Delicatessens', 'Pastrami']",The New York Times,Food,0
Where Pastrami on Rye Rubs Elbows With Falafel and Baklava,2020-03-10,article,Review,,"['Restaurants', 'Pastrami', 'Delicatessens', 'Sandwiches', 'Beef']",The New York Times,Dining,1270
Cruise Line Ads Get Caught in a Coronavirus News Cycle,2020-03-10,article,News,,"['Cruises', 'ADVERTISING AND MARKETING', 'Coronavirus (2019-nCoV)', 'Epidemics', 'News and News Media']",The New York Times,Business,929
A Gallery of Final Choices,2020-03-10,multimedia,Slideshow,,"['Photography', 'Venice Biennale', 'Prisons and Prisoners', 'Capital Punishment']",The New York Times,Food,0
"Last Meals on Death Row, a Peculiarly American Fascination",2020-03-10,article,News,,"['Capital Punishment', 'Food']",The New York Times,Dining,1636
You Can’t Fight City Hall. But Maybe You Can Fight Google.,2020-03-10,article,News,,"['Computers and the Internet', 'Privacy', 'Politics and Government', 'Sensors', 'Area Planning and Renewal']",The New York Times,Foreign,1412
"‘Recollections of My Nonexistence,’ By Rebecca Solnit: An Excerpt",2020-03-10,article,Review,,['Books and Literature'],The New York Times,BookReview,702
Man Who Threatened to ‘Put a Bullet’ in Ilhan Omar Is Sentenced to a Year in Prison,2020-03-10,article,News,,['Terrorism'],The New York Times,Express,721
Remote Learning Comes to America as Coronavirus Shuts Schools,2020-03-10,multimedia,Interactive Feature,,"['Coronavirus (2019-nCoV)', 'Education (K-12)', 'Science and Technology']",The New York Times,U.S.,0
"How Outdoor Voices, a Start-Up Darling, Imploded",2020-03-10,article,News,,"['Fashion and Apparel', 'Shopping and Retail', 'Venture Capital', 'Appointments and Executive Changes', 'Layoffs and Job Reductions', 'Women and Girls']",The New York Times,Business,1838
A Vintage Bash for All Things Burgundy,2020-03-10,article,News,,"['Wines', 'Parties (Social)']",The New York Times,Dining,1571
"Weinstein Appealed to Bezos and Bloomberg for Help, Documents Show",2020-03-10,article,News,,"['Sexual Harassment', 'Sex Crimes', 'Movies']",The New York Times,Metro,1281
"Citing Coronavirus, Ivy League Cancels Basketball Tournaments",2020-03-10,article,News,,['Basketball (College)'],The New York Times,Sports,1331
"When a Teammate Collapsed, the St. Louis Blues Reeled. Then They Rallied.",2020-03-10,article,News,,"['Hockey, Ice']",The New York Times,Sports,839
"Intelligence Officials Temper Russia Warnings, Prompting Accusations of Political Influence",2020-03-10,article,News,,"['Russian Interference in 2016 US Elections and Ties to Trump Associates', 'United States Politics and Government', 'Presidential Election of 2020', 'Cyberwarfare and Defense', 'Classified Information and State Secrets', 'Espionage and Intelligence Services']",The New York Times,Washington,813
How to Heal a Sad Body? Dancing Never Hurts,2020-03-10,article,News,,['Dancing'],The New York Times,Culture,1129
The Ceramics Designer Inspired by 20th-Century Drawings of Brain Cells,2020-03-10,article,News,,"['Ceramics and Pottery', 'Tables', 'Lamps and Lampshades', 'Furniture']",The New York Times,TStyle,367
California Cracks Down on Alternative Health Plans,2020-03-10,article,News,,"['Health Insurance and Managed Care', 'Consumer Protection', 'Regulation and Deregulation of Industry', 'ADVERTISING AND MARKETING', 'Patient Protection and Affordable Care Act (2010)', 'your-feed-healthcare']",The New York Times,Science,629
"House Can See Mueller’s Secret Grand Jury Evidence, Appeals Court Rules",2020-03-10,article,News,,"['Special Prosecutors (Independent Counsel)', 'Russian Interference in 2016 US Elections and Ties to Trump Associates', 'United States Politics and Government', 'Decisions and Verdicts']",The New York Times,Washington,1078
"F.D.A. Halts Overseas Inspections of Drugs and Devices, Citing Coronavirus",2020-03-10,article,News,,"['Drugs (Pharmaceuticals)', 'Coronavirus (2019-nCoV)', 'Medical Devices', 'your-feed-healthcare']",The New York Times,Science,856
‘We Are Like Animals’: Inside Greece’s Secret Site for Migrants,2020-03-10,article,News,,"['Immigration Detention', 'Middle East and Africa Migrant Crisis', 'Politics and Government', 'Refugees and Displaced Persons', 'Asylum, Right of', 'Immigration and Emigration', 'Video Recordings, Downloads and Streaming', 'Deaths (Fatalities)']",The New York Times,Foreign,1779
"Why Didn’t Saturn Eat Titan, Its Biggest Moon?",2020-03-10,article,News,,"['Space and Astronomy', 'Saturn (Planet)', 'Planets', 'Titan (Saturn Moon)', 'Solar System', 'Research']",The New York Times,Science,654
"For 4 Days, the Hospital Thought He Had Just Pneumonia. It Was Coronavirus.",2020-03-10,article,News,,"['Coronavirus (2019-nCoV)', 'Quarantines', 'Epidemics']",The New York Times,Metro,1484
Cleveland’s J.C. Tretter Elected President of N.F.L. Union,2020-03-10,article,News,,"['Football', 'Organized Labor']",The New York Times,Sports,951
Should I Watch the Prequel to ‘Breaking Bad’ First?,2020-03-10,article,News,,['Television'],The New York Times,Arts&Leisure,931
‘Containment Area’ Is Ordered for New Rochelle Coronavirus Cluster,2020-03-10,article,News,,"['Coronavirus (2019-nCoV)', 'Epidemics', 'Shutdowns (Institutional)', 'Synagogues', 'Quarantines', 'Elderly', 'Nursing Homes']",The New York Times,Metro,1161
Colleges and Universities Cancel Classes and Move Online Amid Coronavirus Fears,2020-03-10,article,News,,"['Quarantines', 'Colleges and Universities', 'Coronavirus (2019-nCoV)']",The New York Times,National,1771
Kansas City’s Mayor Was Turned Away When He Tried to Vote,2020-03-10,article,News,,"['Primaries and Caucuses', 'Presidential Election of 2020']",The New York Times,Politics,549
Looking for a Cozy Refuge From Coronavirus Talk? Stay Offline,2020-03-10,article,News,,"['Coronavirus (2019-nCoV)', 'Social Media']",The New York Times,Styles,530
The Media. Young Voters. Sanders Spreads the Blame for His Decline.,2020-03-10,article,News,,"['Presidential Election of 2020', 'Primaries and Caucuses', 'Endorsements']",The New York Times,Politics,1405
Tiny Love Stories: ‘Our Second Baby Turned Us Into Business Partners’,2020-03-10,article,News,,"['Love (Emotion)', 'Modern Love (Times Column)', 'Dating and Relationships']",The New York Times,Styles,482
How Your Airbnb Host Is Feeling the Pain of the Coronavirus,2020-03-10,article,News,,"['Coronavirus (2019-nCoV)', 'Travel Warnings', 'Travel and Vacations', 'Hotels and Travel Lodgings', 'Renting and Leasing (Real Estate)', 'Real Estate and Housing (Residential)', 'Computers and the Internet', 'Initial Public Offerings']",The New York Times,Business,1371
First Coronavirus Death in New Jersey: Yonkers Raceway Worker,2020-03-10,article,News,,"['Coronavirus (2019-nCoV)', 'Deaths (Fatalities)']",The New York Times,Metro,1025
A Portrait of the Artist as a Young Woman on the Road to Happiness,2020-03-10,article,Review,,['Books and Literature'],The New York Times,Culture,995
"Venezuelan Opposition, Trying to Rekindle Protests, Is Pushed Back by Tear Gas",2020-03-10,article,News,,[],The New York Times,Foreign,515
"Xi Jinping in Wuhan, Coronavirus, Putin: Your Wednesday Briefing",2020-03-10,article,briefing,,[],The New York Times,NYTNow,1431
A Second Life for Flowers,2020-03-10,article,Op-Ed,,"['Flowers and Plants', 'Therapy and Rehabilitation', 'Disabilities', 'Elderly']",The New York Times,OpEd,1386
"Devoted to Bernie Sanders, but if He’s Not the Nominee …",2020-03-10,article,Letter,,"['Presidential Election of 2020', 'Income Inequality']",The New York Times,Letters,477
"As Coronavirus Worries Grow, Biden and Sanders Have Kept Shaking Hands",2020-03-10,article,News,,"['Presidential Election of 2020', 'Coronavirus (2019-nCoV)', 'United States Politics and Government', 'Voting and Voters', 'Hygiene and Cleanliness', 'Primaries and Caucuses']",The New York Times,Politics,875
The Artists Are in Charge. Step 1: Upend the Status Quo.,2020-03-10,article,News,,['Dancing'],The New York Times,Arts&Leisure,1623
Different Ways of Coping With the Coronavirus,2020-03-10,article,Letter,,['Coronavirus (2019-nCoV)'],The New York Times,Letters,397
Why Tonight’s Primary Results Are So Important for Bernie Sanders,2020-03-10,article,News,,"['Primaries and Caucuses', 'Presidential Election of 2020', 'Polls and Public Opinion']",The New York Times,Upshot,686
Sanders and Biden Cancel Events as Coronavirus Fears Upend Primary,2020-03-10,article,News,,"['Coronavirus (2019-nCoV)', 'Primaries and Caucuses', 'Presidential Election of 2020', 'United States Politics and Government']",The New York Times,Politics,1399
Travel and the Coronavirus: Answers to Your Top Questions,2020-03-10,article,News,,"['Travel and Vacations', 'Coronavirus (2019-nCoV)', 'Quarantines', 'AIRLINES AND AIRPLANES', 'Cruises']",The New York Times,Travel,3111
Allegations Against Plácido Domingo Deemed Credible by L.A. Opera,2020-03-10,article,News,,"['Opera', 'Sexual Harassment']",The New York Times,Culture,882
Latest Wells Fargo Chief Promises to Reform ‘Broken’ Culture,2020-03-10,article,News,,"['Banking and Financial Institutions', 'Consumer Protection', 'Boards of Directors', 'Appointments and Executive Changes', 'Regulation and Deregulation of Industry']",The New York Times,Business,692
A Chicken Biryani Recipe That Brings People Together,2020-03-10,article,News,,"['Food', 'Recipes', 'Cooking and Cookbooks', 'Indian Food (Cuisine)']",The New York Times,TStyle,671
Trump to Meet Bank Executives Amid Market Turmoil,2020-03-10,article,News,,"['Banking and Financial Institutions', 'Coronavirus (2019-nCoV)', 'United States Politics and Government', 'Credit and Debt']",The New York Times,Business,1120
Afghan President Orders Taliban Prisoner Release,2020-03-10,article,News,,[],The New York Times,Foreign,1102
"Live Primary Election Results: Michigan, Washington and More",2020-03-10,multimedia,Interactive Feature,,"['Elections', 'Presidential Election of 2020', 'Primaries and Caucuses']",The New York Times,U.S.,0
Live Analysis: Presidential Primary Election Results,2020-03-10,multimedia,Interactive Feature,,"['Elections', 'Presidential Election of 2020', 'Primaries and Caucuses']",The New York Times,U.S.,0
"Jamey Gambrell Dies at 65; Made Russian Writing Sing, in English",2020-03-10,article,Obituary (Obit),,"['Deaths (Obituaries)', 'Translation and Interpreters', 'Russian Language', 'Writing and Writers', 'Books and Literature']",The New York Times,Obits,847
Economic Prescription for Coronavirus: ‘You’ve Got to Go Fast’,2020-03-10,article,News,,"['Coronavirus (2019-nCoV)', 'United States Economy', 'Recession and Depression', 'Federal Taxes (US)', 'United States Politics and Government', 'Payroll Tax']",The New York Times,Business,1577
