headline,date,doc_type,material_type,section,keywords,source,news_desk,word_count
Facebook Could Block Sharing of News Stories in Australia,2020-09-01,article,News,,"['Computers and the Internet', 'News and News Media', 'Social Media', 'Regulation and Deregulation of Industry', 'Rumors and Misinformation', 'Search Engines', 'Law and Legislation']",The New York Times,Business,1079
Unwitting Progressives for Trump,2020-09-01,article,Op-Ed,,"['George Floyd Protests (2020)', 'Demonstrations, Protests and Riots', 'Presidential Election of 2020', 'Black Lives Matter Movement', 'Looting (Crime)', 'Race and Ethnicity', 'Police Brutality, Misconduct and Shootings', 'Monuments and Memorials (Structures)']",The New York Times,OpEd,895
"‘We Germans,’ Alexander Starritt by the Author: An Excerpt",2020-09-01,article,Review,,[],The New York Times,BookReview,2357
A Long History of Language That Incites and Demonizes,2020-09-01,article,News,,"['George Floyd Protests (2020)', 'Demonstrations, Protests and Riots', 'Presidential Election of 2020', 'Antifa Movement (US)', 'Black Lives Matter Movement', 'Police Brutality, Misconduct and Shootings', 'United States Politics and Government', 'Black People', 'Blacks', 'Charlottesville, Va, Violence (August, 2017)', 'Republican National Convention']",The New York Times,Washington,923
Trump Defends Kyle Rittenhouse,2020-09-01,multimedia,Video,,"['United States Politics and Government', 'Demonstrations, Protests and Riots', 'Murders, Attempted Murders and Homicides']",The New York Times,,0
One of the Candidates Cheers Violence. It’s Not Biden.,2020-09-01,article,Op-Ed,,"['Presidential Election of 2020', 'George Floyd Protests (2020)', 'United States Politics and Government', 'Polls and Public Opinion', 'Demonstrations, Protests and Riots', 'Fringe Groups and Movements', 'Whites', 'Terrorism', 'Vandalism', 'Voting and Voters', 'Black Lives Matter Movement', 'Republican National Convention']",The New York Times,OpEd,977
Unable to Decide,2020-09-01,article,News,,['Crossword Puzzles'],The New York Times,Games,760
"Quotation of the Day: In Command: The Few, the Proud, the White",2020-09-01,article,Quote,,[],The New York Times,Summary,55
"Corrections: Sept. 1, 2020",2020-09-01,article,Correction,,[],The New York Times,Corrections,304
How the Fatal Shooting at a Portland Protest Unfolded,2020-09-01,article,News,,"['Demonstrations, Protests and Riots', 'Murders, Attempted Murders and Homicides', 'George Floyd Protests (2020)', 'Black Lives Matter Movement', 'Video Recordings, Downloads and Streaming', 'Fringe Groups and Movements']",The New York Times,Video,711
"Germany’s Far Right, ‘Hotel Rwanda,’ Spain: Your Tuesday Briefing",2020-09-01,article,briefing,,[],The New York Times,NYTNow,1590
Los Angeles Sheriff’s Deputies Fatally Shoot a Black Man They Say Had a Gun,2020-09-01,article,News,,"['Police Reform', 'George Floyd Protests (2020)', 'Black Lives Matter Movement', 'Black People', 'Blacks', 'Police Brutality, Misconduct and Shootings', 'Demonstrations, Protests and Riots']",The New York Times,Express,812
Walmart Announces Membership Service in Attempt to Compete With Amazon,2020-09-01,article,News,,"['Shopping and Retail', 'E-Commerce', 'Delivery Services']",The New York Times,Business,484
What Belarusians Can Learn From Poland,2020-09-01,article,Op-Ed,,"['Strikes', 'Demonstrations, Protests and Riots', 'Freedom of the Press', 'Police Brutality, Misconduct and Shootings', 'Human Rights and Human Rights Violations']",The New York Times,OpEd,1097
Samsung Heir Is Indicted but Avoids Jail,2020-09-01,article,News,,"['Mergers, Acquisitions and Divestitures', 'Securities and Commodities Violations', 'Stocks and Bonds']",The New York Times,Business,927
"From the Seabed, Figures of an Ancient Cult",2020-09-01,article,News,,"['Shipwrecks (Historic)', 'ARCHAEOLOGY AND ANTHROPOLOGY', 'your-feed-science']",The New York Times,Science,723
These Scientists Are Giving Themselves D.I.Y. Coronavirus Vaccines,2020-09-01,article,News,,"['Coronavirus (2019-nCoV)', 'Vaccination and Immunization', 'Clinical Trials', 'Research', 'Antibodies', 'Suits and Litigation (Civil)', 'Regulation and Deregulation of Industry', 'Ethics and Official Misconduct', 'your-feed-healthcare']",The New York Times,Science,1888
"The Best Movies and TV Shows New to Netflix, Amazon and Stan in Australia in September",2020-09-01,article,News,,"['Television', 'Movies']",The New York Times,Foreign,1702
Emma Cline Knows First World Problems,2020-09-01,article,Review,,['Books and Literature'],The New York Times,BookReview,1054
The Battleground States Biden and Trump Need to Win 270,2020-09-01,multimedia,Interactive Feature,,"['Elections', 'Presidential Election of 2020', 'Electoral College']",The New York Times,U.S.,0
"‘In a World That Shouts, This Book Is a Song Played Softly,’ Ethan Hawke Writes",2020-09-01,article,Review,,['Books and Literature'],The New York Times,BookReview,651
"This 84-Year-Old Gamer Has More Than 900,000 ‘Grandkids’",2020-09-01,article,News,,['Computer and Video Games'],The New York Times,Styles,1080
A Salvadoran-American Assembles the Fragments of a Violent Cultural History,2020-09-01,article,Review,,"['Books and Literature', 'Salvadoran-Americans', 'War Crimes, Genocide and Crimes Against Humanity', 'Immigration and Emigration']",The New York Times,BookReview,1266
‘Sudden’ Cardiac Arrests Often Aren’t So Sudden,2020-09-01,article,News,,"['Hospitals', 'Heart']",The New York Times,Well,228
"Afraid of a Lurking Evil, a Writer Goes Down the Rabbit Hole",2020-09-01,article,Review,,['Books and Literature'],The New York Times,BookReview,1074
This Year Is Complicated. Three New Novels Remind Us the Past Was No Picnic Either.,2020-09-01,article,Review,,['Books and Literature'],The New York Times,BookReview,1010
"New & Noteworthy, From Netflix to Writers’ Writers",2020-09-01,article,News,,['Books and Literature'],The New York Times,BookReview,382
"Tested by Tragedy, Two Politicians Review Their Records — Mistakes Included",2020-09-01,article,Review,,"['Books and Literature', 'Newtown, Conn, Shooting (2012)', 'Gun Control', 'Mass Shootings', 'Demonstrations, Protests and Riots', 'Charlottesville, Va, Violence (August, 2017)', 'United States Politics and Government']",The New York Times,BookReview,1213
You’re Going to Want to Join this Odyssey Through Postwar Japan,2020-09-01,article,News,,['Books and Literature'],The New York Times,BookReview,867
"Set in Uganda, This Coming-of-Age Story Contains Universal Themes",2020-09-01,article,Review,,['Books and Literature'],The New York Times,BookReview,757
When America’s Cold War Strategy Turned Corrupt,2020-09-01,article,Review,,"['Books and Literature', 'Espionage and Intelligence Services', 'Cold War Era']",The New York Times,BookReview,1284
"Torn Between War and Art, a Journalist Chooses Both",2020-09-01,article,Review,,['Books and Literature'],The New York Times,BookReview,558
Where Is America’s Groundbreaking Covid-19 Research?,2020-09-01,article,Op-Ed,,"['Coronavirus (2019-nCoV)', 'Clinical Trials', 'Research']",The New York Times,OpEd,1181
Elena Ferrante Returns With ‘The Lying Life of Adults’,2020-09-01,article,Review,,['Books and Literature'],The New York Times,BookReview,1543
2020 U.S. Open: What to Watch on Tuesday,2020-09-01,article,News,,"['United States Open (Tennis)', 'Tennis']",The New York Times,Sports,1367
Trump Creates His Own ‘Deep State’,2020-09-01,article,Op-Ed,,"['Espionage and Intelligence Services', 'United States Politics and Government']",The New York Times,OpEd,1190
9 Major N.Y.C. Roads Get Lower Speed Limits as Traffic Deaths Surge,2020-09-01,article,News,,"['Traffic Accidents and Safety', 'Drunken and Reckless Driving', 'Coronavirus (2019-nCoV)', 'Roads and Traffic', 'Deaths (Fatalities)']",The New York Times,Metro,1217
New York City Delays Start of School to Ready for In-Person Classes,2020-09-01,article,News,,"['Coronavirus Reopenings', 'Education (K-12)', 'Shutdowns (Institutional)', 'Teachers and School Employees']",The New York Times,Metro,1782
We’re All Socially Awkward Now,2020-09-01,article,Op-Ed,,"['Loneliness', 'Coronavirus (2019-nCoV)', 'Quarantines', 'Social Conditions and Trends']",The New York Times,OpEd,1318
What We Learned From the R.N.C.,2020-09-01,article,News,,"['Presidential Election of 2020', 'Voting and Voters', 'Republican National Convention']",The New York Times,Summary,987
Why Alyssa Cole Put Romance Aside and Wrote a Thriller About Gentrification,2020-09-01,article,News,,"['Books and Literature', 'Writing and Writers', 'Gentrification', 'Black People', 'Blacks', 'Race and Ethnicity']",The New York Times,Weekend,1354
How to Stop the Next Pandemic,2020-09-01,multimedia,Video,,"['Coronavirus (2019-nCoV)', 'Nipah Virus', 'Lyme Disease', 'SARS (Severe Acute Respiratory Syndrome)', 'Wildlife Trade and Poaching', 'Epidemics', 'Forests and Forestry', 'Biodiversity', 'Land Use Policies']",The New York Times,,0
Young People Are Fighting Hunger and Finding Purpose,2020-09-01,article,News,,"['Food', 'Food Insecurity', 'Coronavirus (2019-nCoV)', 'Empathy', 'Volunteers and Community Service', 'Youth', 'Teenagers and Adolescence']",The New York Times,Well,1183
Who’s to Blame for the Pandemic?,2020-09-01,article,News Analysis,,"['Coronavirus (2019-nCoV)', 'Quarantines', 'Politics and Government', 'ANIMALS', 'Documentary Films and Programs', 'Population', 'Polls and Public Opinion']",The New York Times,Video,805
"As Guns Get Drawn at Protest Sites, Demonstrators Fear a Volatile New Phase",2020-09-01,article,News,,"['George Floyd Protests (2020)', 'Black Lives Matter Movement', 'Demonstrations, Protests and Riots', 'Murders, Attempted Murders and Homicides', 'Fringe Groups and Movements']",The New York Times,National,1732
Virtual Tours Are Here to Stay. This Is How to Do Them Right.,2020-09-01,article,News,,"['Real Estate and Housing (Residential)', 'Real Estate Brokers', 'Content Type: Service', 'Video Recordings, Downloads and Streaming', 'Quarantine (Life and Culture)', '3-D Devices and Effects']",The New York Times,RealEstate,1171
Help! What Are the Best Precautions When Traveling by Car?,2020-09-01,article,News,,"['Road Trips', 'Coronavirus Risks and Safety Concerns', 'Travel and Vacations', 'Content Type: Service', 'Bathrooms and Toilets', 'Hygiene and Cleanliness', 'Hotels and Travel Lodgings', 'Restaurants']",The New York Times,Business,1046
"What It Took to Free a Whale Entangled in 4,000 Pounds of Fishing Gear",2020-09-01,article,News,,"['Whales and Whaling', 'Endangered and Extinct Species']",The New York Times,Metropolitan,1119
Small-Business Failures Loom as Federal Aid Dries Up,2020-09-01,article,News,,"['Small Business', 'Coronavirus (2019-nCoV)', 'Shutdowns (Institutional)', 'Coronavirus Aid, Relief, and Economic Security Act (2020)', 'Stimulus (Economic)', 'United States Economy', 'Federal Aid (US)']",The New York Times,Business,1409
The Many Sides to Dan Brown,2020-09-01,article,News,,"['Writing and Writers', 'Books and Literature', 'Classical Music', 'Dressage (Equestrian Sport)', 'Divorce, Separations and Annulments']",The New York Times,Styles,2171
Trump Needs His Own Sister Souljah Moment,2020-09-01,article,Op-Ed,,"['George Floyd Protests (2020)', 'Presidential Election of 2020', 'Police Brutality, Misconduct and Shootings', 'Black Lives Matter Movement', 'United States Politics and Government', 'Polls and Public Opinion', 'Demonstrations, Protests and Riots', 'Black People', 'Blacks']",The New York Times,OpEd,1089
The State Fair Is Canceled. Deep-Fried Oreos Are Not.,2020-09-01,article,News,,"['State and County Fairs', 'Food Trucks and Vendors', 'Summer (Season)', 'Food', 'Restaurants', 'Shutdowns (Institutional)', 'Quarantine (Life and Culture)']",The New York Times,Dining,1673
The Forgotten Colonial Forces of World War II,2020-09-01,article,News,,"['Defense and Military Forces', 'World War II (1939-45)', 'Colonization', 'Secession and Independence Movements']",The New York Times,SpecialSections,1319
‘Fixing the Damage We’ve Done’: Rewilding Jaguars in Argentina,2020-09-01,article,News,,"['Jaguars', 'Endangered and Extinct Species', 'Conservation of Resources', 'Wetlands', 'ANIMALS', 'Wildlife Sanctuaries and Nature Reserves', 'National Parks, Monuments and Seashores']",The New York Times,Foreign,1248
‘I Am Stuck Until That Border Opens’: Marooned in Paradise,2020-09-01,article,News,,"['Coronavirus (2019-nCoV)', 'Quarantines']",The New York Times,National,1049
"‘The Quiet Americans,’ by Scott Anderson: An Excerpt",2020-09-01,article,Review,,[],The New York Times,BookReview,3142
"‘Fifty Words for Rain,’ by Asha Lemmie: An Excerpt",2020-09-01,article,Review,,[],The New York Times,BookReview,3037
"C.D.C. Halts Evictions, Citing Covid-19 Risks",2020-09-01,article,News,,['Coronavirus (2019-nCoV)'],The New York Times,Foreign,5014
Coronavirus in N.Y.C.: Why the Wealthy Get Quick Test Results,2020-09-01,article,briefing,,"['Coronavirus (2019-nCoV)', 'Tests (Medical)', 'Colleges and Universities', 'Quarantine (Life and Culture)']",The New York Times,Metro,1191
"As summer wanes and federal aid winds down, small businesses are in jeopardy.",2020-09-01,article,News,,[],The New York Times,Business,203
Joe Biden’s Rebuttal,2020-09-01,article,News,,"['Black Lives Matter Movement', 'Presidential Election of 2020', 'Demonstrations, Protests and Riots']",The New York Times,Podcasts,381
Nick Flynn and Lili Taylor’s Red Hook Retreat,2020-09-01,multimedia,Slideshow,,"['Quarantine (Life and Culture)', 'Real Estate and Housing (Residential)']",The New York Times,Real Estate,0
Bird-Watching With Nick Flynn and Lili Taylor,2020-09-01,article,News,,['Real Estate and Housing (Residential)'],The New York Times,RealEstate,1200
America’s Death Gap,2020-09-01,article,briefing,,[],The New York Times,NYTNow,1682
Tit for Tat for TikTok,2020-09-01,article,News,,"['United States International Relations', 'Mergers, Acquisitions and Divestitures']",The New York Times,Business,1633
Biden Lashes Back at Trump,2020-09-01,article,News,,['Presidential Election of 2020'],The New York Times,Politics,1467
University of South Carolina Cracks Down on Greek Houses for Virus Violations,2020-09-01,article,News,,"['Colleges and Universities', 'Fraternities and Sororities', 'Coronavirus (2019-nCoV)', 'School Discipline (Students)', 'Shutdowns (Institutional)', 'Quarantines', 'Parties (Social)', 'Tests (Medical)']",The New York Times,Express,588
Massachusetts Primary Elections: What to Watch For,2020-09-01,article,News,,"['Elections, Senate', 'Elections, House of Representatives', 'United States Politics and Government', 'Primaries and Caucuses', 'Presidential Election of 2020']",The New York Times,Politics,509
A House panel plans to subpoena Louis DeJoy over mail delays and his Trump communications.,2020-09-01,article,News,,[],The New York Times,Politics,395
"The flood of Trump books keeps coming, and readers can’t stop buying them.",2020-09-01,article,News,,[],The New York Times,Politics,336
Trump has a long history of language that incites and demonizes.,2020-09-01,article,News,,[],The New York Times,Politics,237
The president’s trip represents a consequential political bet.,2020-09-01,article,News,,[],The New York Times,Politics,434
Biden hit firmly back at Trump. Will he now take that message on the road?,2020-09-01,article,News,,[],The New York Times,Politics,240
"‘Transcendent Kingdom,’ by Yaa Gyasi: An Excerpt",2020-09-01,article,Review,,[],The New York Times,BookReview,1244
How to Read the Air Quality Index,2020-09-01,article,briefing,,"['Air Pollution', 'Wildfires']",The New York Times,National,1277
"‘Robin’s Wish’ Review: Celebrating a Life, Highlighting a Disease",2020-09-01,article,Review,,"['Documentary Films and Programs', 'Dementia']",The New York Times,Weekend,285
"Determined to Salvage the Fall, Cabaret Plots Its (Outdoor, Online) Return",2020-09-01,article,News,,"['Pop and Rock Music', 'Theater', 'Bars and Nightclubs', 'Coronavirus Reopenings', 'Coronavirus (2019-nCoV)']",The New York Times,Culture,1333
Recent Commercial Real Estate Transactions,2020-09-01,article,News,,"['Real Estate and Housing (Residential)', 'Real Estate (Commercial)']",The New York Times,Business,188
"In Coming Wave of Pandemic-Induced Vacancies, Some See Opportunity",2020-09-01,article,News,,"['Real Estate (Commercial)', 'Real Estate and Housing (Residential)', 'Coronavirus (2019-nCoV)', 'Building (Construction)', 'Area Planning and Renewal']",The New York Times,Business,1206
A Parent’s Toughest Call: In-Person Schooling or Not?,2020-09-01,article,News,,"['your-feed-science', 'Coronavirus Reopenings', 'Pediatric Inflammatory Multisystem Syndrome (PIMS)', 'Education (K-12)', 'Coronavirus (2019-nCoV)', 'Parenting', 'Children and Childhood', 'Masks', 'Shutdowns (Institutional)']",The New York Times,Science,1514
A Beginner’s Guide to Elena Ferrante,2020-09-01,multimedia,Interactive Feature,,['Books and Literature'],The New York Times,Books,0
Love Theater? Jesse Green Recommends Streaming Options,2020-09-01,article,News,,"['Theater', 'Video Recordings, Downloads and Streaming']",The New York Times,Arts&Leisure,800
Reflections on Our Summer Reading Contest and Our Final Week of Winners,2020-09-01,article,News,,[],The New York Times,Learning,1968
The Best Movies and TV Shows Coming to Netflix in November,2020-09-01,article,News,,"['Television', 'Movies', 'Documentary Films and Programs']",The New York Times,Culture,1000
Trump Administration Promise to Focus on Extremism Remains Unfulfilled,2020-09-01,article,News,,"['Black Lives Matter Movement', 'Demonstrations, Protests and Riots', 'Antifa Movement (US)', 'Federal-State Relations (US)', 'Local Government', 'Whites', 'Fringe Groups and Movements', 'Terrorism', 'Presidential Election of 2020', 'United States Politics and Government']",The New York Times,Washington,1350
How to Submit a Modern Love Essay,2020-09-01,article,News,,"['Love (Emotion)', 'Writing and Writers', 'Dating and Relationships', 'Modern Love (Times Column)', 'Sex', 'Families and Family Life', 'Polyamory and Non-Monogamous Relationships']",The New York Times,Styles,493
Graham Company to Draw on Deep Archives for Its Coming Season,2020-09-01,article,News,,['Dancing'],The New York Times,Culture,376
Face Shields and Valved Masks Offer More Comfort but Less Protection,2020-09-01,article,News,,"['Masks', 'Coronavirus Risks and Safety Concerns', 'Protective Clothing and Gear', 'Content Type: Service', 'Coughs', 'Coronavirus (2019-nCoV)']",The New York Times,Well,1340
"Remembering Riley Gale of Power Trip, a Thrash Titan",2020-09-01,article,News,,['Pop and Rock Music'],The New York Times,Culture,145
Guisado on Sunset,2020-09-01,multimedia,Video,,[],The New York Times,,0
U.S.-Russia Military Tensions Intensify in the Air and on the Ground Worldwide,2020-09-01,article,News,,"['United States Defense and Military Forces', 'Defense and Military Forces', 'Military Aircraft', 'United States International Relations', 'United States Politics and Government']",The New York Times,Washington,1260
"Explore which combinations of states would give Trump, or Biden, a victory.",2020-09-01,article,News,,[],The New York Times,Politics,62
Why the Coronavirus More Often Strikes Children of Color,2020-09-01,article,News,,"['your-feed-science', 'Pediatric Inflammatory Multisystem Syndrome (PIMS)', 'Black People', 'Blacks', 'Children and Childhood', 'Coronavirus Risks and Safety Concerns', 'Coronavirus (2019-nCoV)', 'Race and Ethnicity', 'Obesity', 'Hispanic-Americans', 'Deaths (Fatalities)', 'Infections', 'Whites', 'Medicine and Health']",The New York Times,Science,1369
"Roanoke’s ‘Lost Colony’ Was Never Lost, New Book Says",2020-09-01,article,News,,"['Books and Literature', 'Colonization', 'Native Americans', 'ARCHAEOLOGY AND ANTHROPOLOGY']",The New York Times,Science,1190
"To Play Poker in a Pandemic, Americans Flee the U.S.",2020-09-01,article,News,,"['Computers and the Internet', 'Poker (Card Game)', 'World Series of Poker', 'Cards and Card Games', 'Coronavirus (2019-nCoV)', 'Gambling', 'Casinos', 'Travel and Vacations']",The New York Times,Sports,1885
FIFA Is Warned That Banning Top Games in U.S. May Breach Antitrust Laws,2020-09-01,article,News,,"['Soccer', 'Corruption (Institutional)', 'Antitrust Laws and Competition Issues', 'Suits and Litigation (Civil)']",The New York Times,Sports,953
"Tootie Robbins, Lineman With Cardinals and Packers, Dies at 62",2020-09-01,article,Obituary (Obit),,"['Deaths (Obituaries)', 'Coronavirus (2019-nCoV)', 'Football']",The New York Times,Obits,556
"As Food Deliveries Boom, So Do Ghost Kitchens",2020-09-01,article,News,,"['Restaurants', 'Delivery Services', 'Quarantine (Life and Culture)', 'Kitchens']",The New York Times,Dining,1326
"For Teachers and Parents, a School Season of Fear and Anxiety",2020-09-01,article,Letter,,"['Education (K-12)', 'Coronavirus (2019-nCoV)', 'Teachers and School Employees', 'Child Care']",The New York Times,Letters,752
"Biden Expected to Surpass $300 Million Raised in August, Shattering Record",2020-09-01,article,News,,"['Presidential Election of 2020', 'Campaign Finance', 'United States Politics and Government']",The New York Times,Politics,762
"Trump Visits Kenosha, Offering Support for Police With Little Mention of Shooting",2020-09-01,article,News,,"['Police Brutality, Misconduct and Shootings', 'Black Lives Matter Movement', 'Demonstrations, Protests and Riots', 'Conspiracy Theories', 'Presidential Election of 2020', 'United States Politics and Government']",The New York Times,Washington,1870
"Meet Stephanie Winston Wolkoff, Who Released the Melania Trump Tapes",2020-09-01,article,News,,"['United States Politics and Government', 'Fashion and Apparel', 'First Ladies (US)', 'your-feed-fashion']",The New York Times,Styles,1578
"In Lebanon, Macron Dangles Sanctions to Push for Change",2020-09-01,article,News,,"['Beirut, Lebanon, Explosions (2020)', 'Corruption (Institutional)']",The New York Times,Foreign,908
Trump’s claim that ‘thugs’ in ‘black uniforms’ were planning attack echoes far-right social media posts.,2020-09-01,article,News,,[],The New York Times,Politics,470
What Our Reporter Is Seeing on the Ground in Kenosha,2020-09-01,multimedia,Interactive Feature,,[],The New York Times,U.S.,0
Yes to Tech Optimism. And Pessimism.,2020-09-01,article,News,,"['Computers and the Internet', 'Mobile Applications']",The New York Times,NewsDesk,1236
Barr Imposes Limits on F.B.I. Surveillance of Political Candidates,2020-09-01,article,News,,"['Surveillance of Citizens by Government', 'Russian Interference in 2016 US Elections and Ties to Trump Associates', 'Wiretapping and Other Eavesdropping Devices and Methods', 'Foreign Intelligence Surveillance Act (FISA)', 'Espionage and Intelligence Services', 'United States Politics and Government', 'Presidential Election of 2020']",The New York Times,Washington,650
Her Town Depended on the Mill. Was It Also Making the Residents Sick?,2020-09-01,article,Review,,"['Books and Literature', 'Dioxin', 'Paper and Pulp', 'Hazardous and Toxic Substances', 'Cancer', 'Factories and Manufacturing']",The New York Times,BookReview,1379
Schools Reopen Around the World Despite Coronavirus Spread,2020-09-01,multimedia,Video,,"['Coronavirus (2019-nCoV)', 'Quarantines']",The New York Times,,0
‘I Hate New York’ Review: The Club Kids Are Still Standing,2020-09-01,article,Review,,"['Documentary Films and Programs', 'Transgender and Transsexuals', 'Acquired Immune Deficiency Syndrome']",The New York Times,Weekend,334
Kenosha closes streets and halts trains as it prepares for Trump’s visit.,2020-09-01,article,News,,[],The New York Times,Politics,217
Watch Full Video: Mnuchin Testifies Before House Coronavirus Panel,2020-09-01,multimedia,Video,,"['Coronavirus (2019-nCoV)', 'United States Economy', 'Quarantines', 'Stimulus (Economic)', 'Coronavirus Aid, Relief, and Economic Security Act (2020)', 'United States Politics and Government']",The New York Times,,0
When the Forms Don’t Fit Your Family,2020-09-01,article,News,,"['Children and Childhood', 'ADOPTIONS', 'Education (K-12)', 'Parenting', 'Homosexuality and Bisexuality', 'Families and Family Life', 'Women and Girls', 'Day Care Centers']",The New York Times,Parenting,1453
Senator Pat Toomey: What Economic Freedom Means,2020-09-01,article,Letter,,"['United States Economy', 'Absentee Voting', 'Presidential Election of 2020', 'United States Politics and Government']",The New York Times,Letters,429
"For Simone and Max Rocha, Family Has Always Been a Source of Inspiration",2020-09-01,article,News,,"['Chefs', 'Fashion and Apparel', 'Quarantine (Life and Culture)']",The New York Times,TStyle,941
"Taco Mix FonteNova, With Cemitas, Tacos and More, Opens in the Bronx",2020-09-01,article,News,,"['Quarantine (Life and Culture)', 'Restaurants']",The New York Times,Dining,1041
What to Read Right Now,2020-09-01,multimedia,Interactive Feature,,['Books and Literature'],The New York Times,Books,0
Watch live: Mnuchin calls for ‘additional relief’ for pandemic-induced recession.,2020-09-01,article,News,,[],The New York Times,Business,0
Twitter to Add Context to Trending Topics,2020-09-01,article,News,,"['Rumors and Misinformation', 'Social Media', 'Computers and the Internet', 'Presidential Election of 2020', 'Fringe Groups and Movements', 'Conspiracy Theories']",The New York Times,Business,704
Guisado on Sunset,2020-09-01,multimedia,Interactive Feature,,"['Sundance Film Festival (Park City, Utah)']",The New York Times,Opinion,0
"Across the Globe, Students Head Back to School",2020-09-01,article,News,,"['Coronavirus Reopenings', 'Education (K-12)']",The New York Times,Foreign,791
Turkey Announces Arrest of a Major Islamic State Militant,2020-09-01,article,News,,"['Terrorism', 'Politics and Government', 'Muslims and Islam']",The New York Times,Foreign,620
